,user_links,user_ratings,review_text
224,https://www.goodreads.com/user/show/56728658-marko-bojkovsk,Rating 5 out of 5,"U poslednje vreme mnogo radim i nemam vremena za čitanje, koje je inače ostalo jedina hrana i radost mog bića tako da možete zamislisti u kakvom sam stanju. No, pošto je posao (poslovi zapravo) kojim se bavim intelektualno ne zahtevan ostavlja mi mozak sasvim slobodnim i umesto da se bavim crnim mislima odlučio sam slušati knjige. Nisam to posebno često praktikovao ranije, ali eto sada počeh i super mi je. ""Ubiti pticu rugalicu"" sam takođe odslušao, iako je imam na papiru...Dok sam slušao uglavnom sam mislio koliko je momenat u kome neku knjigu zgrabite bitan, da sam ""Norvešku šumu"" počeo pre samo nekoliko meseci verovatno bi mi bila težak smor, hipstersko onanisanje i tome slično. Avaj, sada, dok ne mislim da mi je život skockan i sav na svom mestu, baš mi je legla. Ja svakako ne čitam zbog zapleta i tog nestrpljivog isčekivanja šta će da bude šta će da bude, pa mi ni ovde ne smeta što je ovo samo komad nekih života nekih mladih skenjanih ljudi koji se beznadežno vuku kroz postojanje ili čak ni to ne uspevaju..."
225,https://www.goodreads.com/user/show/92683067-parnian,Rating 4 out of 5,یک یا دو سال پیش شروع کردمش. ۲۰۰ و خورده ای صفحه خواندم و بعد نیمه رهایش کردم. روندش خیلی کند بود و یکجورهایی مثل سوکورو تازاکی بی رنگ همه چی مربوط به گذشته و درباره‌ی گذشته بود و آرام آرام پیش می‌رفت. تا اینکه چند روز پیش سعی کردم دوباره برش دارم، و دیدم چقدر عاشقش هستم!چقدر ساده در عین حال ملموس و زیبا بود. احساسات انسانی و فوق العاده‌ای که موراکامی توصیف کرده بود قلبم را لمس کرد!فهمیدم بسته به درک آدم است. مثل ۱۳ سالگی که مادام بواری خواندم و بعدش گفتم خدامرگم این چه کتابی بود؟!خب، طول می‌کشد تا آدم بزرگ شود و بفهمد چیزهای پیچیده‌ ای در دنیا هست که از توصیف دختر های خوب حرف گوش کن در چمن زاران زیبا حقیقی تر است. خیلی هم حقیقی تر است.
226,https://www.goodreads.com/user/show/11135517-kike,Rating 5 out of 5,"Un obra sutil, llena de imágenes hermosas y personajes entrañables. Murakami nos cuenta una historia sobre la pérdida de la inocencia, la entrada a la realidad de la adultez, la desilusión sobre los ideales de juventud, todo contado con la música de The Beatles de fondo. Una obra poética, llena de sensibilidad, que te regresa al fin de la adolescencia, a ese momento en que te das cuenta que eres un adulto más en el mundo de adultos al que siempre te resististe pertenecer.Recomendado a todo el mundo."
227,https://www.goodreads.com/user/show/10498385-ahmed-mahmoud-gamal,Rating 5 out of 5,حزين أنها إنتهت مورا كاتبى الأثير
228,https://www.goodreads.com/user/show/64491025-j-jahir,Rating 4 out of 5,"4.5 estrellas.vaya, vaya. no sé por dónde comenzar esta reseña. en primera, decir que me estaba tardando en leer este libro porque es sencillamente magnífico. me gustó mucho y fue agradable conocer el estilo particular de Murakami, o al menos el más sencillo, ya que me han comenzado a decir que en otros libros raya más en lo metafórico y filosófico. aunque le prometí a un amigo leerlo de manera más lenta, se puede decir que lo cumplí en parte, pero tampoco demasiado porque el libro es realmente corto, y el mismo te va envolviendo y quedas atrapado por estos personajes tan singulares y entrañables: toru Watanabe, con esa forma particular de ver la vida, que disfruta la soledad, tiene una forma particular de expresarse y muy inteligente; Midori, una chica que es compañera de él en historia de Teatro y con quien consigue una intimidad emocional increíble, la verdad es que su manera de pensar era muy madura, y me nutrían y disfrutaba las conversaciones que tenía con watanabe, sin malicia, llenas de pensamientos, emociones, psicología e intelecto; Naoko, chica de quien Toru está enamorado pero que carga consigo problemas psicológicos y se lamenta por el amor de su vida, Kizuki. Aún así, antes de todo ello, también era una chica despierta, y con quien nuestro protagonista solía pasarla bien.El libro puede que sea quizás uno de los más sonados y lo cataloguen como el ideal para introducirse al autor, aunque esté más marketinnizado, lo cierto es que debo reconocer que está muy bien escrito. retrata la época de la música de los 70's, incluso el último año de los Beatles. como dato curioso, mencionar que Haruki Murakami se inspiró en la canción de Norwegian wood para ambientar su libro, y lo cierto es que le quedó muy bien. de hecho, es esa canción lo que hace que Watanabe nos lleve a través del recuerdo por esos años de juventud.Lo único que no me gustaba mucho de él es  ese afán de buscar acostarse con otras mujeres, como si fuera algo necesario con el que no pudiese vivir, y más si se hacía estar enamorado de Naoko , aunque en este punto vamos a decir que es muy subjetivo porque yo tengo mi propia forma de pensar en cuanto a ese tema, mas no quiere decir que no sea capaz de entenderlo.Tokio blues es un libro muy dialogado, en cada momento del mismo aparece siempre hablando e interactuando con alguien, tal como todo chico social. Irónicamente, había momentos en los que describía la sensación de soledad, pese a contar con gente que lo apreciaba: su amigo nagasawa, kizuki  cuando estaba vivo , Naoko, Reiko, Midori... A través del diálogo conocemos a cada personaje, ya que ellos mismos nos hacen partícipes de sus historias de vida, sus pensamientos y sentimientos. está demás decir que los de Watanabe los conocemos de sobra, pues además de todo, él es quien nos narra la historia.Y no puedo dejar de comentar este otro aspecto. el libro habla sobre sexo de una manera tan natural y fluida, sin la menor intención de caer en tabú ni mucho menos de tocarlo de una manera vulgar o sucia. No, lo habla como si fuera algo tan común como comer, cepillarse los dientes o dormir. aquí un ejemplo. —¿He llegado demasiado pronto? —preguntó ella—. ¿Te acabas de levantar?—Voy a lavarme la cara y a afeitarme. ¿Me esperas unos quince minutos? —le rogué.—No me importa esperarte, pero, desde hace un rato, no paran de mirarme las piernas.—Normal, ¿no te parece? Presentándote en una residencia de chicos con una falda tan corta... Vamos, te mirarán todos.—No hay problema. Hoy llevo unas bragas muy bonitas. De color rosa, con un encaje precioso.—Peor aún. —Suspiré.Me lavé la cara y me afeité lo más rápido posible. Luego me puse una camisa azul, una chaqueta de tweed gris por encima, bajé y conduje a Midori a la salida de la residencia. Estaba bañado en un sudor frío.—¿Todos los chicos que hay aquí se masturban? —Midori alzó la vista hacia la residencia.—Es probable.—¿Lo hacen pensando en chicas?—Supongo que sí —dije—. No creo que haya ningún hombre que se masturbe pensando en el mercado de valores, en la conjugación de los verbos o en el canal de Suez. Imagino que la mayoría lo hace pensando en mujeres.—¿El canal de Suez?—Por ejemplo.—Es decir, piensan en una chica determinada.—¿Por qué no se lo preguntas a tu novio? —le espeté—. No entiendo a qué viene preguntarme todas estas cosas un domingo por la mañana.—Es simple curiosidad —contestó Midori—. Además, él se enfadaría muchísimo. Dice que las mujeres no tenemos que preguntar estas cosas.—Es una manera de pensar muy correcta.—Pero yo quiero saberlo. ¿Tú, cuando te masturbas, piensas en una chica concreta?—Yo sí. Ahora bien, no tengo ni idea de lo que hacen los demás —me resigné a responder.—¿Y has pensado alguna vez en mí? Dime la verdad. No me enfadaré.—No, nunca, la verdad —le respondí honestamente.—¿Y por qué no? ¿No me encuentras atractiva?—No es eso. Eres atractiva, eres guapa, te gusta provocar.—Entonces, ¿por qué no piensas en mí?—En primer lugar, porque te veo como una amiga y no puedo involucrarte en mis fantasías sexuales. En segundo lugar...—Hay otra persona que está presente en tus pensamientos. —La verdad es que sí —reconocí.—Eres educado incluso en esto —comentó Midori—. Me gusta esta faceta tuya. Pero, aunque sea una vez, ¿me incluirás a mí en tus fantasías sexuales o en tus obsesiones? Me gustaría aparecer. Te lo pido como amiga. ¡Vamos! Esto a otro no se lo pediría. Esta noche, cuando te masturbes, piensa en mí. No puedo pedírselo a cualquiera. Pero tú eres un amigo. Y luego quiero que me cuentes cómo ha ido.Lancé un suspiro.—Pero nada de penetración, ¿eh? Somos amigos. Mientras no haya penetración, puedes hacer lo que quieras. Pensar lo que quieras. cita larga, lo sé, pero debo admitir que cuando leía esta parte, así como otras haciendo alusión al tema, quedaba sorprendido de la naturalidad con que se llevaba todo esto.Por esto, es que me parece que el libro es bastante ameno, disfrutable, muy anímico y psicológico, como en  la escena en la que muere Naoko y Toru se siente culpable por dejarla, o también en la carta en la que midori le escribe a él cuando estaban tomando una coca-cola y le recriminaba su falta de atención hacia ella Lo recomiendo ampliamente."
229,https://www.goodreads.com/user/show/48159983-anu,Rating 5 out of 5,"There's something magical about Murakami's books, something that keeps you going, something that doesn't make sense, yet, makes perfect sense. There's something about Murakami's books that I can't find in others' books. 
""Those guys sure knew something about the sadness of life, and gentleness."" By ""those guys"" Reiko of course meant John Lennon, Paul Mc Cartney and George Harrison.
The Beatles are my favourite band of all time. I can listen to their songs all day, everyday, and never get bored. Their music is ethereal and eternal, which is also something I can say for Murakami's books. I've read three, so far, each of them so different from the others, yet as beautiful and soulful as the other. Of course, it is here that I should point out that Murakami's books have some common themes; I mean to say characters, but seeing as all his characters seem to represent a theme, I stand by my reasoning. Toru Watanabe is an introverted, slightly odd college student who is in love with the beautiful and certifiably crazy Naoko. Of course, she (like the other women in this opus) is a manic pixie dreamgirl.The song Norwegian Wood was revolutionary. It was the first rock song to incorporate the sitar in its music, and to this day, it remains iconic of the Beatles' innovation and creativity, while simultaneously reflecting the simple and enjoyable music that they are known for. This book, similarly, while drastically different from the usual Murakami style, propelled him to superstardom. Now, having read two other books of his, The Wind-up Bird Chronicle and Kafka on the Shore, both of which were obviously rampant in the classic Murakami themes of magical realism and surrealism, this book was surprisingly more realistic and, well, normal. Of course, because Murakami is drawn to magical realism like a moth to a flame, there are underlying themes of death and a slightly preternatural element to it in some parts. But in its heart, it is a simple, romantic, coming-of-age story. 
""For a certain kind of person, love begins from something tiny or silly. From something like that or it doesn't begin at all.""
The song Norwegian Wood is a story of an affair that John Lennon had, and while it may just seem like it is Naoko's favourite song, I like to think that it has a much deeper connotation to the themes of the story. Sometime back, I saw the video version of Bohemian Rhapsody, where the whole song was played out as a small movie. I like to believe that Murakami heard this song, and decided, ""hey, I can make a story out of this"". Because in a way, the book Norwegian Wood is a more complete version of its eponymous song. It is a surprisingly simple book dealing with deeply complex themes of love, loss, life, and living. The characters in the book are realistic enough for you to hate them at various points of time during the book, and I don't mean hate them in an endearing manner. The most incredible part of the book, however, is its vivid imagery. Whether it be the natural scenery, food, the weather, of emotions, Murakami (and the translator) has done a stellar job with the descriptions and the language. Of course, there are some weird sex scenes and 
a lot
 of penis talk, but my previous experience and hearsay otherwise have prepared me for that. Read Norwegian Wood for the rich descriptions and the depth of its characters. because despite its many obvious flaws, these two factors make this book a five-star read for me. I also live for pop culture references, and this one has them aplenty. Of course, the fact that Watanabe doesn't much like The Graduate, which is my favourite movie slightly irritated me, but oh well, he was kind of a prick anyway.
All of us (by which I mean all of us, both normal and not-so-normal) are imperfect human beings living in an imperfect world. We don't live with the mechanical precision of a bank account or by measuring all our lines and angles with rulers and protractors.
"
230,https://www.goodreads.com/user/show/16500960-maria-bikaki,Rating 5 out of 5,"Σκέφτηκα πραγματικά πολύ για το ποιο βιβλίο θα ήθελα να είναι το πρώτο της χρονιάς. Όχι γιατί απαραίτητα θα κάνει τη διαφορά αλλά δεν ξέρω μάλλον γιατί ενδόμυχα μέσα μου δεν ήθελα να βιώσω την «κατάρα του βιβλιοφάγου» να ξεκινήσω τη χρονιά με ένα άθλιο βιβλίο και μετα να συνεχιστεί και για όλο το υπόλοιπο έτος. Χτες λοιπόν αφού ξεφύλλισα 3-4 βιβλία (εντάξει σταματήστε με πιάσατε ήταν παραπάνω) έπεσα πάνω στο νορβηγικό δάσος του Μουρακάμι. Είχα καιρό να διαβάσω κάτι δικό του και η αλήθεια είναι ότι περισσότερο το ξεκίνησα έχοντας τη βεβαιότητα ότι θα το άφηνα όπως και τα υπόλοιπα. Αν σκεφτώ ότι κόντεψα να αλλάξω χρόνο με το μουρακάμι και όχι με την οικογένεια μου υποθέτω πως οι φόβοι μου δεν είχαν βάση . Και ναι τελικά τα κατάφερα. Δε θα μπορούσα να ζητήσω καλύτερη εκκίνηση πραγματικά!!! 5 γεμάτη ζάχαρη άχνη αστεράκια!!! Είχα στα αλήθεια ξεχάσει πόσο σπουδαίος αφηγητής είναι ο Μουρακάμι. Πραγματικά πρέπει να σαι καλός συγγ��αφέας ώστε να επιτυγχάνεις ένα βιβλίο το οποίο στερείται ιδιαίτερης πλοκής να σε καθηλώνει και να καταπίνεις ως αναγνώστης τις σελίδες λες και ο χρόνος γύρω σου έχει σταματήσει. ΤΟ Νορβηγικό δάσος φέρει τη σφραγίδα του συγγραφέα του και αποτελεί δείγμα της συγγραφικής του ευφυίας μέσα από την σχεδόν λυρική και ποιητική του αφήγηση.Το Νορβηγικό δάσος είναι ένα βιβλίο όπου ο έρωτας και ο θάνατος πορεύονται χέρι χέρι υπό τους ήχους της μουσικής. Είναι μια αριστοτεχνική θα έλεγα διείσδυση στον ψυχισμό του ανθρώπου. Ένα μελαγχολικό και νοσταλγικό μυθιστόρημα για τον ανεκπλήρωτο έρωτα από τη μοναδική πένα του Μουρακάμι. Το νορβηγικό δάσος λοιπόν αποτελεί το βιβλίο του έρωτα και του θανάτουΟ θάνατος του Κιζούκι με είχε διδάξει κάτι, μιά πίστη που ένιωθα ότι την είχα κάνει δική μου, κομμάτι του εαυτού μου: ο θάνατος υπάρχει, όχι ως το αντίθετο της ζωής αλλά ως μέρος της. Ζώντας καθένας τη ζωή του, τρέφουμε τον θάνατο. Μα όσο κι αν αυτό είναι αλήθεια, δεν είναι παρά μία μόνο από τις αλήθειες που πρέπει να μάθουμε. δεν υπάρχει αλήθεια ικανή να γιατρέψει τη λύπη. Δεν υπάρχει ούτε αλήθεια ούτε εντιμότητα ούτε δύναμη ούτε καλοσύνη ούτε τίποτα που να μπορεί να γιατρέψει αυτή τη λύπη. Πρέπει να την αντέξουμε ως το τέλος και να μάθουμε κάτι απ’ αυτή. Μα ό, τι κι αν μάθουμε, δεν θα μας βοηθήσει την επόμενη φορά που μια παρόμοια λύπη θα έρθει να μας συντρίψει απροειδοποίητα. Ο 37χρονος Τόρου Βατανάμπε, καθώς το αεροπλάνο του προσγειώνεται στο Αμβούργο, ακούει μια διασκευή του τραγουδιού των Beatles ""Νορβηγικό δάσος"". Είναι το τραγούδι αυτό που τον μεταφέρει 20 χρόνια πριν στην εποχή της ενηλικίωσης του. Κάπως έτσι ξεκινάει να περιγράφει τη ζωή του όπως εκείνη διαμορφώθηκε μεταξύ των 17 και 20. Στα χρόνια αυτά θα γίνει μάρτυρας πολλών και διαφορετικών γεγονότων, θα βιώσει αυτοκτονίες πολλών και κοντινών του προσώπων, θα γνωρίσει την αγάπη και το θάνατο ως μέρος της ζωής, θα πορευτεί μόνος του όχι τόσο γιατί του αρέσει η μοναξιά αλλά γιατί όπως λέει σιχαίνεται τις απογοητεύσεις, είναι πιστός στις αρχές του αλλά και συνάμα θα γευτεί τους πειρασμούς που βρίσκονται μπροστά μου. Ένας νέος που μέσα σε αυτά τα 3 χρόνια θα γνωρίσει τη ζωή σε όλες τις εκφάνσεις της και θα γίνει άντρας. Ο Τόρου Βαντανάμπε θα κληθεί να επιλέξει ανάμεσα στη ζωή και το θάνατο, ανάμεσα στο παρελθόν και το μέλλον αφού πρώτα μάθει να αποδέχεται όλα τα στάδια της ζωής από την ίδια τη ζωή, τις απολαύσεις, τον πόνο και τις απογοητεύσεις της μέχρι το θάνατο. Ένα βιβλίο που χωρίς να λέει πολλά στην πραγματικότητα σημαίνει άλλα τόσα και που θα ταρακουνήσει τις καρδιές των απαιτητικών αναγνωστών."
231,https://www.goodreads.com/user/show/16564718-fatema-hassan-bahrain,Rating 4 out of 5,"تحتاج عقلاً فوق عقلك لتقرأ موراكامي كما يريدك أن تقرأه، من خلال الغياب المفاجئ من حوله، نستكشف مشاعر تورو واتانابي الذي يقف صامدًا بينما تتساقط ذكرياته مفجوعة و مشوشة بكل الموت من حولها، موراكامي يصنع من تورو بديلاً في مخطط الآخرين كما في علاقة صديقة كيزوكي - المنتحر- و ناوكو الفتاة التي وقع تورو في حبها، و في علاقته ب رايكو المرأة الثلاثينية المطلقة و علاقته بميدوري الفتاة الصاخبة- صاحبة الشخصية المسلية هنا- بحبيبها كان البديل كذلك، تورو يبحث عن النضج و الحب، فكيف يجدهما في زوبعة الغياب هذه، إن كان كلما حولك من أشخاص يغيبهم الموت فأنت ممن يحق لهم التساؤل هل هم من أصبحوا في عالم آخر فعلاً أم أنت من أنتقلت لبعد آخر؟ إن كنت لم تشعر بانتقالك فهل من المنطقي أنك تحللت شيئًا فشيئًا دون أن تشعر ؟ خسارتك لمن حولك ممن يهمك أمرهم و يهمهم أمرك هو تحلل في ذاتك! خسارتك لذاكرتك بثقل ما تحويه عنك هو تحلل ينقلك لبعد آخر ! بداية الرواية و قفلتها شيء عظيم و مربك بحيث لا يجد القارئ تفسيرات مقنعة ولائقة بما قرأ، يكفي أن تتذرع بكمية الجنس أو الغموض عند موراكامي لتقلع عن محاولة فهمه، لكنك تأكد حينها كم ستخسر. لا يهمني كم أخفق في فهم مقاصده و لكن هذا الكاتب استثناء.أقتبس من غابته:- الذاكرة شيء مضحك.- تلك هي الأشياء الأولى، و إنها لتأتي بوضوح مطلق.- أحيانًا أفكر أن في قلبي نواة قاسية، لا يدخلها شيء على الأطلاق، و انني لأشك في قدرتي على حب أي انسان.- إذا كنت تقرأ الكتب التي يقرأها كل شخص سواك فقط، فلن تستطيع التفكير إلا بالطريقة التي يفكر بها كل شخص سواك. وهذا يعني عالم الريفين و السذج، الناس الحقيقيون يشعرون بالعار لأنهم يفعلون ذلك.- حين تكون محوطًا بإمكانيات لا نهاية لها، فإن من أصعب الأشياء عليك تركها تفلت من يديك.- الكتابة ��ندي عملية مؤلمة.-مهما قلنا، فلن يصدق الناس إلا ما يريدون تصديقه، وكلما ازددنا مكافحة، ازداد وضعنا حرجًا.--يترك الناس ذكريات غريبة، صغيرة وراءهم حين يموتون.- انظر، العالم مكان ظالم بالفطرة، لم أكتب قوانينه، لقد كان دائمًا على هذا النحو."" لا بد أنه شيء رائع أن تكوني متأكدة من أنكِ تحبين شخصاً ما"" - حين تبدأ من الصفر، فقد حصلت على ما تتعلمه.- أبريل، أكثر وحشة من أن تقضيه وحدك بطوله.- جميعنا كائنات إنسانية ناقصة تعيش في عالم يعوزه الكمال.- إذا كنت لا تريد ان تقضي عمرك في مأوى مجانين ، فعليك أن تنفتح قليلاً و تجري مع الحياة في تدفقها الطبيعي.- لا تقلق، إنه مجرد موت، فلا تتركه ينغص عليك حياتك.- يوجد الموت لا بوصفه نقيض للحياة، بل بوصفه جزء منها.- ليست هذه نقودًا، إنها مشاعري، لا تفكر فيها كثيرًا، خذها فحسب.- ذاكرتي بقيت مشتبكة مع الموتى، لا الأحياء.- ليست الرسائل سوى قطع من الورق، أحرقيها، و سيبقى ما في القلب في القلب، احتفظي بها وسيختفي ما يختفي."
