,user_links,user_ratings,review_text
137,https://www.goodreads.com/user/show/35251024-nat-k,Rating 3 out of 5,"""If you only read the books that everyone else is reading, you can only think what everyone else is thinking.""Yes, this amazing quote is from Norwegian Wood. It's really something, isn't it. A dream quote. The stuff of magic to be proudly displayed on t-shirts, notebooks and tote bags.I first read this book in 1990s. I'd ""discovered"" Murakami and fallen into book obsession with him. I would read his books in random order, in awe of his quirkiness. Toru Watanabe is a nineteen year old, attending University in Tokyo at the end of the 1960s. This book is a year in the life, and is all about his thoughts and relationships until he turns twenty.It's quite melancholic and has a slow, underwater feel to it. Toru, his best friend Kizuki and Kizuki's girlfriend Naoko form a tight little clique. Inseparable. Until a tragedy occurs and Toru and Naoku are left to somehow cope with his loss.There's a backdrop of societal change and student uprising. The frienships Toru makes at Uni and the impact they leave on his life.The first time I read this book it left me feeling flat and scratching my head. It was not a favourite then, and revisiting it again after so many years, I feel the same. There are moments where I got glimpses of the Murakami I love. Some beautiful writing. Descriptions of sitting in cafés reading books. Nature's beauty in the changing seasons. His references to music (showing his love of all genres, from classical to jazz and The Beatles - it's only natural this book should be named after one of their quirkier tunes). The joy at starting a new friendship. Discovering what you have in company. There is a white cat called Seagull. These snippets had me settle in and enjoy the book, but they were fleeting. Overall I found this book to be frustrating, as for me it has an air of aimlessness. The characters - with the exception of Toru - are either victims of their own lives or ruthless in their treatment of others. Emotional overload or lack of emotion. Neither extreme is good, and I found it difficult to remain focused on the story from not forming an attachment to any of them. With Toru himself, the isolation he felt (which I could empathise with up to a point) began to grate. It was tough what he went through, but this book felt endless to me.The constant reference to (male) masturbation was boring, as was another character's penchant for watching porn and having extreme sexual fantasties. It was just dull.What was interesting was that Kinokuniya (the amazing bookstore) was mentioned a few times. And this time I knew what it was! There was no Kinokuniya store in Sydney when I first read this, so I got a buzz out of that.⚠️Trigger warnings include suicide, emotional anguish, emotional cruelty, mental health, depression, sexual dysfunction and masturbation. Which shouldn't be a trigger warning in itself, but references to it were incessant.A low watt 3 ⭐ It was simply too many pages for so much existential teen angst.It makes me sad to love an Author so much, only to have some of their books not hit the mark. But that's ok, as I know there are others which more than make up for it.And so, on this rainy Wednesday afternoon I bid adieu to Toru.To end on a positive note, here's another great quote from this book:""Better to be a first-class matchbook than a second class match.Now how good would that look on a t-shirt? My Murakami Odyssey continues with Dance Dance Dance. I'm looking forward to it!As an aside, has anyone else pondered on the line ""Just remember, life is a box of chocolates."" Sound familiar? I don't know who wrote the screenplay for Forrest Gump, but they must have been a Murakami fan."
138,https://www.goodreads.com/user/show/14024451-azumi,Rating 4 out of 5,"Esta es mi segunda lectura de este libro. La primera vez que me lo leí fue hace siete años más o menos y la verdad es que no me gustó nada y no me dejo ningún poso ni recuerdo. Tal vez es que lo leí en una mala época o vete tú a saber. El caso es que ni siquiera lo incluí en mi biblioteca de Goodreads cuando me registré porque ya tenía la idea de volvérmelo a leer, porque me daba la impresión de que le tenía que dar otra oportunidad. El caso es que me ha encantado, no sé qué estaría yo pensando en esa época para no ver lo bien escrito que está, con ese ritmo tan pausado que te va envolviendo y como está todo tan bien perfilado, ya sean paisajes, recuerdos o personajes.Y esta es mi historia con este libro.Esto me da que pensar, porque ¿cuántos libros que no gustaron me gustarían ahora? ¿y al revés? ¿Cuántas estrellas de puntuación se caerían de otros libros? "
139,https://www.goodreads.com/user/show/139784884-alvarohernandez-81,Rating 3 out of 5,"Cuando comencé este libro no me había leído ni la sinopsis. Lo cogí de la biblioteca porque había visto que era bastante popular y decidí incluirlo en mis tres lecturas que me dejan llevarme al mes.Pues bien, siento llevar la contraria a todos esos afortunados que han disfrutado de este libro, pero a mí este Tokio Blues me ha dejado más bien frío. 🥶 Es cierto que he disfrutado de ciertas partes del libro pero en otras ocasiones se me hizo pesadísimo. Explicaciones larguísimas que no llevan a ningún lado y sobre todo un empalagoso diálogo entre personajes que en más de una ocasión me hizo cortar la lectura y cerrar el libro.Aún así le pongo tres estrellas porque como digo he disfrutado de ciertos pasajes, aunque no me resulte imprescindible haberlo leído. 🥱🥱🥱"
140,https://www.goodreads.com/user/show/5942822-alan,Rating 5 out of 5,"There are only a few things I have to say about this book:1)	Throughout the novel, I had a single verse repeating itself in my head over and over again: “I once had a girl, or should I say, she once had me? She showed me her room, isn’t it good, Norwegian wood?”2)	The last 20 pages of this book took me 3 days to read.3)	The New York Times Book Review described this book as “Masterly.” Honestly, I have nothing to add to that.4)	Absolutely FUCK mental health problems that plague relationships."
141,https://www.goodreads.com/user/show/16560782-maria-yankulova,Rating 4 out of 5,"Изключително мрачна и депресивна книга, която щеми е трудно да препоръчам, но много харесах! Истински майстор е Мураками! Много трудно ми потръгна четенето на романа, но след първите 50 страници силно ме увлече. Интересен факт е, че оставех ли книгата много трудно посягах към нея. Започнех ли да чета се потапях в света на Мураками и не исках да я оставя. “Норвежка гора” засяга редица значими теми - самотата, депресията, психичното здраве, самоубийството, приятелството, музика, изкуство, любов. Страхотни образи е изградил Мураками - особено женските. Шапки долу. Отнемам 1⭐️, заради прекомерното сексуално съдържание, което никак не е по вкуса ми и твърде многото самоубийства в сюжета. Не знам кога ще посегна пак към Мураками, но когато му дойде времето вероятно ще е “Хроника на птицата с пружина”."
142,https://www.goodreads.com/user/show/13703358-ms-smartarse,Rating 5 out of 5,"Norwegian Wood has been on my ""favorites"" shelf for a number of years now, even after several rereads. It never failed to put me in a good mood, despite the fact that the story itself is a rather sad one. It was my first Murakami and also the first ""adult"" book I've ever read. My mom had got it for me as a birthday gift, possibly as an attempt to make me relate to Japan with something other than Sailor Moon. This was of course reason enough for considerable reluctance on my part, when it came to giving it a try.No one was more surprised than I, when the story ended up growing on me after all. My reasons ranged from the obvious: protagonists barely older than me, freshmen life in university, a 'lot' of sex (well comparatively). And then there were also weird attractions such as: Japanese names. I had previously read stories staring Ion, Christina, Otilia and the rather more exotic Maitreyi. All very special characters in their own right, but with few relatable qualities.Enter Norwegian Wood starring Naoko, Toru, Reiko, Midori; all featured in my favorite anime, yet much more realistic compared to their anime namesakes. They were all doing such mundane things as living in university dorms, playing the guitar, working part time at a music shop, visiting ill relatives in the hospital, cooking 'exotic' food. Truthfully, I haven't reread this book for a number of years now, and after Kafka on the Shore and The Wind-Up Bird Chronicle I probably won't either. It has so many nostalgic moments linked to it, that I'd hate to 'have to' lower its score to a 4. So I'll just quietly pretend that Norwegian Wood is still the best thing since sliced bread: 5/5 stars."
143,https://www.goodreads.com/user/show/2876105-marc,Rating 3 out of 5,"In lots of reviews on Goodreads I read that this early work by Murakami is one of his lesser. That surprises me, because I had a really nice reading experience with it. On the one hand it is a rather conventional ""coming of age""-book: we see how a 17 year old boy struggles with life, friendship and love, and above all death. The story is beautifully composed, although the end is a bit predictably moralistic.But the special thing about it is the mood the work breaths: the main character, the young Watanabe, strays through life, searching for his own voice; he's a kind of Man without Qualities: everybody likes him, he is at ease with the most difficult characters, friends (boys and girls) display to him their most profound secrets and confront him with very difficult questions (suicide for instance, or madness). What is really beautiful about Watanabe is his openess and honesty, his authenticity; it's also this quality that makes him find his way through. The strange thing is that everything seems to slide down from him, he has almost no impact upon things, he just undergoes events, but with open eyes. Marvellous how Murakami describes this process.Two other things that make this novel special: persistently there are references to western popculture (especially the Beatles) but also to western high culture (Bach, Camus, Thomas Mann); this produces the effect that the strangeness that sometimes pervades Japanese novels (read by a westerner like me) is effaced. Another thing that is striking is the very explicit way the characters talk about sex or are having sex, always as a natural action, a very nice and human way of interrelating. This was my first acquaintance with Murakami, and I was pleasantly surprised. I've read a few other ones since (see https://www.goodreads.com/review/show..., https://www.goodreads.com/review/show...), and though he has not become my most favourite author, he sure is one of the most interesting writers of the moment. (rating 2.5 stars)"
144,https://www.goodreads.com/user/show/58361902-nancy,Rating 4 out of 5,"""If you only read the books that everyone else is reading, you can only think what everyone else is thinking.""This was my first Murakami and it's easy to see why people are drawn to his writing, it's vulnerable, raw, and relatable. Toru's journey was not one filled with rainbows and unicorns, it was a very dark journey at times and sometimes painful to read, but then there are moments like the ones involving the storm trooper that made me laugh. The prose is beautiful, Toru is a brilliant character full of depth, and I appreciated the stark contrast between Naoko and Midori and the roles they played in his life. I don't generally like ambiguous endings, but this one worked for me. I actually found the ending hopeful which is what I needed it to be since I loved Toru. This is not a book that will be easily forgotten. 4 stars for now, but this may change the more I think about it."
145,https://www.goodreads.com/user/show/88361217-james-scholz,Rating 5 out of 5,4.6by far the horniest book ive ever read 👍
146,https://www.goodreads.com/user/show/6868207-mau-maponto-lee,Rating 4 out of 5,"“Tokio Blues (Norwegian Wood)” es un libro que toma su nombre de una famosa canción de 1965 de los Beatles, y está ambientado en el Japón de la década de 1960 durante el período de la revolución estudiantil. Es un drama y un romance oscuro sobre llegar a la mayoría de edad que es melancólico y extrañamente pacífico al mismo tiempo. El escenario nos dice mucho sobre el Japón de ese entonces y cómo era ser un adulto (en medio de la revolución estudiantil hipócrita y de voluntad débil) en aquellos días.Toru es un joven estudiante precoz, un pensador profundo sobrenaturalmente serio y amante de los escritores clásicos como Fitzgerald y Hemingway. Aunque sus primeros tiempos en la universidad fueron solitarios, los capítulos que detallan su vida en el campus y su peculiar compañero de cuarto son genuinamente divertidos. Un día, un encuentro casual reúne a Toru con Naoko, la novia de su mejor amigo Kizuki, quien se suicidó un par de años antes. El trauma de este evento hizo que Toru se mudara a Tokio para estudiar y, a través de su dolor y confusión compartidos, él y Naoko adquirieron el hábito de dar largas caminatas dominicales juntos.Desde el momento en que la presentan, hay algo fantasmal e intangible en Naoko. Al principio, Toru (y nosotros los lectores) tenemos poca idea de cuán profundos son sus problemas psicológicos. En última instancia, llevan a Naoko a retirarse del mundo exterior a un centro de tratamiento aislado y poco convencional, mientras que Toru mantiene la esperanza en su recuperación y muestra su amor y apoyo con visitas y cartas periódicas. Mientras tanto, la frágil relación de Toru y Naoko se complica cuando él se hace amigo de una compañera de estudios llamada Midori. Es una joven de clase trabajadora que es prácticamente el polo opuesto de Naoko: divertida, dinámica, provocativa y habladora, dañada a su manera pero llena de vida y emocionalmente abierta. Dividido entre lo que considera su deber para con Naoko y su creciente conexión con Midori, Toru se pregunta si puede aspirar a algo más que estar atrapado en un limbo desconectado, cuidando a una chica que podría sufrir daños irreparables y nunca volver a amarlo.Se trata de una novela oscura, de ritmo lento, con un fuerte trasfondo de melancolía que impregna todo el libro y persiste a pesar de los destellos de optimismo en la conclusión. Hay poca trama real, con muchos capítulos que llevan al lector cada vez más a las mentes atribuladas de sus personajes. Casi todos en la vida de Toru en esta etapa formativa tienen problemas y batallas personales profundos. Hay una pizca liberal de sexo, clásicos de los Beatles y el tema del suicidio, aunque este generalmente se explora de una manera cuidadosa y sensible.Lo primero a destacar de este libro es la hermosa y excéntrica escritura de Murakami, quien encuentra formas no obsoletas, inesperadas y extravagantes de describir a las personas, sus estados de ánimo y emociones, la naturaleza y los lugares, lo cual siempre nos sorprende y nos mantienen alerta. Es cierto que algunos de los diálogos de los personajes pueden sonar terriblemente forzados, antinaturales y nada parecido a lo que dirían los jóvenes en la vida real, pero podemos aceptarlo como parte de todo el paquete onírico y de otro mundo. Murakami claramente domina el lenguaje y sus posibilidades.Lo siguiente a destacar es la forma en que Murakami crea sus personajes. De alguna manera, logra crear un vínculo entre nosotros y los personajes que es tan fuerte que sentimos sus alegrías, dolores y sus altibajos casi tanto como ellos. Es fácil llegar a identificarse con los tres personajes principales: el aislamiento de Toru, la capacidad de Naoko de sentir las cosas demasiado profundamente, y la calidez y excentricidad de Midori. Todas las relaciones del libro parecen representar un intenso deseo de conexión humana en un mundo donde el dolor y la tristeza son parte del ritmo natural de la vida.Uno de los temas más prominentes de la novela es la muerte, lo cual es un poco traumático considerando lo emocionalmente involucrados que estamos con los personajes. A lo largo del libro, Murakami presenta la vida y la muerte como fuerzas opuestas que nos arrastran en una dirección u otra sin elección ni previo aviso. No se trata sólo de seres humanos encarnados, sino también de la memoria, y de cómo una persona sigue existiendo incluso cuando ya no está.Es fácil enamorarse de la escritura de Murakami porque es muy real. Lleno de referencias contemporáneas a canciones, músicos, novelas y autores, el libro se basa en el mundo tal como lo conocemos, haciéndolo aún más identificable. Al abordar algunas de las emociones humanas más intensas, entrelaza los temas de la muerte, la pérdida y el dolor con los del amor, el sexo y la adolescencia. Es tanto una historia de las celebraciones como de las dificultades de estar vivo.Reseña completa sin spoilers en mi canal de YouTube ➡ Maponto Lee 📚 Link aquí!"
147,https://www.goodreads.com/user/show/33814147-jorge,Rating 4 out of 5,"Espléndida novela del renombrado escritor japonés Haruki Murakami (1949), quien con sus narraciones ha hecho gozar a millones de lectores en todo el mundo, entre los que ahora me incluyo yo. A pesar de su ya larga y exitosa trayectoria y de las reiteradas recomendaciones de amigos y conocidos, no me había acercado a él por una especie de necio prejuicio que tengo en contra de los escritores que son, a mi juicio, sumamente publicitados y exhibidos tanto en las librerías como en los diferentes medios. No he podido deshacerme de la idea de que tras ese aparato publicitario existen muchos intereses comerciales que no necesariamente comulgan con un cierto nivel de calidad literaria. Sin embargo, parece ser que Murakami es uno de esos casos que reúne ambas características: aceptación mediática y talento artístico.  Esta novela fue escrita en 1986 y es considerada por la gran mayoría de los fanáticos del autor japonés como su obra cumbre. La novela en cuestión está narrada por el protagonista de la misma: un hombre que se acerca a los 40 años y que justo al principio del libro tiene una fuerte remembranza al escuchar una canción de “The Beatles” en un aeropuerto. Esto detona un flujo de recuerdos muy vívidos de su época universitaria los cuales constituyen el cuerpo de la novela. La narración se desarrolla en la gran ciudad de Tokio hacia finales de los años sesenta, donde la personalidad del protagonista en ese entonces de entre 18 y 20 años posee unos rasgos distintivos muy bien delineados por el autor. Buena parte de los personajes secundarios está constituido por mujeres que rondan la vida de este Toru Watanabe, en especial su vida sentimental y erótica, pero también se presentan algunos otros de sexo masculino que contrastan con la personalidad sensata y circunspecta de Watanabe.  Ligero, envolvente e interesante relato, durante el cual el autor equilibra muy bien la acción con la reflexión y los diálogos. En su mayor parte las oraciones son cortas, las frases concisas y los párrafos compactos lo que contribuye a que su lectura se haga sumamente ágil. Murakami también encuentra momentos de inspiración que expresa con suaves líneas mediante una prosa que podríamos calificar de poética.  A pesar de la riqueza artística y cultural del Oriente, Murakami nos deja ver, a través de sus personajes, sus influencias en el campo artístico en donde pone de manifiesto que éstas provienen del mundo occidental, en especial por lo que toca a Literatura y Música.  El relato está magníficamente ambientando en aquellos años de finales de la década de 1960. A esta ambientación contribuyen las constantes menciones del autor acerca de la música y la literatura que escuchaba y leía aquella generación y que siempre son de autores Europeos y Norteamericanos, mencionando aquí y allá nombres y obras que han surgido claramente de las fuentes occidentales y que la historia ha consagrado.En cuanto al trasfondo de la obra, me parece que Murakami acomete varios temas y sentimientos de vital importancia para el ser humano. Encuentro a algunos de sus personajes revestidos por una profunda angustia existencial, por una insondable falta de identidad, así como por una acentuada carencia de sentido de pertenencia que los hace atravesar por diversas crisis y extraños comportamientos, aunque como se dice en el texto: todas las personas somos anormales.  Un asunto recurrente lo constituyen las siempre complicadas relaciones hombre-mujer. Mediante algunos pasajes cargados de erotismo, el autor aborda con largueza la atracción sexual que ocupa gran parte de nuestras existencias y que se despierta con singular violencia en esta etapa de la vida. También son encarados otros temas importantes como el desconcierto y la duda, tanto ante lo que se presenta ante nuestra vida, como en lo que está por venir. Mención aparte merece cómo Murakami acomete el sentimiento de soledad, el egoísmo, la falta de comprensión entre las personas, la sensación de culpabilidad que nos asalta a cada momento y el tema del suicidio. Pero sobre todo me impactó la sensibilidad de Murakami para transmitirnos todos esos anhelos de juventud que nunca fueron colmados. Por último diré que, para coronar la obra, me hubiese gustado mucho que el autor incluyera un fragmento o capítulo en el cual se diera una discusión, a través de sus personajes, sobre algunas manifestaciones artísticas a las que él hace mención con tanta asiduidad durante su obra: Miles Davis, William Faulkner, Johannes Brahms, “The Beatles”, Thomas Mann, y algunos otros. "
