,user_links,user_ratings,review_text
58,https://www.goodreads.com/user/show/28854579-glenn-sumi,Rating 4 out of 5,"I’m late to the Murakami party, but I’m glad I arrived. People here seem to be enjoying themselves, passing his books around enthusiastically while ordering many rounds of sake and Japanese beer and nibbling on cucumber with nori and soy sauce. I think I’ll stay a while.Last year I read What I Talk About When I Talk About Running – his book on long-distance running - and quite enjoyed it. But this is the first book of his fiction I’ve read. I hear it’s atypical Murakami: no magic realism, no noir.What a strange book this is, comprised of simple, unshowy sentences, lots of muted emotions and understatement. It took a while to work its magic on my mind and imagination, but it eventually did. He plants symbols: a forest, a well. The melancholy Beatles song, a fave of some of the characters, kept going through my head as I read. Youth suicide seems to be a major theme. So is the nature of love and friendship. There are erotic and sensual passages.Gradually, oh so gradually, the book began to affect me. It’s all about memory, moody atmosphere, accepting things you can do nothing about but trying to learn from one’s mistakes. It’s about enjoying the view.There’s a mournful, elegiac feel to it, right from the beginning, when the 37-year-old writer, Toru (the book feels autobiographical but I don’t think it is) looks back on his intense relationship 20 years earlier with his friend Naoko.For a long time, Naoko, Toru and Kizuki were inseparable, and then Kizuki died. Toru was the last person to see him alive. Naoko checks herself into a facility, and Toru visits her and her friend Reiko there. Reiko’s story – one of many powerful multi-page monologues – will break your heart. Toru also takes a shine to his fellow student Midori, a high-spirited woman who’s got her own problems but a much different approach to them. She provides a boisterous, life-affirming contrast to the rather glum Naoko. And then there’s Toru’s womanizing friend Nagasawa. One of the most poignant sections in the book concerns Nagasawa’s girlfriend Hatsumi. Toru informs us of her suicide, and then we go back to see a scene between Hatsumi and Toru that, in retrospect, is terribly moving. In fact, Murakami plays with chronology a lot, and I think it’s this structure, this gradual accretion of details, that has a cumulative emotional effect. I came to admire Toru, too, for his truthfulness. He’s a little hard to read – kind of like Nick Carraway in The Great Gatsby, a book he loves – but he’s got a code of honour. He never lies. He tries to do what’s right, even when he feels powerless.I’m not sure if his obsession with Western things is typical of a Murakami protagonist: there are references to Mike Nichols’s The Graduate, Thomas Mann’s The Magic Mountain, songs by the Beatles and Bob Dylan. Oh yeah, the book is set in the late 60s and early 70s, when the cultural shifts occurring in the West must have seemed liberating.I was surprised with how little Japanese culture itself is referenced. But it’s telling that this was Murakami’s monster breakthrough book in his own country. Clearly, it’s connected with people around the world, too. Finding your voice, discovering your vocation, surviving death and unrequited love: post-adolescent angst is common wherever you are."
59,https://www.goodreads.com/user/show/112160688-leah,Rating 5 out of 5,"essentially, this book is murakami’s version of the early 20s, coming of age novel. the book explores the desperation and loneliness of youth, along with the existential crisis of being young and not understanding what life is all about, or what you’re supposed to be doing with it. toru being a university student is really where the relatability came in for me as murakami really captured how monotonous university life can feel sometimes i.e. going to lectures, doing your assignments and repeat, and how you sometimes feel like you’re just floating through your student years.i was pulled into the story within the first few pages which was definitely aided by the writing, which is beautiful and poetic with a hint of melancholy laced throughout. life and death is the prominent theme running throughout the novel but murakami doesn’t paint them as opposites, instead they are just parts of a wider process that mark all the experiences you have in between. it is quite a bleak read, but it’s a story that is very easy to get lost in. however, as many people have pointed out, murakami unfortunately can’t write women. most of the female characters are the epitome of the ‘manic pixie dream girl’, and although this phrase wasn’t coined until 2005, that’s basically how they’re all portrayed. obviously we don’t know murakami’s views towards women, but the protagonist here clearly sees women either as things he can just discard or as pretty little broken dolls that he wants to fix. i have to admit i did still enjoy midori as a character though, mainly because of her witty dialogue. i was debating taking a star off due to the portrayal of women throughout the novel which was a bit distracting, but i can’t bring myself to because i just loved the book so much overall. i’m a firm believer that you can still love a book while also criticising its more problematic aspects, and that’s probably the best way to approach this book. but even still, i highly recommend it."
60,https://www.goodreads.com/user/show/3536004-jenna,Rating 5 out of 5,"I don't know how he does it, but once again Murakami had me totally enthralled with a story I doubt many authors could have interested me in. It's about a young man named Watanabe and his relationships with several women, both sexual and platonic. It's a ""finding oneself and one's place in the world"" story. Norwegian Wood is beautifully written, achingly so. It is atmospheric, heart-breaking, and lyrical, but without the magical realism I've come to expect in Murakami's novels. There is magic though. It is in the words and the way Murakami unraveled the story, taking the reader to the depths of despair and back into a world of hope. I doubt it's a story that will appeal to everyone. It seems people either love or hate Haruki Murakami. For those who love him, this book will not disappoint."
61,https://www.goodreads.com/user/show/81770848-h-khu-t,Rating 4 out of 5,"Lần 2 đọc lại cuốn này và có 1 sự tự vả k hề nhẹ 🙃 mình đã cho cuốn này vào clip nh cuốn sách bán chạy gây thất vọng của mình, nh bây h khi đọc là cuốn này sau 7 năm mình kiểu bị ấn tượng thực sựNỗi lòng của cả một thế hệ, họ tồn tại nhưng họ có thực sự đang sống k, họ sống cùng nỗi đâu như thế nàocái chết và sự sốngtình yêu và tình dụcnỗi đâu và chữa lành ( hoặc có thực sự chữa lành đc k?)bình thường và bất bình.thường??Thực sự là văn phong của bác Murakami quá đỉnh, viết mà sâu kinh khủng, mình cảm giác mình chỉ hiểu đc 50% cái bác muốn nói...Chắc chắn sẽ còn đọc lại lần 3..."
62,https://www.goodreads.com/user/show/33138824-mia-nauca,Rating 4 out of 5,"4.5Este es el segundo libro de Murakami que leo y debo admitir que fue mucho más sensual de lo que me esperaba, no contaba con el erotismo que me iba a encontrar, y contrario a todos, a excepción de una escena, me gustó mucho como eran descritas, tenían sentido, pasión y sentimiento. Es muy sensual sin ser sexual, muy íntimo El estilo de escribir de Murakami es como soñar despierta, es empezar a darte cuenta de los pequeños placeres de la vida, es escuchar música, tomar un trago, disfrutar de la soledad, abrazar a alguien, disfrutar un libro, beber algo caliente, todo esto junto y más, pero sin salir de sus páginas¿Será que ya estoy acostumbrado a leer libros un poco más deprimentes que terminé con una sensación de calidez en vez de tristeza? Todos dicen que no es lo mejor de este autor, ni a él mismo le parece así, pero lo he disfrutado muchísimo y siento que es un libro con el que me quedaré mucho tiempo."
63,https://www.goodreads.com/user/show/1421407-janet,Rating 5 out of 5,"I was absolutely riveted by this haunting novel of a young man's coming of age in the 1960s and his search for connection. Toru Watanabe is a serious young man at university in Tokyo trying to understand the world and his part in it, and focuses on his relationship with two young women: Naoku, a girl he knew in high school, when he was part of a friendship triangle with her and another more glamorous boy, Kizuku--who killed himself, but who remains an invisible part of their attachment to each other; and Midori, an opinionated, high-spirited girl whose presence on the page is a sheer joy. Actually both of the girls are very 'sixties types--the beautiful mournful haunted girl and the wacky fun-loving one who breathes life into a room. There is also the jaded rich boy on his way to becoming master of the Universe, who takes Watanabe under his wing... All the characterizations in this book are glorious and very specific, the people just jump off the page at you. Murakami perfectly captures the searching young person--how everything becomes an object of serious contemplation, and 'how to be' is an urgent matter. The way literature and the music are so much a part of his young seeker's life.  But what I admire most is how the novelist weaves the tale--it's a very talky novel, a lot of storytelling by the characters--and yet it's all extremely effective and engaging. Not much ""happens"" in a Murakami novel, but relationships and the internal life are beautifully and accurately portrayed, I can't get over how skillful he can be in his ability to put his finger right on the most evanescent impressions."
64,https://www.goodreads.com/user/show/96515924-demi,Rating 4 out of 5,"❥ 4 / 5 starsAlthough I complained a lot (almost every time) when sex scenes or conversations regarding sex came up in the story, I must say that this book could undoubtedly be considered as a very well-written one. (Right, I mean it was well written in those parts too. He narrated them so crystal clear you didn’t even have to imagine it by yourself. That’s why it made me cringe AF.🤢)The word choice is great.The writing is on point.And the narration is also exceptional.I think it’s a kind of book that you should read at least once in your life even though you might not end up liking the story itself. (I, to be honest, didn’t like the story itself, either, but as long as its beauty of words made it worth reading, I think that‘s enough, right?)
By the way, here’s a list of trigger warnings for you
- Mental illness- Depression- Rape- Suicide (showed more than once in the story)- DeathSo, if you feel sad, lonely, or depressed, I would say that it would be better if you pass it since the story is quite dark and contains lots of serious issues :(P.S. I based this rating MOSTLY ON THE WRITING so don’t misunderstand that I enjoyed or agreed with the characters’ ill attitude (especially Nagasawa’s one — he was the most problematic one!!!) and their actions because I swear I didn’t. I just complimented what’s good and criticized what’s bad. That’s it."
65,https://www.goodreads.com/user/show/101718720-ahmed-kamal,Rating 5 out of 5,لحين كتابة مراجعة مفصَّلة(الشيء الذي لن يحدث غالبًا)، عايز أقول إن موراكامي أكتر كاتب بيلمسني وبلاقي نفسي في رواياته، خصوصًا هذه الرواية، لذلك هسيب دي هنا 
66,https://www.goodreads.com/user/show/48483884-michael-finocchiaro,Rating 5 out of 5,"Not as profound as The Windup Bird Chronicle or as absurd as Kafka on the Shore, Norwegian Woods still works and impresses as a love story with splendid writing. They HAVE to give Murakami a Nobel now that Roth is gone. He is sooooo talented.Fino's Murakami Reviews - NovelsHear the Wind Sing (1979/1987-2015)Pinball, 1973 (1980/1985-2015)A Wild Sheep Chase (1982/1989)Hard-Boiled Wonderland and the End of the World (1985/1991)Norwegian Wood (1987/1989-2000)Dance Dance Dance (1988/1994)South of the Border, West of the Sun (1992/2000)The Wind-Up Bird Chronicle (1995/1997)Sputnik Sweetheart (1999/2001)Kafka on the Shore (2002/2005)After Dark (2004/2007)1Q84 (2010/2011)Colorless Tsukuru Tazaki and His Years of Pilgrimage (2013/2014)Killing Commendatore (2017/2018)Fino's Murakami Reviews - Short Story Collections and MiscThe Elephant Vanishes (1993)After the Quake (2000/2002)Blind Willow, Sleeping Woman (2006)Men Without Women (2014/2017)First Person Singular (2020/2021)Underground: The Tokyo Gas Attack and the Japanese PsycheWhat I Talk About When I Talk About Running (2007/2008)"
67,https://www.goodreads.com/user/show/64604431-oguz-akturk,Rating 2 out of 5,"YouTube kitap kanalımda Japon edebiyatı hakkında daha detaylı bilgi edinebilirsiniz: https://ytbe.one/QbT0zmxxnoMBRUH. Bu kitabı tek kelimeyle özetleyecek olsaydım kocaman bir BRUH derdim. Hatta bu kitabın gözünüzde daha iyi canlanabilmesi açısından küçük bir örnekle başlayayım. Livaneli'yi ve Elif Şafak'ı alın, ikisini bir Uzakdoğu restoranına yemek yemeye götürün, sonra ikisine de yarasa çorbası içirin... İşte alın size İmkansızın Şarkısı kitabı!Şimdi kitaba böylesine düşük bir puan verdim diye bu puanı kitabın içerdiği yoğun cinsellikten ötürü verdiğimi sanıp beni kendi edebiyat çarmıhlarına germek ve kanlı bir ayin düzenlemek isteyen Murakami holiganları olacaktır elbette. Ama yanılacaklar... Kitaba neden bu puanı yakıştırdığımı söylemeden önce gelin bazı noktalardan bahsedeyim.Öncelikle bir kitabı bitirdiğimde o kitap hakkında hem Türklerin hem de yabancı okurların başka platformlarda yazdığı pek çok yorumu okurum, böylece farklı milletlerin bir kitap özelinde nasıl düşündüğünü anlayabileceğim harman bir veri toplarım. Bunların hepsini kendi düşüncelerimle karşılaştırırım ve şu an okumakta olduğunuz incelemeyi oluştururum. Bu kitap özelinde ise yabancı okurların yaptığı bazı olumsuz yorumlarda yanlış tespitler olduğunu fark ettim.Yabancı okurların yaptığı yorumlarda bu kitap, çok fazla cinsel sahnenin bulunduğu, karakterlerin sevişmek için her fırsatı kolladığı, kadın karakterlerin zayıf, basit ve kolay elde edilebilir gözükmek için ellerinden geleni yaptığı şeklinde farklı eleştiriler almış. İyi de, Japon bir yazarın Japonya'da geçen ve Japon karakterler içeren bir kitabını Japon toplum yapısındaki cinsellik ve kadının rolüyle değil de kendi milletlerimizin ahlaki değerleri ve kabulleri üzerinden yorumlayacaksak bunun ne anlamı kalır ki? Yabancı okurların bu yazdıklarıma ulaşamayacaklarını biliyorum ama olur ya belki bir gün yolları bu siteye düşer ve Google Translate üzerinden bu incelemeyi çevirmek isterler, olur mu olur...Japonlar hakkında küçük bir bilgi vermem gerekirse, yıllarca Japonya'da yaşamış ve orayı, insanlarını gözlemlemiş olan Onur Ataoğlu'nun Japon Yapmış kitabına göre """"Evlenmeden olmaz"" anlayı��ı yerine ""olmadan evlenilmez"" prensibinin benimsendiği"" bir cinsel dünyaları var Japonların. [s. 92] Yani Japonlarda cinsellik bizim gibi bir tabu değil. Gençler özgürce, istedikleri kişiyle istediklerini yapabiliyorlar. Bu, bizim ahlaki değerlerimize uyar ya da uymaz, konumuz bu değil. Bu yüzden kitaplar da yazıldıkları milletin değerleri ve kültürleri perspektifinde değerlendirilmelidir diye düşünüyorum.Çok küçük bir ekleme daha yapmak istiyorum. Yine Onur Ataoğlu'nun Japon Yapmış kitabının dediği gibi ""Japon toplum yapısına göre bir kadının kendi görüşü yoktur"" [s. 102] Gördüğünüz gibi yabancı okurların bu kitap hakkında yaptıkları olumsuz yorumları çürütmüş oldum. Kitapta yoğun bir cinsellik varsa bu, Japonların cinsel tercihlerinden dolayıdır, kitaptaki kadınlar zayıf ve kolay elde edilebilir gibi yansıtılmışsa bu da yine Japonların ataerkil toplum yapısında kadınların kendi görüşlerinin bile olmasına izin verilmemesinden dolayıdır. Bu yüzden bu kitabın 2 yıldız ederlik kısmı, bence, Murakami'nin kendi kültürünün özgür anlayışını kitabında iyi yansıtmış olmasından dolayıdır.Kitaptaki cinselliğin boyutuyla ilgili eleştirebileceğim tek kısım bir tecavüz güzellemesinin olması:""Eğer gece gece aklınıza birine tecavüz etmek gelirse, aman sakın karıştırmayın"" dedi Reiko. ""Soldaki kırışık olmayan vücut Naoko'nunki.""""Yalancı. Benimki sağdaki yatak"" dedi Naoko."" [s. 171]Haha, amma komikmiş Reiko ve Naoko... Yani şu satırları bir Türk yazarımız yazsaydı emin olun o kişinin ağzı yüzü çoktan linç olmuştu. O yüzden de tecavüz konusunun ırkı, cinsiyeti, kültürü, zamanı veya milleti olduğunu düşünmüyorum. Tecavüz, tecavüzdür. Sonucunda kalıcı psikolojik hasarların kaldığı, güzellemesi veya en ufak bir esprisinin bile kabul edilemeyeceği, zamana, kültüre bağlı olmayan ve evrensel bir konudur.Ayrıca olumsuz kısma geçmeden önce benden size küçük bir tüyo olsun... Murakami gibi kitaplarında Batı'nın değerlerine ve kültürüne çok yer veren yazarlarla Mişima gibi kendi değerlerine bağlı geleneksel yazarların kitaplarını karşılaştırmalı olarak değerlendirirseniz kendi okuma serüveninizde çok ilerlersiniz. Mesela Dostoyevski de bir Panslavist'ti, Slav değerlerini savunuyordu ve ölümüne doğru da Rus milli halk değerlerine çok bağlı hale bir yazar haline geldi. Bunun tam tersi, Turgenyev de genel olarak liberal Batılılaşmayı ve Avrupalılaşmayı savunuyordu. Turgenyev ve Dostoyevski arasında yapabileceğiniz karşılaştırmalı edebiyat incelemelerini, Mişima ve Murakami gibi Japon yazarlar ya da Orhan Kemal, Fakir Baykurt gibi toplumcu gerçekçi ve Oğuz Atay, Yusuf Atılgan gibi bireyci Türk yazarlar arasında da yapabilirsiniz.Gelelim kitaba benim neden 5 üzerinden 2 yıldız verdiğime... Arkadaşlar bu kitap dümdüz bir kitap. Yani bu kitabı okuyup da kendimi kitap okumuş olarak saymazdım ben olsam. Hiçbir esprisi ve hiçbir edebi kaygısı yok yani. Livaneli ve Elif Şafak kitaplarında olduğu gibi dil, biçim, edebi haz ve üslup açısından okuruna katabileceği hiçbir şey yok. Bu kitabı ""Japon Cinselliğinde Öğrenmeniz Gerekenler"" başlığı altında kurgu dışı ve öğretici bir kitap olarak yayımlayın daha isabetli ve daha iyi olur. Çünkü bu şekliyle kesinlikle bir edebi değeri yok bence.Hem bu kitap sadece 40-50 sayfa bile olsaymış gerçekten de yeterli olurmuş. Çünkü 370 sayfa kitapta boş boş gevezelikten başka bir şey gördüğümü söyleyemem. Bu kadar dümdüz ve edebi kaygı içermeyen bir kitabın da yazarın popüler olmasını sağlayan esas kitap olduğunu duyunca çok şaşırdığımı söylemem gerekiyor. Yani bu kitabı okuduğum zaman içerisinde SüngerBob Kare Pantolon ve Patrick'in maceralarını izleseydim kendime daha çok şey katardım diye düşünüyorum.Murakami'nin diğer kitaplarında gerçek ve gerçeküstünün başarılı bir şekilde harmanlandığını okumuştum fakat maalesef ki bu kitabı benim için büyük bir fiyasko oldu. Yani bence İmkansızın Şarkısı kitabı da ""ölmeden önce okunması gereken kitaplar"" listelerinde değil, ""okumadan önce ölünmesi gereken kitaplar"" listelerinde olmalı. Bu kitabı okumazsanız hiçbir şey kaybedeceğinizi düşünmüyorum. 370 sayfa boyunca yazarın hiçbir edebi kaygı gütmeden dümdüz bir kitap yazmasını okumak yerine pek çok başka nitelikli kitabı gerek benim önerilerimle gerekse de kendi keşiflerinizle bulabileceğinizi ve okuyabileceğinizi düşünüyorum.Esas ""İmkansızın Şarkısı"", kitaplara karşı hissedilen olumsuz düşüncelerin sırf tepki almak uğruna bir yerlerde belirtilmemesi, yazılmaması ve bu yüzden de başka okurların kendi zamanlarını kaybetmelerine sebep olmaktır. Olumsuz eleştirilerin belirtilmesini ""imkansız""laştıran şey, sizin başka insanlardan alacağınız tepkilere, kendi düşündüklerinizden daha çok önem veriyor oluşunuzdur. O halde bu yazımı buraya kadar okuyan sizlerden ricam, bugünden sonra bizim için zorla imkansızlaştıran şeylerin şarkılarını kendi düşüncelerinizle kimseden çekinmeden yazabilmeniz yönündedir. Siz, kendi benliğinizle, kendi düşüncelerinizle biriciksiniz."
68,https://www.goodreads.com/user/show/68037742-danesda,Rating 5 out of 5,Un espectáculo de sentimientos donde la falta de madurez emocional termina destruyendo vidas..... no se lo pierdan.Video reseña completa en:https://www.instagram.com/p/CTC9AOZlMVZ/
