,user_links,user_ratings,review_text
37,https://www.goodreads.com/user/show/89588648-old-dog-diogenes,Rating 3 out of 5,"Upon finishing this collection, I read through some of the reviews left by my GR friends, and I came across my friend Mark's review, and he articulated a few things that I was in complete agreeance about concerning the difficulty of interpretation when it comes to Sappho because of the lack of objectivity surrounding both her work and her life. Here are some of my thoughts in line with what he said:What is it about Sappho that is so attractive to so many modern readers? There is a modern fascination with her that is historically unprecedented. Are modern readers equally as fascinated by the rest of the Greek poets? The Homeric Hymns or the Odes of Pinar of Thebes? Do they read Sappho's only complete poem, ""Ode to Aphrodite"" in it's entirety and long for the rest of the fragments of her poetry to be complete, to better understand her contextually? I know that some readers do, but it appears to be the minority. It seems more likely to me that modern readers enjoy Sappho most, primarily because they are not actually reading Sappho, but only a ghost of Sappho that has been constructed with the help of a modern translation to read very much like post-modern poetry. The fragmented nature of Sappho arouses the post-modern inclination toward subjectivity, and the lack of historical and biographical information concerning Sappho releases us from the contextual understanding so that we are free from the chains of objectivity when deciphering her poetry's meaning. She becomes in essence whatever we desire her to be. Which is hilariously incongruous because she is then often objectified by the very people who supposedly despise the objectification of women. She is touted to be a LGTBQ+ hero, a proto-feminist, a herald of the post-modern age, yet isn't all of that a bit silly? Calling her a lesbian makes sense, but only in the sense that she was from Lesbos. The idea that she was living against the norm by engaging in sexual relations with both men and women (whether or not that was actually the case) is preposterous, and displays a certain level of ignorance concerning the Greeks in general. She was a Greek from Lesbos that sadly we know very little about. Her poetry when referenced by other Greeks such as Aristotle, or Herodotus is usually praised for it's immaculate craftsmanship. Yet the Sappho they are referring to is not entirely the same one that we are reading today. The Sappho that we are reading today has been turned into a modern play-thing that fortifies a post-modern perspective, and I am quite skeptical of this tendency to edit/skew history to have it back-up a certain perspective. I wonder if we had her poetry in it's entirety if she would be as widely read as she is today, and I honestly doubt that she would be because it wouldn't pander to postmodernist liberalism in the same way that it does in it's current form. According to John Tzetzes of the 12th century ""the passage of time has destroyed Sappho and her works"". So, historically speaking it seems that lack of interest in her poetry was the primary reason that her works were lost to time, due to a few different factors, one being that her dialect was odd for the people who encountered her works throughout history who were more accustomed to a more ""classic"" dialect, alongside I imagine a lack of content that resonated with historic readers. Now with all of that out of the way, I should say that I enjoyed these fragments for what they were, and I am glad that they exist, even with all of the missing pieces and holes in the narrative. I just think that we should approach Sappho and the fragments with a degree of caution, as to not perpetuate the tendency to make her into something she was not. Fragment 22]]work]face]]if not, winter]no pain]]I bid you singof Gongyla, Abanthis, taking upyour lyre as (now again) longingfloats around you,you beauty. For her dress when you saw itstirred you. And I rejoice.In fact she herself once blamed meKyprogeneiabecause I prayedthis word:I wantFragment 47Eros shook mymind like a mountain wind falling on oak treesFragment 52I would not think to touch the sky with two armsFragment 147someone will remember usI sayeven in another time"
38,https://www.goodreads.com/user/show/110286034-deniz-eilmore,Rating 5 out of 5,reading sappho while thinking of  her  and my cat purring on my lap is what heaven must be like
39,https://www.goodreads.com/user/show/50030039-andreea,Rating 5 out of 5,"]]work]face]]if not, winter]no pain]]I bid you singof Gongyla, Abanthis, taking upyour lyre as (now again) longingfloats around you,you beauty. For her dress when you saw itstirred you. And I rejoice.In fact she herself once blamed meKyprogeneiabecause I prayedthis word:I want-•-He seems to me equal to gods that manwhoever he is who opposite yousits and listens closeto your sweet speakingand lovely laughing—oh itputs the heart in my chest on wingsfor when I look at you, even a moment, no speakingis left in meno: tongue breaks and thinfire is racing under skinand in eyes no sight and drummingfills earsand cold sweat holds me and shakinggrips me all, greener than grassI am and dead—or almostI seem to me.But all is to be dared, because even a person of poverty"
40,https://www.goodreads.com/user/show/31790398-jamie,No Rating,"I'm fine, I'm not fucked up over this or anything."
41,https://www.goodreads.com/user/show/55004585-emily,Rating 5 out of 5,“you came and I was crazy for youand you cooled my mind that burned with longing”
42,https://www.goodreads.com/user/show/162645483-melissa-aspiring-author,Rating 5 out of 5,Read this ages ago but I still feel the need to shout and scream and sing (even thought I can't sing) about how beautiful it is.
43,https://www.goodreads.com/user/show/98866662-frankie,Rating 4 out of 5,"I’ve been in a Sappho mood lately, and now I am desperate to devour all of her works. This book only half-sated my need, because Carson emphasizes how INCOMPLETE and fragmentary Sappho’s surviving poems are. We have incomplete sentences, and even more short phrases, sometimes a mere word. Sometimes what survives barely makes sense on its own. I know nothing about Ancient Greece and am not a classicist, but that said, there are some poems that I recognized here and enjoyed more when it came from a different translator. Ie, some of the most iconic translations were not Carson’s (though she also has some of my favorite iterations). I’m glad I finally got a copy though. Mine is well-tabbed, well-worn and loved."
44,https://www.goodreads.com/user/show/89541447-hafsah,Rating 3 out of 5,3.5/75☆ — i want to live inside sappho's brain
45,https://www.goodreads.com/user/show/8936844-marijana,Rating 5 out of 5,"Predivno i toliko dragoceno jer znamo da je većim delom izgubljeno. Lepota i dolazi više do izražaja baš zato što su fragmenti i neverovatno je koliki uticaj može da ima jedna jedina reč na stranici, koliki utisak može da ostavi. Mistično, senzualno, sa puno ljubavi i iskrenosti, Sapfo nam se obraća kroz vreme i prostor i nastavlja da živi i potvrđuje sopstvene reči:someone will remember usI sayeven in another time"
46,https://www.goodreads.com/user/show/109701234-river,Rating 5 out of 5,"4.75/5 Sappho gets the full 5 stars, the translator takes off a little. I so wish her works weren't lost, even just the fragments are beautiful."
47,https://www.goodreads.com/user/show/144534181-regulus,Rating 4 out of 5,I’m so very fucking gay
48,https://www.goodreads.com/user/show/83805041-leah,Rating 5 out of 5,"3rd read: ""you came and i was crazy for you. and you cooled my mind that burned with longing""2nd read: i love sappho okay bye-1st read: holy shit this was amazing...""but me you have forgotten or you love some man more than me"" ""i want to say something but shame prevents me yet if you had a desire for good or beautiful things and your tongue were not concocting some evil to say, shame would not hold down your eyes but rather you would speak about what is just""""someone will remember us i say even in another time"" ""full appeared the moon and when they around the altar took their places"" ""moon has set and pleiades: middle night, the hour goes by, alone i lie"" those are some of the favorite ones that i have tabbed."
49,https://www.goodreads.com/user/show/140993376-ria-raj,Rating 5 out of 5,"Sappho, my love…(this book has such a severe chokehold on me. i have read it four times in one week, i take it everywhere i go, i forced my partner to read the entire book in one sitting right in front of me, and i am in the worst reading slump of my life because of it)"
50,https://www.goodreads.com/user/show/138508107-kate,Rating 5 out of 5,Crazy how sappho invented romance
51,https://www.goodreads.com/user/show/125030475-mina,Rating 5 out of 5,"""The rosyfingered moon surpasses all stars. And her light stretches over salt sea equally and flowerdeep fields."""
52,https://www.goodreads.com/user/show/165691608-lucy-hodgman,Rating 5 out of 5,very perfect. some of these fragments are the most beautiful lines of poetry ever and some of them are just like the word “stone” and that is what makes this translation so much fun! i love anne carson! 
53,https://www.goodreads.com/user/show/132775153-soundousse,Rating 5 out of 5,"This probably doesn't make sense to a lot of people, because its just fragments of lost lyrics and thats what made it perfect, i would suggest listening to her poetry sung because it surely feels better than sex with any man lolhttps://open.spotify.com/album/1dU9kx...I might have problems with annes translation but she did what she had to do so..."
54,https://www.goodreads.com/user/show/132970055-npc,Rating 5 out of 5,Sappho had that dawg in her 
55,https://www.goodreads.com/user/show/55127045-robyn,Rating 5 out of 5,"the poems are lovely and anne carson is obviously an icon for a reason but it’s really the fragmentation itself that stands out to me - the dizzying juxtaposition between the clarity & urgency of sappho’s words and the tangible sense of just how much time has elapsed since they were written leaves me a little breathless and awestruck, and i don’t know that i’d feel the whole weight of that if these poems had survived in their entirety"
56,https://www.goodreads.com/user/show/3165683-briar,Rating 5 out of 5,"Had to reread, it's just so beautiful ___________________________Reread:: December 2022Reread: December 2021Reread: December 2020Reread: December 2019Reread: May 2019Read: December 2018"
57,https://www.goodreads.com/user/show/43793386-kiera,Rating 4 out of 5,I wish the poems were more fluid because I loved even the little snippets of them. Obvi there’s a reason why BUT still. The explanations/added story at the end of the poems were my favorite. It changed the perspective of even the one liners. 
58,https://www.goodreads.com/user/show/33341572-nico-lindell,Rating 5 out of 5,imagine writing some gay ass poems on ur lil papyrus/lil lyre and then centuries later some lovesick dyke on a different continent cries reading the surviving fragments of ur poems on her living room floor stunning translation by anne carson
59,https://www.goodreads.com/user/show/39972744-leah,Rating 5 out of 5,The (allegedly) original lesbian! Pretty sad that only fragments are left from what she wrote. Loved the poems nevertheless and enjoyed the little history lesson after.
60,https://www.goodreads.com/user/show/49469177-zachary,No Rating,"Impossible to judge, but fascinating to read. Sad to think how much history has been lost. I found some beautiful writings in here, and some inspiration."
61,https://www.goodreads.com/user/show/96077718-emily-morgan,Rating 4 out of 5,someone will remember us I say even in another time
62,https://www.goodreads.com/user/show/147203-maggie,Rating 5 out of 5,"Anne Carson, poet and Classicist, presents all we have of Sappho in the original Greek and in English translation. Carson indicates with brackets where the papyrus has simply fallen apart or is incomprehensible, which gives a curious flow to most of the fragments. When I read this, I heard some of the lines with pauses; some of the lines overlapped as if multiple voices were speaking, breaking in and over the voice before it.As you sift through chance lines, half-expressed thoughts, you begin to wonder and compose in your head. What sort of dripping cloth? Is it a tear-soaked handkerchief? Is is a bloodied gown? Whose eyes? Why would she not think to touch the sky with two arms? And as you're musing, you're suddenly rewarded (as if poetic contemplation was not reward enough) with whole chunks of poetry, full finished lines and thoughts. The rhythm, which I cannot express in the expected vocabulary of meter, resonated (I hate this word, but nothing else suffices) like all the best lines I've ever read - be it by Tiptree, Szymborksa, or Fitzgerald. These are phrases that I understand, but cannot articulate why. These are ideas that will sit with me and then suddenly pop up years later.And with the turn of a page you're back to the laundry lists of adjectives and nouns, the scraps and pieces that you start again to fit together into something... anything. I could imagine another great poetry project in which the poet tried to incorporate into individual poems some of these phrases or adjectives left behind.Carson's notes are interesting too, even if you're like me and lack any real Classical learning. How this woman manages to dance between Sappho and Emily Dickinson, and Julian, and George Eliot, and Gertrude Stein is beyond my comprehension, but it all works beautifully.That it really - it's beautiful."
63,https://www.goodreads.com/user/show/18695911-daniel-chaikin,No Rating,"65. If Not, Winter : Fragments of Sappho by Anne Carsoncomposition: c ~612-570 bcetranslation 2002format: 389 page hardcover, quite beautifully done by Knopfacquired: library read: Oct 16-19rating: ?What an odd, curious experience. On the left page are the poems in Greek, as preserved, with random bits of letters and lots of gaps. On the right page is the translation, as much as can be translated. It seems to be a very direct translation, although she had to take leaps here and there. And, even in the translation, she preserves the gaps. Some poems consist entirely of half lines. Nothing is filled in. So you scan through lots of oddball scraps, and suddenly get very excited when a complete sentence shows up, or even a stanza!There isn't much left of Sappho, The Poetess of Ancient Greece. Her nine books are lost and only handful of lengthy sections of poems exist - maybe two are complete. All we have is a reputation and a very many tantalizing fragments quoted or found here and there. Carson claims she finds the gaps exciting, as we can imagine our own various completions. She has put together a beautiful book, one for reflection as we look at a page of two incomplete lines and can spend some time, if we like, pondering them. As they are the only thing on the page, we might just do that, and then do it again on the next. Or you might find yourself trying to learn some Greek by finding the reoccurring words, or other such nonsense tasks. I really really like that this book exists. I can't, however, say that I truly got anything useful from reading it. And, if I did, couldn't possibly tell you what that was. "
64,https://www.goodreads.com/user/show/11973316-joshie,Rating 4 out of 5,"How spellbinding and redolent Sappho's fragments are. In their spaces, incompleteness, and briefness lie the beauty of a thousand interpretations and perceptions. Indeed, it's quite a waste to think that most of her works are lost forever and that we must rely on our imagination in envisioning this stunning arrangement of words (""sweetworded desires"", ""goldsandaled Dawn"", ""piercing breezes"") sung accompanied by the gentleness of the lyre — wooing, proclaiming, praising. Other than Sappho's indubitable genius as a poet, Anne Carson's translation is not to be missed. Each ""]"" that designates parts of a papyrus indecipherable / destroyed hints of a much grandeur whole. All is felt and guessed. Moreover, Carson's section for Notes provides fascinating insight on some of her literary decisions regarding the translation, some points theorise for what / for whom perhaps a certain fragment is for. I also marvelled on some of the influences included. ""I don't know what to dotwo states of mind in me""— FRAGMENT 51""you came and I was crazy for youand you cooled my mind that burned with longing""— FRAGMENT 48Throughout the course of reading this, I tend to forget what's missing due to their sheer brilliance alone (""mingled with all kinds of colors"", ""both you and my servant Eros"", ""may you sleep on the breast of your delicate friend""). I'd like to think the lost / destroyed papyri have been sieved; a matrimony with the earth. Oh how much more in their wholeness? Currently, this book is resting on my bed and I sleep beside it. All these nights I leaf through it, more so when sleep would not come, comforting myself with pictures they form in my head; an intimate commune I built for Sappho and me. What an experience."
65,https://www.goodreads.com/user/show/37054611-sorgens-dag,Rating 5 out of 5,"""Someone will remember us i say even in another time""Anne Carson debe ser una de las mentes poéticas más brillantes de nuestro tiempo y es curioso por que sus construcciones beben directamente del pasado y se siente a través de su trabajo la sensación de haber encontrado fragmentos de ese gran mito que el la época dorada de la historia, el pasado glorioso. Carson nos invita en su traducción a conectar con lo sublime y lo bello por que lo bello es lo verdadero como desarrollara en una de sus obras maestras ""Belleza del marido"". Hay que empezar a atrevernos a trascender las meras lecturas desde la política identitaria para redefinir nuestra identidad, en otros términos, en otros lugares. Carson en su prologo lo señala ¿realmente es tan importante leer a Safo solo desde nuestras expectativas identitarias o hay que liberarla para liberarnos a nosotras mismas también de esas expectativas? Hay un mundo sáfico que apenas estamos vislumbrando y está traducción/ re-creación/ resurrección nos da pautas para poder no reapropiarlo sino para poder volver a vivir en el, porque el legado de Safo es nuestro como es nuestro el amor que construyo en las mujeres para las mujeres. Si no el invierno, es parte de esa selección de las grandes épicas femeninas, por que existen, son varías y necesitamos conocerlas. Carson traduce los fragmentos que quedaron del trabajo de Safo pero también se da tiempo de experimentar, nos propone un juego, nos dice: aquí faltan pedazos, pon lo que tu quieras poner ahí. Ella nos brinda su traducción pero el trabajo final de darle sentido pertenece a las lectoras, quienes llenaremos los corchetes vacíos del poema y dotaremos de sentidos y vidas nuevas a Safo.Carson nos presenta un prodigio, el poema que es infinito."
66,https://www.goodreads.com/user/show/2510736-luana,No Rating,"“someone will remember us  I say  even in another time” [Fragment 147]  First read of the year: If Not, Winter: Fragments of Sappho translated by Anne Carson, featuring an inquisitive feline. The first time I read Sappho was through Mary Barnard’s translation, which I did enjoy, yet it felt like there was something missing. The fact that this edition presents the original Greek poem on the facing page, with the verses written as if on a ragged scrap of papyrus, makes the experience more intimate and profound. Brackets and spaces give you a sense of what is absent, allowing you to ponder what the words might have been or even simply basking in the silence of those white empty spaces.Carson says of her method of translation: ‘I like to think that, the more I stand out of the way, the more Sappho shows through.’ In fact, the fragments, despite their broken lines and missing words, are still emotionally impactful, if not even more so. Maybe you might not be able to hear the music, but you might still hear an echo from the past."
67,https://www.goodreads.com/user/show/38874522-madina,Rating 5 out of 5,"maybe i'll put out a proper review later but right now my heart is just aching / bursting with warmth at the same time. these fragments... what would i do to recover them in their full form, tbh. also POETS: USE MORE EPITHETS. smush up words. our sapphic icon would smile at you."
68,https://www.goodreads.com/user/show/35871157-diana,Rating 4 out of 5,"Reading poems at night, such as those from Antiquity, can nonetheless take me to faraway places. Sappho is a GODDESS and she shall always be one.
Moon has setand Pleiades: middlenight, the hour goes by, alone I lie. 
"
69,https://www.goodreads.com/user/show/128506230-laina,Rating 5 out of 5,"i've read a lot of different translations of sappho, and what really stood out to me in this one is the layout. you really get a sense of the tragic loss of her work, and how different things could be if moat of her work hadn't been lost or destroyed :(("
70,https://www.goodreads.com/user/show/136741339-blowjobqueen,Rating 5 out of 5,“we will always be remembered”
71,https://www.goodreads.com/user/show/140003165-vic,Rating 5 out of 5,I will be taking this book everywhere with me
72,https://www.goodreads.com/user/show/2650868-leah-rachel-von-essen,Rating 4 out of 5,"Much of what we know of Sappho's poetry is actually inaccurate. Poets over centuries have filled in, guessed, and translated, but the truth is that Sappho is one of the most iconic poets of antiquity—quoted and referenced by Plutarch, Galen, Aristotle—as well as a queer woman legend, but all we actually have of her poetry is in tattered, halting fragments or quoted excerpts. Here, Anne Carson takes a stab at translating these excerpts, using open brackets to show the reader where lines are missing, giving us a glimpse into the reality of Sappho's verses.I admit I feel lied to! The complete poems of Sappho's I've read are ones with much of the verse filled in or with added context. This was a fascinating look into the truth. Sappho's yearning, evocations of Aphrodite, and discussion of soft throats, bundles of violets, and music are gorgeous and hint at the poetic genius we might have known. She wrote nine books of poetry, but this is all we have, and there's a true tragedy in that (my little bookworm heart wonders whether the Library of Alexandria had copies!)To be honest...I found this volume difficult at times. First of all, my readability pet peeve: footnotes instead of endnotes, PLEASE. The flipping back and forth makes putting the pieces together a lot harder! But rising past my qualms about end notes...they weren't that well done. Included were: comparisons between Sappho and more modern poetry (fun but unnecessary), notes that punted you on to later notes (aren't you supposed to give the explanation at the earliest reference, not latest?), notes that were frustratingly brief and required Wikipedia follow-ups, notes that were so specific they weren't actually useful, and technical notes about where each fragment was found or discovered.Her translation could be opaque at times, and the end notes didn't give any help (someone explain the uninterrupted line ""the blamer may winds and terrors / carry him off"" to me). At times a translation may have been accurate, but the meaning wasn't clear, and the notes didn't help. Some verses could have used some literary analysis from someone who knows more about Sappho than the average reader, but only a few had that. For some of Sappho's most iconic verses, I would have loved some insight into the translation choices Carson made. And sometimes I wondered if Carson failed to make a leap in her insights (ex. might the mysterious use of ""courtesan"" to describe female friends mean something closer to ""lover""?)Overall, I loved Sappho, and this presentation—but wonder if Carson's translation work was let down by the book's execution and the work of the end notes."
