,user_links,user_ratings,review_text
199,https://www.goodreads.com/user/show/76263743-tree,Rating 5 out of 5,"A favorite concept I learned when studying art history is negative space. I often thought of that as I read through these fragments of Sappho’s poetry translated by Anne Carson, because at times what is not on the page is as evocative as what is.It’s unfortunate so much of Sappho’s work is lost, but it’s clear based on the words of others that she was a brilliant writer, and this often comes through in the barest of her remaining words.I know one turn of this book is not enough, I’ll be returning to it often to enjoy what has been left for us, as well as pondering what has not."
200,https://www.goodreads.com/user/show/44321637-janna,Rating 4 out of 5,"""someone will remember us/ I say/ even in another time""Reading this is such an insane experience; I did not realize how fragmented the poems truly are. Sometimes all that's left of a poem is a singular word, so it's like, how do you even begin to derive/construct meaning from a poem consisting of one word? I loved this though. I really enjoyed constructing my own stories/meaning from the poems and I liked Carson's notes at the end. It truly speaks to the power of writing, that a couple of fragmented words or sentences managed to make me emotional."
201,https://www.goodreads.com/user/show/70733763-samhita,Rating 5 out of 5,"correct order to do this in: read prologue, read poems (watching greek for ][), re-reading poem with context on the other side i think this collection shows the importance of a translator more than ever. sappho yearns to be understood but the absence of her complete works renders that impossible. (though, who is to say that access to her full work would make things any clearer? we are still readings the songs without the music and missing half the picture regardless) to quote, “one may say of sappho that a knowledge of erotic things is the chief pursuit of life” erotic like of eros,, so be in love! yearn! desire and crave and fall apart and build again! feel fire under your skin and split your tongue and curse god! sappho said to do so!"
202,https://www.goodreads.com/user/show/3813968-jackie,Rating 5 out of 5,"gorgeous, gorgeous, gorgeous. i feel like...a very strong yearning in my bones wondering what the poems were like in their entirety. anne carson is magnificent. her translation and notes are divine.on my second reading of this, on fragment 168C which is “ spangled is/the earth with her crowns”, i found the joker card of a tarot deck tucked into the page of my library copy. it felt very silly and very right. "
203,https://www.goodreads.com/user/show/60157722-phoebe,Rating 5 out of 5,I think this establishes more than anything that art is one of the only things that transcends time. Even just from these little fragments of her poems you can just tell that she could describe life in a way that not many of us will ever be able to do.“not one girl I thinkwho looks on the light of the sun will everhave wisdomlike this”& “someone will remember us I sayeven in another time”Are especially beautiful (shoutout to “you burn me” too)
204,https://www.goodreads.com/user/show/30178291-fraser-simons,No Rating,"No idea how to evaluate this really. I’ve read like 5 books of poetry, and every time it’s been clear it’s not how my brain is really wired. This, though, has a bunch of incomprehensible gibberish sometimes— as an exercise I tried processing what was there. It’s just not how my brain works. And that feels like a pretty central tenet of consuming this, so I won’t rate it. Wouldn’t know what to rate it, otherwise. Some of the times it was moving, some of the time it was meaningless. "
205,https://www.goodreads.com/user/show/132580693-finn,Rating 5 out of 5,"""Someone will remember us / I say / even in another time.""This book was probably the quickest 300+ page read ever because when they say 'Fragment of Sappho,' they mean it. Some are only one word as is the case for the last 13 fragments. However, it is very beautiful, what remains of her poetry, and it's really interesting to see where words like sapphic and lesbian come from. Loved it honestly."
206,https://www.goodreads.com/user/show/80027756-kolbr-n-matth-asd-ttir,Rating 5 out of 5,"Góð bók! falleg ljóð með góðum útskýringum á því hvernig svona gamall texti er þýddur og hvað er hægt að vera viss um að hún sappho sagði og var að reyna að segja, en einnig bendir á allt það óljósa og hversu mikið af verkum sappho í dag eru bara brot af heilu verki. Hlakka til að fara til Lesbos!!But she goes back and forth rememberinggentle Atthis and in longingshe bites her tender mind"
207,https://www.goodreads.com/user/show/22147703-vehka-kurjenmiekka,Rating 5 out of 5,"A beautiful puzzle box of poetry from over two thousand years ago. Carson's translation is very beautiful. The book has both the original fragmented poems in Ancient Greek and the translation side by side, so it is interesting to compare those two. (Although my Ancient Greek needs some honing. Very badly.)"
208,https://www.goodreads.com/user/show/112299139-andr-crombie,Rating 5 out of 5,“Eros the melter of limbs (now again) stirs me—sweetbitter unmanageable creature who steals in”Notes: Wow.“to what O beloved bridegroom may I compare you? to a slender sapling most of all do I compare you”Wow.“]nor]desire]but all at once]blossom]desire]took delight”Wow.“sweet mother I cannot work the loomI am broken with longing for a boy by slender Aphrodite”WOW.
209,https://www.goodreads.com/user/show/11105280-cassie,Rating 5 out of 5,"i think reading sappho in fragments is the ideal way to read sappho. reading just her own words rather than a recreation is powerful, partly because it does give the sense of some loss, but mostly because it allows sappho to use only her own voice, unfiltered. and her words, even in the fragments, are so provocative of reflection and warmth. “someone will remember us i say even in another time”"
210,https://www.goodreads.com/user/show/83590520-keaton,Rating 5 out of 5,"I'm bowled over every time I read Carson... this time, through both the translations and Carson's notes, was absolutely no different. For all Sappho's majesty - and there is plenty! - I cannot help but be grateful for the wealth of meaning in the notes and all the little references and examinations therein... "
211,https://www.goodreads.com/user/show/124858741-jules,Rating 4 out of 5,"I really liked how the author formatted her translations. Carson added parathesis in the spaces in which that section of the poem did not survive, so it makes the reader understand how much of the poem did not survive time.----------------------------------------------------------------------------Side-note: I think that it is very cool how Sappho wrote: ""Someone will remember us, I say, even in another time"" Because we do 😊"
212,https://www.goodreads.com/user/show/132092381-annie-oke,No Rating,"This work is devastating, not for what it contains, but for what it doesn’t. The tragedy of having only one complete poem remaining from at least 9 books is reinforced by page after page containing just a few words surrounded by parentheses, marking all the areas of the parchment that have been lost to time.I wish I could read all of the poems in their entirety, but I will never get to."
213,https://www.goodreads.com/user/show/44180739-dory,Rating 5 out of 5,"Back To basics, but with Anne Carson’s interpretation of two thousand year old words. Het mogen dan wel zinnen en fragmenten zijn waar je de helft van de tijd te weinig context voor hebt om ze te begrijpen, de vertaling is geweldig en hoe fragmentarisch ook, je kan de liefde voelen door de woorden. Ook na meer dan tweeduizend jaar. "
214,https://www.goodreads.com/user/show/98217465-megan,Rating 5 out of 5,"even though all that remains of some of these poems is just a single word, they made me feel things. fragment 147: 'someone will remember us  I say even in another time'🥺🥺it's all making me want to write gay poetryalso I love that the original ancient Greek is on one side of the page with the translation beside it!"
215,https://www.goodreads.com/user/show/90569603-jamie,Rating 5 out of 5,"The translator does an excellent job of warning readers of the fragments that make up the known collection of Sappho's work. She even romanticizes the ""beauty within the brackets"" or the empty spaces. Additionally, the context she provides as necessary gives a bit more to go off when available or relevant.Regardless of it's brevity, it's a worthwhile read."
216,https://www.goodreads.com/user/show/32898697-celine,Rating 4 out of 5,"I don't know a lot about poetry, and sometimes these fragments were quite...random and nonsensical, but there was also some great stuff in here, and I greatly enjoyed myself reading this. I just love Sappho."
217,https://www.goodreads.com/user/show/51557766-rosie,Rating 5 out of 5,got this for christmas 2019 and have been slowly absorbing a few poems at a time ever since. LOVE a good fragment! shout out to any other fans of aeschylus's fragmentary achilleis
218,https://www.goodreads.com/user/show/35436724-emese-toth,Rating 5 out of 5,:0
219,https://www.goodreads.com/user/show/21603546-maria,Rating 4 out of 5,"I usually have no faith in myself to read this kind of literature, but I must say I thoroughly enjoyed this.""you came and I was crazy for youand you cooled my mind that burned with longing"""
220,https://www.goodreads.com/user/show/63569589-emily,Rating 5 out of 5,"I’m so upset about how short this was. So beautiful, and it hurts to think about how much has been lost.A favorite fragment (147):someone will remember us I say even in another time"
221,https://www.goodreads.com/user/show/75548218-essi,Rating 4 out of 5,I don't know what to dotwo states of mind in me&someone will remember usI sayeven in another time
222,no user info,Rating 4 out of 5,so so beautiful. cant wait to reread when i get a physical copy 
223,https://www.goodreads.com/user/show/84206170-austin,Rating 5 out of 5,(38) you burn me(130) …—sweetbitter unmanageable creature who steals in
224,https://www.goodreads.com/user/show/103068276-sam,Rating 4 out of 5,“you came and I was crazy for youand you cooled my mind that burned with longing”
225,https://www.goodreads.com/user/show/111428415-valentina,Rating 5 out of 5,"""someone will remember us i say even in another time"""
226,https://www.goodreads.com/user/show/118257669-bowiesbooks,Rating 4 out of 5,"I loved this so much. Sappho has such a way with words, so many of the poems were truly beautiful."
227,https://www.goodreads.com/user/show/21201155-palo,Rating 4 out of 5,me encanta que anne carson haga todo bien. 
228,https://www.goodreads.com/user/show/115440382-abigail,Rating 5 out of 5,I actually understand exactly how the Greeks felt about losing her poems because the person who owned this book before me ripped out 15 pages
229,https://www.goodreads.com/user/show/70208577-sarvenaz,Rating 5 out of 5,i need her to write a sequel so bad
230,https://www.goodreads.com/user/show/148220945-hazel,No Rating,Almost as hetero as Achilles...(not very)
231,https://www.goodreads.com/user/show/90967493-june-garc-a,Rating 5 out of 5,"Más sáfica que ayer, menos que mañana. TE AMO ANNE CARSON!!!!Hermoso. Alucinante. Increíble. Me quedo en ese espacio suspendido de los corchetes, todo lo que Safo nos dejó y no llegó a nosotras, pero que nos da la oportunidad/aventura de imaginarlo. ""messenger of springnightingale with a voice of longing"""
232,no user info,Rating 5 out of 5,incredible translation
233,https://www.goodreads.com/user/show/57558278-tamara,Rating 5 out of 5,anne carson’s translation is probably one of the most beautiful ones out there. loved it front to back.
234,https://www.goodreads.com/user/show/33885924-april,No Rating,Carson’s translation was lovely and the notes added helpful context for understanding the text
235,https://www.goodreads.com/user/show/115962052-soph,Rating 5 out of 5,to think that somebody 2600 years ago in a different culture felt the same way i do now... oh i'm sobbing people
236,https://www.goodreads.com/user/show/44271324-kristen,Rating 5 out of 5,anne carson has me having a category 5 big feelings emergency over some fragments written two and a half thousand years ago
237,https://www.goodreads.com/user/show/161205379-rosaceae,Rating 4 out of 5,i need to learn ancient greek asap
238,https://www.goodreads.com/user/show/65628912-salina,Rating 4 out of 5,Del hade fått 5 om inte notsystemet längst bak var högst förvirrande
239,https://www.goodreads.com/user/show/128806107-eleanor-sullivan,Rating 5 out of 5,Much to say! 
240,https://www.goodreads.com/user/show/11582948-riley,Rating 5 out of 5,The legendary sappho lady's and gents
241,https://www.goodreads.com/user/show/80193577-feral-academic,Rating 5 out of 5,*swoons*
242,https://www.goodreads.com/user/show/10091702-christina-6-word-reviewer-lake,Rating 5 out of 5,Seductive fragments left me wanting more. 
243,https://www.goodreads.com/user/show/128432746-danni,Rating 5 out of 5,"i will always wish that more of her complete works had survived to this day, but even the fragments are fantastic. fragment 31 from this book is my favorite. love sappho and love being a lesbian!"
244,https://www.goodreads.com/user/show/112875023-mara-tudor,Rating 4 out of 5,*3.5* Look i understand they are FRAGMENTS because that’s all we have but this was too quick for me! It was so beautiful I just wish we had every word from her 
245,https://www.goodreads.com/user/show/28023926-marina,Rating 3 out of 5,Let’s go lesbians! 
246,https://www.goodreads.com/user/show/5846018-laura,Rating 5 out of 5,"
for when I look at you, even a moment, no speakingis left in me
"
247,https://www.goodreads.com/user/show/70030656-ciara-power,Rating 5 out of 5,of all stars the most beautiful 
248,https://www.goodreads.com/user/show/92162443-seda,Rating 5 out of 5,I am a whore for Sappho 
249,https://www.goodreads.com/user/show/128432738-molly,Rating 5 out of 5,women 🤌🏻✨
250,https://www.goodreads.com/user/show/48546428-annie,Rating 4 out of 5,"Very good attempt at translating Sappho's fragmented poetry. One thing that needs to be eventually amended, though, is the ς's that have mistakenly been used instead of σ. This is pretty significant."
251,https://www.goodreads.com/user/show/104587973-maddie-pearson,Rating 4 out of 5,My greatest wish is that Sappho's poetry was preserved. This was a beautiful way to showcase the fragments that we have. 
252,https://www.goodreads.com/user/show/26418314-alice-kingma,Rating 5 out of 5,‘someone will remember us / i say / even in another time’ - sappho in 500-600BCi’m not okay. 
253,https://www.goodreads.com/user/show/47127308-c-cile,Rating 5 out of 5,ok so i cried and now i'm going to go embroider some quotes on a tote bag
254,https://www.goodreads.com/user/show/102101199-francesca,No Rating,(i don’t rate poetry)
255,https://www.goodreads.com/user/show/76316033-klara-gonciarz,Rating 5 out of 5,"""someone will remember us I say even in another time""Sappho if you only knew"
256,https://www.goodreads.com/user/show/78054591-emma-ariana,Rating 5 out of 5,Sappho did this for the girls and the gays and I can never be grateful enough that she did
257,https://www.goodreads.com/user/show/17700607-sam-thomas,Rating 4 out of 5,"In truth, it's quite difficult to rate this because so much of the original content has been lost to time. Still, the fragments that are mostly complete are quite technically interesting and captivating, and some of the more isolated fragments become quite Nietzschean in their aphoristic terseness."
258,https://www.goodreads.com/user/show/98433952-tsun-tsun,Rating 5 out of 5,This is the gay agenda everyone's been talking about.
259,https://www.goodreads.com/user/show/159264767-gabby-mola,Rating 3 out of 5,would rate it higher if some of the poems weren’t just one singular word. like maybe preserve lesbian poetry better🙄
260,https://www.goodreads.com/user/show/28789176-dannica,No Rating,"Not rating bc even if I was good at rating poetry in general, which I'm not, I still don't think I could rate Sappho! Anyways some of these fragments were very sweet and sad and others struck me as kind of hilarious. An enjoyable read. (I also spent a lot of time in the footnotes, which I wish had been longer... I really wanted more context.)"
261,https://www.goodreads.com/user/show/76547650-laelia,Rating 4 out of 5,3.75
262,https://www.goodreads.com/user/show/29285772-franzi,Rating 5 out of 5,"So, so good!"
263,https://www.goodreads.com/user/show/28004500-rayene-ziadi,Rating 4 out of 5,Anne Carson's use of brackets to highlight all the anti-poems is a poem in itself♥
264,https://www.goodreads.com/user/show/1134884-scott,Rating 4 out of 5,"Anne Carson’s If Not, Winter (2002) is a very beautiful book that makes a flattering frame for the relics of Sappho’s enigmatic verse. Both a musician and poet, Sappho lived on the island of Lesbos 2,600 years ago. Her music has perished, but fragments of her lyrics 	– wedding songs, hymns to Aphrodite, pleas to her brother, plaints for the loss of lovers, a song for her daughter, all infused with great passion and feeling – survive in tattered papyri and ancient commentaries. Of her nine books of poetry, only one full poem and scattered remnants remain, just enough to whet our interest in a poet whose influence was so great in antiquity that she was known as the Tenth Muse. Anne Carson – poet, graphic artist, classical scholar – collects all the crumbs of Sappho’s poetry and offers a translation in clean modern English that’s lyrical and yet so literal that it could serve well as a crib. Her intent, she explains, is to render Sappho “in the plainest language I could find, using where possible the same order of words and thoughts.” True to her texts, Carson gives us not only the words and thoughts of the Greek manuscripts, but the blanks as well.The blanks? Imagine if all we had of Shakespeare’s sonnets were thin strips of words ripped from a few of his poems. What would “That time of year” (sonnet 73) look like? “… thou mayest … or none … which shake … where late … the twilight … fadeth … black night.” The mood is clear, but the full meaning remains a mystery. Readers are faced with the temptation to supply missing words, to fill in the blanks and tell the whole story. It wouldn’t be Shakespeare, but still, how spellbinding. Sappho’s poetry is the same. So much is fragmented, offering only images and moods, that some translators have, well, elaborated upon them, added private thoughts and presumptions in an effort to chink the papyrus’s holes.Carson, on the other hand, doesn’t indulge in this sort of interpolation; that’s not to say, though, that she isn’t eager to have her readers stretch their imaginations and explore possibilities for humor and passion. To allow for this, she makes clear what’s missing in the original; her renderings are incrusted with a rich growth of brackets [ ], used “to give an impression of missing matter” in the original text. “Brackets are exciting,” says Carson, who doesn’t want us to “miss the drama of trying to read a papyrus torn in half or riddled with holes.” For her, “brackets imply a free space of imaginal adventure,” where readers create meanings that the fragments only suggest. So a typical poem (78) reads in Carson’s translation,]	] now	] desire	] but all at once	] blossom	] desire	] took delightIf these are the crumbs, what must dinner have been like? Filling in the blanks can become a warm afternoon's obsession. A few more snippets hint at the richness of the banquet we’ve missed. gathering flowers so very delicate a girl I don’t know what to do   two states of mind in me (shades of Catullus’ Odi et amo)Eros the melter of limbs (now again) stirs me –sweetbitter unmanageable creature who steals in messenger of spring    nightingale with a voice of longing stand to face me belovedand open out the grace of your eyesneither for me honey nor the honey beeyou burn meOr the almost complete poem:Moon has setand Pleiades: middlenight, the hour goes by,alone I lie.If you like the idea of picking through ruins, playing the role of a literary archaeologist, then Sappho can yield a lifetime of pleasure, though her works in translation will take no more than an hour to read. Her fragments are passionate and suggestive, and if you have a speck of Greek you will enjoy Sappho’s original poetry, printed in red on the facing page. The translations are set in Mrs Eaves, a lovely typeface that the designers have leaded very well to balance the acres of white space on each page. In fact, most pages have fewer than twenty words on them, underscoring by their emptiness how much of Sappho’s wonderful poetry has been lost."
265,https://www.goodreads.com/user/show/109468725-loren,Rating 5 out of 5,Stunning. I devoured this in one sitting.
266,https://www.goodreads.com/user/show/137758217-pearl-whitehead,Rating 5 out of 5,"“someone will remember us,i say,even in another time”holy shit"
267,https://www.goodreads.com/user/show/66283516-emma,Rating 5 out of 5,i like this but i think we should organize the fragments to create as many deez nuts jokes as possible
268,https://www.goodreads.com/user/show/28516570-bee,Rating 5 out of 5,Beautiful in its simplicity.
269,https://www.goodreads.com/user/show/62899747-lucie,Rating 4 out of 5,happy pride celery heads
270,https://www.goodreads.com/user/show/62392148-sophia-zuo,No Rating,sweetvoiced little lines!i think i read this book the wrong way.^ thank u chloe for the borrow <3
271,https://www.goodreads.com/user/show/5526556-lara,Rating 5 out of 5,Ler todas as traduções de Sappho pra me apaixonar com ela de novo e de novo. 
272,https://www.goodreads.com/user/show/142012746-mackenzie,Rating 4 out of 5,I think what I liked most about this edition was the composition of the text - the use of brackets and spaces is delicate but really gives breath to the missing pieces and lends to a sort of cadence when reading the fragmented works. Definitely a collection I would return to.
273,https://www.goodreads.com/user/show/18795917-devin,Rating 5 out of 5,"']]sinful]'']bitter]]and know this]whatever you]I shall love]]for]of weapons]''you came and i was crazy for youand you cooled my mind that burned with longing''someone will remember usi sayeven in another time'just fragments of Sappho's poetry remain, lost to time, but even the fragments formed together bring a beautiful collage of lesbian passion, love, longing, despair, and imagery."
274,https://www.goodreads.com/user/show/4569445-joshua,Rating 5 out of 5,"An interesting thing occurred to me while looking up Sappho on Tumblr: there are so many quotes taken out of context. I kept seeing them and saying to myself, “No, that’s not what that means! You can’t just take the first half off and keep the second half! It changes the meaning!” Well, in the middle of this verbal rant to myself I realized that since most of what we have from Sappho is fragments, this is entirely what scholars have to deal with in the study of her poetry. There’s so much that we can only grasp at because we don’t have the context. Take fragment 87E and F (the Anne Carson translation) as an example:]]queen]]]]]to you]]horse]]]What are we supposed to do with that? It is interesting how the broken fragments of what’s left of her poetry can read as some powerful postmodern pieces, but that has everything to do with the translation and the reader rather than the original work. A line like “and I on a soft pillow will lay down my limbs” might seem like it perfectly captures the essence of weariness, but the only reason we have it is because Herodian cited it because of the interesting word used for “cushion” (here translated as “pillow”). As to what the poem is actually about--well, your guess is as good as anyone else’s, because that’s all we have of it. The image is powerful, but in the end, the power lies mostly in the reader, unfortunately. We have no context to put the lines in, so we have no way of knowing if it is a bittersweet statement--resting after trouble--or a statement of simple serenity or even a statement of sensuality.Reading her poetry, for the most part feels like participating in a detective story, grasping for clues to find the meaning. That’s all you can do--read what the scholars think of it and wonder.Since having this realization though, I’ve found a pleasurable way to pass the time. I’ve been taking down books of poems from my shelf--Keats, Wordsworth, Lawrence, Whitman, Shakespeare--and broken up their poems into fragments. It’s difficult to repeat the concept behind actual fragments, since there’s no real way to unconsciously break up the poem--the mind naturally tends towards making patterns--but it is interesting to see some more familiar poets in a similar light as Sappho. In the end, it makes me appreciate even more all the works that we have complete, despite all the elements that could’ve removed them from us entirely."
