,user_links,user_ratings,review_text
118,https://www.goodreads.com/user/show/54680202-yu,Rating 3 out of 5,"""I would rather see her lovely step and the motion of light on her face than chariots of Lydians or ranks of footsoldiers in arms.""""You came and I was crazy for you and you cooled my mind that burned with longing""""Virginity virginity where are you gone leaving me behind? no longer will I come to you no longer will I come""It's hard to explain why I don't strongly love Sappho. The words are beautiful even in fragments, although they do seem too feminine and sensual to me. I find it hard to project myself into her poems. There is just something missing there. "
119,https://www.goodreads.com/user/show/119185481-malina-rusu,Rating 5 out of 5,"I'm working on going through each fragment and assigning each zodiac sign one for a TikTok. I fucking love it. None of it makes any sense. She's so ME. Oh, and I paid $18 for a physical copy of this because my hoarder brain found out it was the ONLY Anne Carson in the ENTIRE DFW area. What the FUCK happened to Anne Carson, and why does Texas hate her? I have to admit I originally was looking for anything Anne Carson since I love the bot on Twitter that spews out her quotes, but was pleasantly content with this find instead. I like to think it was fate."
120,https://www.goodreads.com/user/show/11660972-sassafrass,Rating 5 out of 5,"Even fragmented Sappho's poetry is absolutely beautiful and profoundly moving. Trying to pick a favourite would be impossible, so I will just go with one of the final extracts that I adored: 'spangled isthe earth with her crowns'Short, dismantled, and yet still wonderful. "
121,https://www.goodreads.com/user/show/61505135-del,Rating 5 out of 5,"it was not my first time reading this one (more like my 10th time) and it's still as amazing as the first time. sappho will forever and always be my favourite poet, and anne carson' translation is the best one in my opinion. "
122,https://www.goodreads.com/user/show/6098324-anya,Rating 4 out of 5,YAAAAAASSSSS MY QUEEN YAAASSS
123,https://www.goodreads.com/user/show/5695312-lyd-havens,Rating 5 out of 5,"considering i went out and got one of these fragments tattooed on my arm while i was reading this book, i would say i liked it very very much."
124,https://www.goodreads.com/user/show/16208084-joanne,Rating 5 out of 5,someone will remember us i say even in another time !!!!!!
125,https://www.goodreads.com/user/show/62028049-madeline,Rating 5 out of 5,"""someone will remember us		i say		even in another time""god i love this book so much. always a good reread. "
126,https://www.goodreads.com/user/show/77650205-sol,No Rating,i want this to make me gayer
127,https://www.goodreads.com/user/show/103090537-cosmina,Rating 3 out of 5,3-4?The structure killed me but Sappho was good
128,https://www.goodreads.com/user/show/51053585-alice-x1f52e,Rating 5 out of 5,The fact that we will never get the full piece breaks my heart
129,https://www.goodreads.com/user/show/148593009-lily-mae,Rating 5 out of 5,"Someone will remember us, I say, even in another time.God I love Sappho "
130,https://www.goodreads.com/user/show/75799600-ab,Rating 4 out of 5,"I've read fragments of Classical authors in the past but none have left me with such an enjoyable sense of discovery and curiosity as these Fragments of Sappho. For me, this is especially the case in the fragments that survive on Papyri. Carson presents the fragments as what they are, frustratingly fragmentary. It is quite easy to get bogged down in looking only at the English translation, and I found myself doing this on several occasions. In many ways, looking only at the English translation can impart the feeling of a complete poem. That is, the translation imparts a sense of completion in many of the poems. But taking the English translation alongside the Greek and paying close attention to the brackets used to note breaks in the surviving stanzas is a gratifying experience. This experience is gleaning complete words among the unintelligible fragments. Carson provides a real sense of curiosity and discovery that I was completely absorbed in. While the more extant poems drew my attention in this way, a special shout out has to be given to Carsons treatment of the really damaged papyri. These too were a real joy to read. There were many times I was left staring at the few surviving words and trying to picture to myself what the poem may have actually been like. Most importantly, Carson really added a special touch to these fragments, adding copious footnotes discussing the potential meanings and contexts. Sappho and this translator were a real treasure and I am very happy that I picked up this book. The more extant poems were very good and my personal favorite was the arrival of Hector and Andromache to Troy. This is definitely something I will be coming back to over the years.Translators please take note at Carson's work. I cannot but help to appreciate her when she openly admits that she may be reading a fragment completely wrong and provides a second translation/meaning. I really appreciate a translator discussing things like this instead of the shallow translators notes that usually come in ""public"" translations. In general the footnotes were well done and really brought a whole new sense of understanding to the fragments. "
131,https://www.goodreads.com/user/show/91798595-isabel,Rating 5 out of 5,"Como estoy en una red social que me pregunta ""qué pensaste"" y no una crítica o comentario para una revista de publicación o difusión, puedo decir: Anne Carson tkm. Todo sus trabajos inspiran, porque hay algo en la manera en que los ejecuta que es ded(l)icada y minuciosa, pero sin ambiciones. Esta traducción de Safo es bellísima, bellísima y explicativa, pues nada queda al azar:""I like to think that, the more I stand out of the way, the more Sappho shows through. This is an amiable fantasy (transparency of self) within which most translators labor. If light appears""Anne Carson quiere ser un instrumento de la palabra de Safo, respetar su métrica, su sintaxis y las ausencias de texto a través de corchetes. La hace correr veloz los siglos que nos separan y la vuelva continua.Los poemas son una compilación de manuscritos y comentarios de otros autores grecolatinos que hacen referencia a ella. La temática es el amor, lo erótico, la guerra, la noche, y por la forma en que están organizados, pareciera que ninguno se concibe sin el otro. Espero que alguien traduzca esta maravilla de libro algún día, con todo, con los comentarios, con el griego, el inglés y la otra lengua, con todo sí:""and lovely laughing—oh itputs the heart in my chest on wingsfor when I look at you, even a moment, no speakingis left in meno: tongue breaks and thinfire is racing under skinand in eyes no sight and drummingfills earsand cold sweat holds me and shakinggrips me all, greener than grassI am and dead—or almostI seem to me..."""
132,https://www.goodreads.com/user/show/26715359-lidija,Rating 5 out of 5,"Are you not amazed at how she researches all at once the soul the body the ears the tongue the skin all as if they had departed from her and belong to someone else? And contradictorily in one instant she chills, she burns, is crazy and sensible, for she is in terror or almost dead. So that no single passion is apparent in her but a confluence of passions. And her selection (is I said) of the most important elements and her combination of these into a whole achieves excellence. Fragment 31 - Longinus, On the Sublime 10.3"
133,https://www.goodreads.com/user/show/150421891-erin,Rating 4 out of 5,"first of all anne carson is a genius. second of all i feel like i could see so many different love stories, platonic or familial or romantic, charted in these fragments from antiquity. was also interesting to see how the concepts from the greek plays were intertwined with these poems, some motifs even carried over like purple robes from the agamemnon or the concept of pain as dripping or yoking as a symbol of marriage as well as subjugation““someone will remember usI sayeven in another time.”"
134,https://www.goodreads.com/user/show/35744860-emma,Rating 5 out of 5,"This was so good that I found myself sitting on the (very hard, might I add) floor in my hallway having devoured the whole thing by midnight, when I had only meant to open it and have a quick look on my way to the living room (and a fairly comfortable sofa). Even in just the few fragments of what’s left of her work, Sappho manages to speak through time and space and pull on my 21st century heartstrings. What I wouldn’t give to read the poems and hear the songs that have been lost."
135,https://www.goodreads.com/user/show/56491386-kirsty,Rating 5 out of 5,"I have read Sappho’s work before, but in a different -and far more old-fashioned translation. Carson brings such vitality to this collection, and I love the way in which it has been rendered as a bilingual edition, with the breaks in the originals honoured. Gorgeous and intriguing, this translation gives one so much to muse over."
136,https://www.goodreads.com/user/show/57140730-marisa,Rating 5 out of 5,"This is a beautiful collection of Sappho's poetry. All but one of the poems are fragmented, and there is this ghostly magic about them where you can only guess at the remaining lines, gathering what is left of a poem with just a few phrases or words. Anne Carson’s notes at the back of the book also were helpful to understand the historical, mythological, and linguistic context. I loved this so much I may even buy it."
137,https://www.goodreads.com/user/show/15855398-nur-banu-simsek,Rating 3 out of 5,"Occasionally very beautiful and makes you grieve the loss of the complete works, but simultaneously not enough to draw you in fully. Carson's translation and translator's notes did add to the experience -- which is very ephemeral and focused gently on sensuality. I definitely will revisit a few fragments, but overall was not my cup of tea. "
138,https://www.goodreads.com/user/show/30156485-kerrie,Rating 5 out of 5,"  ""let there exist for us not one single further sorrow.""  There's no way I can efficiently and completely express how much I cherished and loved this book. The fragmented words of sappho are beyond haunting and beautiful. I highlighted and tabbed too many excerpts to even list here. I fell in love with every word. "
139,https://www.goodreads.com/user/show/18461352-kyo,Rating 5 out of 5,"A very good and interesting translation by Sappho! I feel like everyone knows or at least has heard of this translation, in the sense that it does not try to reconstruct the poems and thus to fill in the gaps. It makes you very aware of both what is lacking but at the same time it enhances the aesthetic of the fragment. While that does sound pretty (read: very) pretentious, it's actually pretty accessible (there's both a glossary and notes on the poems in the back)! Anyway, if you're interested in lyric poetry or just a very interesting read, I'd definitely recommend it!"
140,https://www.goodreads.com/user/show/46216233-mary-stuart,Rating 5 out of 5,"Lovely lovely lovely… Anne Carson is such a powerhouse when it comes to translating Classical Greek literature, and this is no exception. I kept having to resist the urge to underline and mark pages in the library copy I read. Sappho’s poetry is such a comfort to me. Even the more fragmented pieces seemed to form poems of their own. It was beautiful. "
141,https://www.goodreads.com/user/show/55551568-txell,Rating 4 out of 5,"Dead you will lie and never memory of youwill there be nor desire into the aftertime—for you do not share in the rosesof Pieria, but invisible too in Hades' houseyou will go you way among dim shapes. Having been breathed out."
142,https://www.goodreads.com/user/show/113649107-dorian-lou,Rating 4 out of 5,yes most of it is nonsensical yes it altered by brain chemistry in some irreparable way. so what
143,https://www.goodreads.com/user/show/113022204-olivia,Rating 5 out of 5,but me you have forgottenor you love some man more than me 
144,https://www.goodreads.com/user/show/44291702-eliana-chow,No Rating,This makes me ache with the weight of the vast expanse of stories lovingly told yet left unremembered.
145,https://www.goodreads.com/user/show/152118931-dorothy,Rating 5 out of 5,Even the poems in which only one fragment has been recovered are still so beautiful.
146,https://www.goodreads.com/user/show/112757815-izzy-rose,Rating 5 out of 5,"""someone will remember us, I say, even in another time."""
147,https://www.goodreads.com/user/show/77043951-ouliana,Rating 4 out of 5,"when she wrote ""you came and i was crazy for you // you cooled my mind that burned with longing"", people died. i'm people"
148,https://www.goodreads.com/user/show/102978501-brittany,Rating 5 out of 5,"Was going to be 4 stars for solid poetry (of course) but then Anne Carson swooped in in those back 30 pages to teach me what a PRIAMEL is! Also annual beauty pageants at the shrine of Hera on Lesbos? Also also, the admittance of ""I may not have this translation correct! Did you know that the Greek word for Burn has a history where, in this case she could mean erotically inflamed or she's beseeching a God to slow broil her passion because they're the cook of the Gods?"" A history and linguistics lessons in my poetry book? Please and thanks (and Happy Pride ❤️)!"
149,https://www.goodreads.com/user/show/33199497-andrea,Rating 5 out of 5,"""among mortal women, know thisfrom every careyou could release medewy riverbanksto last all night long""go off, girl (i gotta read the complete works of sappho now)"
150,https://www.goodreads.com/user/show/176254369-vi,Rating 5 out of 5,Absolutely beautiful composition of yearning and the human experience 
151,https://www.goodreads.com/user/show/125252550-viv-megenhardt,Rating 5 out of 5,Oh my GOD
152,https://www.goodreads.com/user/show/37482483-cait,Rating 5 out of 5,"@ first i was considering leaving this four-starred bc i in my nonexistent wisdom was like 'ugh anne carson didn't let this be gay enough' but then the post-poetry addenda got me w*t for language and it was back up to five!!! anne carson is the only one, the onlyin sum: i genuinely feel in anne carson a kindred spirit in her endless linkage and fascination, i love her, i love herkenning + [whatever the adjective equivalent of a kenning is i'm blanking rn i guess epithets but like not strictly] highlights: sweetflowing flute, sondelighting clearsounding lyre, sweetworded desires, goldsandled Dawn, girl sweetvoiced, honeyvoiced, mythweaver, manyskilledlotta snippets + favs below the cutfr. 16: ""Some men say an army of horse and some men say an army on foot [/] and some men say an army of ships is the most beautiful thing [/] on the black earth. But I say it is / what you love.""fr. 22-23fr. 31fr. 34: ""stars around the beautiful moon / hide back their luminous form / whenever all full she shines / on the earth // silvery""fr. 36: ""I long and seek after""fr. 38: ""you burn me""fr. 44Aa: ""Virgin deershooter wild one the gods / call her as her name. / ]Eros comes nowhere near her / ]""fr. 45-48fr. 56: ""not one girl I think / who looks on the light of the sun / will ever / have wisdom / like this""fr. 74A-Cfr. 94fr. 96: the whole thing BUT especially ""you like a goddess / and in your song most of all she rejoiced. // But now she is conspicuous among Lydian women / as sometimes at sunset / the rosyfingered moon // surpasses all the stars. And her light / stretches over salt sea / equally and flowerdeep fields."" (see Song of Songs, transl. Blochs, ""Every maiden calls her happy, / queens praise her, / and all the king’s women: / ‘Who is that rising like the morning star, / clear as the moon, / bright as the blazing sun, / daunting as the stars in their courses!’"")fr. 102: ""sweet mother I cannot work the loom / I am broken with longing for a [ ] by slender Aphrodite""fr. 104A-Bfr. 112, esp ""gracious your form and your eyes / as honey: desire is poured upon your lovely face"" (also if I get married I'm FULLY playing on the could-be-ambiguity of the full word 'bridegroom')fr. 126, 142fr. 130: ""Eros the melter of limbs (now again) stirs me-- / sweetbitter unmanageable creature who steals in"" (Carson's note: ""'unmanageable': a word made from the root machan- (cf. English 'machine') and cognate with words for 'contrivance, device, instrument, means, technique.' Eros is a creature against whom no technology avails."" no weapon formed against u shall PROSPER)fr. 146: ""neither for me honey nor the honey bee"" (Carson's alternate translation: ""mellowsmelling honey / yellowstinging bee / honey, Honey? / no not me"" god i LOVE her)fr. 148fr. 154156: ""far more sweetsounding than a lyre / golder than gold""- Carson's note on 3.11: ""all night long""- her note on 22.10: yoke-mates, wives, comrades- her saying that Snell's Discovery of the Mind is ""still worth considering FOR ITS IRRITANT VALUE,"" sick-burn capslock mine (from her note on 51)- her note on 104a: ""I read somewhere once that ancient marriage rites may have included a burning of the axle of the chariot that brought the bride to her bridegroom's house--no going back""--I READ SOMEWHERE ONCE, ANNE, JESUS, see that footnote that's like 'this came to me in a dream'- her commentary on ""shamefastness"" in her note on 137, as well as saying that ""The word translated 'shame' in the first and fifth lines of the fragment is much more interesting in Greek: aidōs (also rendered 'reverence, respect, shamefastness, awe, senese of honor')""- her calling Apridite ""lay[ing] the dying adonis in a bed of lettuces"" ""anthropologically provocative,"" ANTHROPOLOGICALLY PROVOCATIVE WE ONLY STAN TALENT- the whole bonkers note on Isaac Casaubon in the note on 147.1 but: ""Casaubon's emendation of mnasthai to  in fr. 147 ('did remember' to 'will remember') is generally accepted, if dull, and makes me think of George Eliot's final assertion in the novel [Middlemarch]: 'Every limit is a beginning as well as an ending.'"" GENERALLY ACCEPTED, IF DULL. DRAG HIM.- the fact that Hekebolios was ""a sophist who taught rhetoric to Julian at Constantinople"" who had to ""[change] his religion three times to keep up with imperial whim"""
153,https://www.goodreads.com/user/show/1291116-dana-desjardins,No Rating,"Reading this translation is like beachcombing: you find only fragments, made more beautiful by their weathering and context. Without the scholarly notes at the back (and I love Carson's humor!), the words are just lightning flashes against a dark sky. It is tedious to read a paragraph of explanation for three words, but Sappho's legend warrants no less. I was left wanting so much more."
154,https://www.goodreads.com/user/show/12060143-floreana,Rating 5 out of 5,"""because I prayedthis word:I want"""
155,https://www.goodreads.com/user/show/5825926-maria,Rating 4 out of 5,"I just sat down in a bookshop and read this in 30 minutes which honestly felt a bit illegal.However, I found a lot of fragments I really enjoyed so I thought I could share some:"" ] you will remember] for we in our youthdid these thingsyes many and beautiful things""*""and I on a soft pillowwill lay down my limbs""*""of all the stars most beautiful""*""gathering flowers so very delicate a girl""*""someone will remember usI sayeven in another time""*and a special shout out to:"" ]to you]  ] horse"""
156,https://www.goodreads.com/user/show/87291547-anthony,Rating 3 out of 5,Sappho was the Milk & Honey of her era.(minor update)I heard someone say this is the equivalent of a dude saying their favorite book is Fight Club or American Psycho. Had a good laugh about that one. 
157,https://www.goodreads.com/user/show/17241396-j,Rating 4 out of 5,"Sappho was a musician, her lyric poetry was composed to be song. She lived in the city of Mytilene on the island of Lesbos from 630 B.C. It is assumed that due to political affiliations she was exiled to Sicily between 604 and 595 B.C.The Greek philosopher and historian Strabo said of Sappho, 'Sappho an amazing thing, For we know in all of recorded history not one woman who can even come close to rivaling her in the grace of her poetry'. She was called 'the tenth muse' by Plato. One poem has survived intact all the rest are fragments. Her words are sensual, beautiful and put down with great passion and sometimes frustration.""no tongue breaks and thinfire is racing under skinand in eyes no sight and drummingfills earsand cold sweat holds me and shakinggrips me all, greener than grassI am and dead- or almostI seem to me.""Sappho subverts the male literary epic tradition. 'O immortal Aphrodite of the many coloured throne'. As Mary Beard says in her essay ""Sappho Speaks"", Sappho is echoing 'the words of the hero Diomedes in the midst of battle in the fifth book of Homer's Iliad when he prays for help to the goddess Athena'. Showing us the distance between the male domain epic heroism and female private concerns. Sappho is reinterpreting Homeric epic to give it a fresh female meaning. From soldiers in battle we leap to women in love. Sappho subverts the language. ""I would rather see her lovely step and the motion of light on her face than chariots of Lydians or ranks of footsoldiers in arms.""Anne Carson the translator of this work is director of graduate studies in Classics at McGill University Montreal. Carson uses brackets and line breaks in the text where there are holes or breaks in the papyrus. She also provides notes on the text for those who want a more in depth reading.This is an interesting format in which to present the work as if you the reader are reading the papyrus with all it's breaks and gaps. There is a parallel translation with the Greek provided on the facing page. She is very strict about translating word for word rather than translating the flow or feeling so this is not a loose presentation of the work. You find yourself filling in the gaps. As it is a faithful reflection of the work, some pages have only two or three words on them. I'm sure somebody more interested in poetry can appreciate and find beauty in the spareness of the book. I found myself surmising about what was left out by cause of destruction. It's an interesting approach, in a sense the incompleteness encourages the reader to engage more with the work. Still in my opinion this faithful plain approach doesn't always reflect the passion of the work fully but is true to it.""Eros shook mymind like a mountain wind falling on oak trees""Sometimes her words are prescient.""someone will remember usI sayeven in another time""."
158,https://www.goodreads.com/user/show/67751253-liz,Rating 4 out of 5,*sobs* ——————————I HAVE IT I HAVE IT I HAVE ITTTT *screams incoherently* Also I hate Amazon more than I already do bc the cover is bent and I want to go Murder TM something now but FIRST. Time to read lesbian poetry on Valentine’s Day bc I am also a lesbian poet and it’s very meta of me —————————-Alright y‘all how to take my mom’s credit card and sneak the cash back into her purse so I can buy this without being suspicious. Because I need this like yesterday.Edit: *REMEMBERS MY MOM FOLLOWS ME ON GOODREADS* WAIT-haha mom of if you see this no you didn’t *nervous sweat*
159,https://www.goodreads.com/user/show/86530527-ld,Rating 3 out of 5,"i really enjoyed the formatting for this book, it illustrated well how fragmentary the surviving remains of sappho's work is and i like the presentation of the original greek alongside the translation. a lot of the notes in the back were a bit dense/academic for me so i might seek out some other books on sappho and her writing that have more general context and information."
160,https://www.goodreads.com/user/show/145863-owl,No Rating,"‘He’s equal with the Gods, that man’He’s equal with the Gods, that manWho sits across from you,Face to face, close enough, to sipYour voice’s sweetness,And what excites my mind,Your laughter, glittering. So,When I see you, for a moment,My voice goes,My tongue freezes. Fire,Delicate fire, in the flesh.Blind, stunned, the soundOf thunder, in my ears.Shivering with sweat, coldTremors over the skin,I turn the colour of dead grass,And I’m an inch from dying. ________‘Stand up and look at me, face to face’Stand up and look at me, face to faceMy friend,Unloose the beauty of your eyes.....duhh, baru nemu beberapa doank puisinya, hiks..:("
161,https://www.goodreads.com/user/show/2608238-chrystopher-s-archive,Rating 4 out of 5,"Of course, I went into this read knowing that, on some level, it would be unsatisfying. After all, how else can a fragment be defined? Part of a larger, missing, whole. But the translator did a fantastic job changing the trajectory from a dry presentation of the crumbs history has left us to a poetic, melancholy longing for something more. And the end-notes are as interesting to read as the fragments themselves, opening a tantalizing new window behind the translated words.Highly recommend. I'm thinking I might need my own copy."
162,https://www.goodreads.com/user/show/109558610-eilidh-fyfe,Rating 4 out of 5,"4.5 - It’s devastating to see how fragmented and how little we have remaining of Sappho’s lyric, every piece is like having the person you want to listen most to in the world being cut off at every opportunity. Everything she says sets the mind racing.Only criticisms would be is that I feel Carson had a tendency to present readings that undermined the lesbianism of Sappho herself and her companions. Also the published book could’ve been more compact, some 3 word long fragments took up whole pages and I was basically concerned about the environment the whole time. "
