,user_links,user_ratings,review_text
0,https://www.goodreads.com/user/show/91520258-jack-edwards,No Rating,brb sobbing atsomeone will remember us i say even in another time
1,https://www.goodreads.com/user/show/8645302-anna-of-readsrainbow,Rating 5 out of 5,"if i weren't already a lesbian, this would turn me into one
someone will remember usi sayeven in another time
"
2,https://www.goodreads.com/user/show/6431467-s-penkevich,Rating 5 out of 5,"Fuck me up, Sappho"
3,https://www.goodreads.com/user/show/30800-oriana,Rating 5 out of 5,"I love this book so much that I copied out some of the best lines in thick sharpie onto a shirt that I wore so often it's now terribly stained and faded and rather hard to read. An interesting cyclical thing, sort of, given the flimsiness of what remains of Sappho's works. Also, I once had a writing teacher who said we should follow the ""Sappho rule"": every word of your writing should be so good that if there was a great flood or conflagration and only snippets of lines survived, there would still be great beauty and intensity in what was left. Kind of a tall order, but given the state of publishing today, I'd say it's needed now more than ever. "
4,https://www.goodreads.com/user/show/32804270-michael,Rating 5 out of 5,"Intimate, piercing, and incisive, Sappho's fragments are as enrapturing as they are reflective. The subjects of her lyrics range from musing about forbidden love to reveling in the passing of time. Paradoxically, the soft musicality of the poet's phrasing pairs extraordinarily well with the intensity of the emotions she describes in her lyrics: at once the fragments read as tender and visceral. Carson's edition makes for an ideal introduction to Sappho's work, as it clearly marks the many gaps in her extant verse. Whereas editions that don't format the fragments tend to transform Sappho into a kind of sparse Imagist, If Not, Winter forces readers to remember that most of the poet's work has in fact been lost or destroyed."
5,https://www.goodreads.com/user/show/49374500-kimberlina,Rating 4 out of 5,only by the power of lesbians could i get out of my reading slump
6,https://www.goodreads.com/user/show/52545435-elle-ellexamines,Rating 5 out of 5,"
(137) I want to say something but shameprevents meyet if you had a desire for good or beautiful thingsand your tongue were not concocting some evil to sayshame would not hold down your eyesbut rather you would speak about what is just
Sappho (c.630-c.570BCE), one of Ancient Greece’s Nine Lyric Poets, is an absolutely gorgeous poet and writer, one who’s been the subject of much academic discourse. Sappho was a complicated woman. Believed to have written 8 or 9 books, her lover Megara, daughter Kleis, and enemy Andromeda all appear within these texts. Through this translation, Anne Carson attempts to convey the best of her work, through both presentation—sometimes the spacing makes the poem, as with verse 26—and wording, as she discusses in her final notes of the book. For me, half the appeal of this edition was the work put into translation notes by Carson. Her insights on poem 137’s use of the extremely loaded term aidos (shame), and poem 142’s use of the term hetairai (friend) to connote an intimate relationship with a woman, each deepen the meaning of the poem. I also appreciated Carson’s commentary on 16, 55, 94, and 98. I particularly loved her choice to end on the brief verses, page after page of lines with no context beyond. Each line may be brief, but together they are infinite. Carson points out that Sappho associates desire with death, an idea that—interestingly enough—is also a function of queer theory in later times. Lee Edelman would, in his iconic 2004 book No Future, argue that because queerness cannot produce the patriarchal ideal of a Child, it is fundamentally defined by a drive towards death. Though I think this can easily become an oversimplification when applied to the ancient world, I couldn’t help but think of this when reading her poetry. If desire is death, what does it mean that through her poetry, her desire has kept her alive? There is something particularly powerful about a note in Anne Carson’s introduction, where she discusses the fact that much of our remaining knowledge of Sappho comes from references—other ancient artists quoting Sappho, discussing her works, creating poetry inspired by her. I wondered, reading this, what our future histories will look like: Which lines will survive? Which will not?A few of my highlights are listed below. ____(16) Some men say an army of horse and some say an army on foot and some men say an army of ships is the most beautiful thing on the black earth. But I say it isWhat you love.(22)Because I prayedthis word:I want. (26)]frequently]for thoseI treat well are the ones who most of all]harm me]crazy]]]]you, I want]to suffer]in myself I amaware of this]]](55) Dead you will lie and never memory of youwill there be nor desire into the aftertime—for you do not	share in the rosesof Poeroa, but invisible too in Hades’ houseyou will go your way among dim shapes. Having been breathed out. (69)]]sinful](94) I simply want to be dead. Weeping she left mewith many tears and said this:Oh how badly things have turned out for us. Sappho, I swear, against my will I leave you. …(96)…]into desire I shall come(138)stand to face me belovedand open out the grace of your eyes(158)with anger spreading in the chestto guard against a vainly barking tongueI also really enjoyed fragments 23, 31, 74B, 91, 93, 95, 104B, 120, 126, 129B, 137 (commentary here) and 147. I know I’ll return to this collection again, and I’m sure different poems will resonate with me each time. Regardless, I adored this, and am honored to have spent some time with Sappho in 2021. Blog | Youtube | Twitter | Instagram | Spotify | About |"
7,https://www.goodreads.com/user/show/72975-marley,Rating 5 out of 5,"I took high-school Latin, as perhaps a couple of my recent reviews have mentioned. The first poem they ever had us translate in our AP Catullus/Horace class was Catullus' half-translation (""inspired by?"") of the second-most-complete Sappho lyric I think we have: Sappho 31. It's perfectly preserved as far as it goes, because it's in someone else's book and quoted in full in Greek, except that it very likely cuts off suddenly. As Carson translates the original, it begins ""He seems to me equal to gods,"" (I now paraphrase) that lucky man who is standing in front of you and getting to hear your sweet voice. It's every high school crush rolled into one, double-strength for adults. The awe there of a particular type of love from afar. And having your voice stopped up, just as the poem goes on to say. Really, it's the run into the third stanza, which came through just as overwhelming in my own half-proficient high school translation out of Latin when I was 17, that gives me shivers:for when I look at you, even a moment, no speakingis left in meno: tongue breaks and thinfire is racing under skinand in eyes no sight and drummingfills ears.(Nobody seems to be sure whether this stray last line was a mistaken addition in a later copy or whether the jerk of a grammarian we got it from decided to break off one line into another stanza--and Catullus' copy doesn't help either, because after some very gorgeous poetry, he breaks off somewhere ENTIRELY differently right at this point -- starts grumbling about how all this desire is probably just a sign he's got too lazy a schedule. That's the Roman in him, even though no other Roman appreciated Sappho like Catullus did--all his love poems are to ""Lesbia,"" after Sappho's homeland, which had at the time more sensual and artistic than solely homoerotic connotations.) The PointAnyway, this is a long, nerdy, Goodreadsy introduction, but there's a reason: a poem nearly 2,600 years old, not even in its original language, not even in its entirety, and originally written as a song but with the music lost aeons ago (one wonders whether this is what will happen to Bob Dylan one far-away day)--what I am saying to you is: all these qualifiers, all this in between us and the original impact, and me bored in high school, and it still knocked me flat on my ass.And now you realize there is only one other poem in better shape (from a book of her work as late as the 8th century, which KILLS me that she survived in good shape over 1,000 years but couldn't last more), and every single other one in existence is in pieces--some still getting you most of a through-line, others just one or two or three words. Shattering.And of course, this is exactly what Carson plays up, translating every tiny snowflake of parchment we've ever been able to trace to Sappho, every time some stodgy grammarian or hokey philosopher quotes half a line to keep his audience from falling asleep--and showing you as best she can how much is lost, and how much you can tell through this incredibly hazy lens how fantastic a poet she clearly was.And I'm getting frustrated, because this input form has eaten half my review twice already (starting to feel like our subject, here), but I'm going to lay out what this means if it kills me:The way Carson shows you the gaps are with the power of ASCII art: brackets, brackets everywhere. Left hand page is always the Greek, laid out in the SHAPE of what remains, brackets to show the yawning gaps in the ripped or torn or blotted parchment, and to show the little interpolations that remain. Right hand page is her English--still using brackets, but gesturally, to give you a sense of the ""papyrological event,"" as Carson says in her introduction--and desperately trying to translate only the words that remain, to show you that lack that is also need that is also desire.How else to behold:]noble]taking]sing to usthe one with violets in her lap]mostly]goes astrayand realize even those few words come from two full stanzas we will never see, and not go as silent as the lover in that first poem I mentioned, trying to grapple with the passion for life that still blazes out of this gorgeous, tragic confetti?"
8,https://www.goodreads.com/user/show/5114433-liz-janet,Rating 4 out of 5,"""Someone will remember usI sayeven in another time""Sappho was an ancient Greek poetess from the island of Lesbos, but little is known of her life, with mostly fragments of her work surviving, which are often not taken as biography. So little of her works survives, that it is known she was exiled from Lesbos after the rise of Pittacus, but very little of her political standing has been discovered. “yet if you had a desire for good or beautiful thingsand your tongue were not concocting some evil to sayshame would not hold down your eyesbut rather you would speak about what is just” Sappho wrote with wit and sharpness, but so soft and beautiful, that I would love to listen to her fragments being sung, they create a space of peace within me. It makes me happy. “Evening you gather backall that dazzling dawn has put asunder:you gather a lamb, gather a kid,gather a child to its mother.” It is to say, that a poem written 2 millennial ago, by an ancient woman, not to my eyes in its native tongue, and not even in its entirety, still survives and is widely read, loved, admired, and studied, is to show the magnificence of the author."
9,https://www.goodreads.com/user/show/138125050-li-reading,Rating 5 out of 5,I bloody love anne carson
10,https://www.goodreads.com/user/show/53165-warwick,Rating 4 out of 5,"•Greek Lyric: Sappho and Alcaeus, tr. David A Campbell, Loeb 1990•If Not, Winter: Fragments of Sappho, tr. Anne Carson, Virago 2002•Stung With Love: Poems and Fragments, tr. Aaron Poochigian, Penguin 2015SAPPHICS FOR SAPPHOEach ellipsis teases, inviting dreams – dreamsFormed from torn papyruses' single words. Bare,Lonely scrawls of sigmas and psis that sing, still,      Sticky with meaning.Fragments all. What's left is the one percent, rich,Rare. When Alexandria burned, the whole worldChoked to breathe the smoke of the ninety-nine. Now,      Desperate to get youBack, we trawl millennia-old unearthed dumps,Hunting out your clotted Aeolic strung lines.Lone hendecasyllables' sounds that awed Greeks      After you quoted. Questing, reading, marvelling – so we search on,Poets seeking answers to questions all lostLovers ask. Your answers still reach us, drenched, fresh      From the Aegean.A LIFE IN FRAGMENTSTowards the end of the second century AD, in the last flickering light of classical Greece, a philosopher called Maximus, in a city on the Levantine coast, wrote a grammatical textbook about figures of speech. Casting around in old books for examples of how poets have described love, he writes: ‘Diotima says that Love flourishes when he has abundance but dies when he is in need: Sappho combined these ideas and called Love bitter-sweet and “ἀλγεσίδωρον”.’So we have this one word that Sappho wrote, some eight centuries before Maximus was born. This is what we mean when we talk about her poetry existing in ‘fragments’. The Canadian poet Anne Carson translates this example as:171paingiverVery often these remnants are quoted with no regard to any poetic quality, but rather in illustration of some grammatical point. Apollonius Dyscolus, for instance, writing again some time in the 100s AD, included a throwaway remark on variant dialects during an essay on pronouns. ‘The Aeolians,’ he said, ‘spell ὅς [‘his, hers, its’] with digamma in all cases and genders, as in Sappho's τὸν ϝὸν παῖδα κάλει.’ Again Carson's translation gives us just the phrase in question:164she summons her sonCarson's translation of Sappho's oeuvre is well subtitled ‘Fragments of Sappho’, since most of what's left is of this nature. It's certainly nice to have everything collected in this way in English, though it must be admitted that her book sometimes seems more an exercise in completionism than in poetic expression. That said, as other reviewers have pointed out, reading pages and pages of these deracinated terms (‘holder…crossable…I might go…downrushing’) can succeed in generating a certain hypnotic, Zen-like appeal.Nevertheless, such things lose a lot by being read in isolation; the as it were archaeological pleasure of digging them out of their original context, in works of grammar or rhetoric, is completely absent. For that, the Loeb edition translated by David A. Campbell is far preferable, for all that he has no pretensions to being a poet, just because you get Sappho delivered in that context of other writers. The fonts used for the Greek are also much more readable in the Loeb. (The Carson edition does include the original Greek, and points for that – though there are some strange editorial…choices? mistakes? – such as printing ς for σ in all positions.)MUSIC AND LYRICSTo the Ancient Greeks, Homer was simply ‘The Poet’ – and ‘The Poetess’ was Sappho. She was held in extraordinarily high esteem, which makes it the more frustrating that so much of her has been lost: ninety-nine percent, according to some experts. Only one or two poems remain that can be said to be more or less complete.Her poetry is mainly ‘lyric’, that is, designed to be sung while strumming along on the lyre. Sappho was, in modern terms, a singer-songwriter; she was known to be an extremely talented musician, designing a new kind of lyre and perhaps even inventing the plectrum. When we read her poetry now, we have to remember that we're looking at something like a shredded collection of Bob Dylan or Georges Brassens lyrics, with no idea of how their meaning would have interacted with the music.But however important the lost melodies, we do know that she was revered for the beauty of her phrasing. This is something translators struggle with. Fragment 146, a proverb about not wanting to take the bad with the good, is rendered literally by Campbell as ‘I want neither the honey nor the bee’ and by Carson, ‘Neither for me honey nor the honey bee’ – which is better, but consider the alliterative dazzle of the original:μήτε μοι μέλι μήτε μέλισσα(mēte moi meli mēte melissa)Reading the Greek, even if you don't understand what any of the words mean, will often get you halfway there with Sappho. Say it out loud and you'll get a tingle, as it starts to dawn on you what all the fuss might have been about.But the rest of the job has to be done by translators. The Loeb edition will not help you here: its prose translations are only a crib to help you study the original. Carson's approach is slightly conflicted. She quotes approvingly a well-known statement from Walter Benjamin to the effect that a translation should ‘find that intended effect…which produces in it the echo of the original’, i.e. that one should translate ideas and feelings rather than words. But she also claims to be trying to use ‘where possible the same order of words and thoughts as Sappho did’, which is the sort of thing that makes me instantly suspicious.Here's her version of Fragment 2, which is one of the more complete poems we have, scratched on to a broken piece of pottery which has miraculously survived from the second century AD. The first stanza (an invocation to Aphrodite) is probably missing, but the next two run like this:]here to me from Krete to this holy templewhere is your graceful groveof apple trees and altars smoking      with frankincense.And it in cold water makes a clear sound throughapple branches and with roses the whole placeis shadowed and down from radiant-shaking leaves     ��sleep comes dropping.This is not bad. I think the word order is unnecessarily foreign at times, but it does sound good and Carson even includes a few of Sappho's famous hendecasyllabic lines – though they are not true ‘Sapphic’ verses, a very strict form which is not well adapted to English (as you may be able to tell from my attempt at the top of this review).Aaron Poochigian, in a selected edition for Penguin Classics, takes a different approach. ‘Sappho did not compose free verse,’ he chides, perhaps with one eye on Carson, ‘and free-verse translations, however faithful they may be to her words, betray her poems by their very nature.’ Poochigian's version of the stanzas above goes like this:Leave Crete and sweep to this blest templeWhere apple-orchard's eleganceIs yours, and smouldering altars, ampleFrankincense.Here under boughs a bracing springPercolates, roses without numberUmber the earth and, rustling,The leaves drip slumber.I think that's pretty great. It takes much more liberties with Sappho's actual words but, to the extent that it produces a sensual thrill in English, it more faithfully reproduces the effect that Sappho had on her original audience. At least, to me it does. Poochigian's selection, called Stung with Love, is much shorter than the other two I read, but a very good encapsulation of her qualities. It also has by far the best introduction, a brilliant essay which puts Sappho in her context extremely well. And because it's the most recently published, it's also able to include the magic new Sappho poem discovered in 2013, written on a scrap of papyrus used to stuff a mummy.BIGGER THAN A BIG MAN‘Someone will remember us / I say / even in another time.’ Another fragment. The irony of this one upset me at first, because she should have survived in far greater quantities than she did. But even so, the thrill of hearing the voice of a woman who lived six centuries before Christ was enough to catch my breath over and over again. Generally speaking, women in antiquity are pretty silent. But Sappho isn't, and her influence, despite the meagre remains we have, is ginormous.It might sound hyperbolic to claim that all modern love poetry is inherited from Sappho, but in fact there's a very real sense in which that's true – so great was her reputation among Classical writers and the Europeans who, in turn, studied them, that it's quite possible to trace a direct line from Sappho, through Catullus, to the Romantic poets and from them to contemporary pop lyrics. Every song about the pain of unrequited love owes something to Sappho's Fragment 31, for example – ideas now so clichéd that we forget they have an ancestry at all. That's just natural, surely – just the way people speak? But no, it isn't natural, it's Sappho. She's part of our inheritance, part of our language. She's under our tongue."
11,https://www.goodreads.com/user/show/108125111-persephone,Rating 4 out of 5,"may you sleep on the breast of your delicate friendi wish Sappho, i wish ... :''"
12,https://www.goodreads.com/user/show/131243077-freya,Rating 5 out of 5,kinda gay lol
13,https://www.goodreads.com/user/show/3144945-alex,Rating 5 out of 5,"We have almost none of Sappho, the Bob Dylan of ancient Greece, the most famous poet of like 600 BCE. What we have is aching and mysterious and sexy. As my friend JG pointed out, there's an intimacy here that feels modern. A lot of the old Greek stuff feels like dudes standing around yelling (because a lot of it is drama). Sappho's in the room with you, whispering in your ear.For her dress when you saw itStirred you. And I rejoice.In fact she herself once blamed meKryptageneiabecause I prayed this word:I wantSome of the other fragments, you're a little confused by. If Not, Winter collects every surviving Sapphic word, which is a few poems and a heap of scraps, and that's noble but you may find yourself asking, what good does this do anyone?I had a girlfriend in college with this tattooed on her ankle, probablyBut Anne Carson is not just a mighty translator but a poet herself, and she's off on her own trip here, making a sort of found poetry out of these fragments, a larger statement about echoes and loss. And it works: it has a cumulative power, skimming over all these snatches and breaths.Their heart grew coldthey let their wings downI mean, cumulative power and also it reminds you of those refrigerator magnet poetry sets on the fridge at someone's party right before someone rearranges it to sound dirty.Who even knew they had soda back then?"
14,no user info,Rating 5 out of 5,When Sappho’s fragments are better than everyone else’s complete poems you know she’s an actual goddess. Sappho and Carson are a match made in Elysium.
15,https://www.goodreads.com/user/show/126347706-zo,Rating 4 out of 5,"“your sweet speakingand lovely laughing—oh itputs the heart in my chest on wingsfor when I look at you, even a moment, no speakingis left in me”4.5 Being Sapphic is so beautiful.Books around the globe: Greece"
16,https://www.goodreads.com/user/show/19742661-nemo-pagesandprozac,Rating 5 out of 5,"""But now she is conspicuous among Lydian women as sometimes at sunsetthe rosyfingered moon surpasses all the stars. And her lightstretches over salt seaequally and flowerdeep fields."" -------""someone will remember usI sayeven in another time""(this last one is particularly poignant because it makes up the entirety of the poem. damn.) "
17,https://www.goodreads.com/user/show/28365883-elizabeth-plant-based-bride,Rating 5 out of 5,"someone will remember usI sayeven in another time(Fragment 147)If Not, Winter was my first introduction to Sappho's writing, and I have been thoroughly bewitched. It is incredible to me that these ancient words, rescued from damaged papyrus and recovered from walls and vases, can be so relevant and evocative thousands of years later. Sappho writes of many things, but love and beauty are at the forefront. In these difficult times, being reminded that we are only human and that we are just as lost and small as we were in ancient times brings a strange sense of comfort. We are all connected in the ever-expanding family tree of humanity, and if only we could value love and beauty in the ways Sappho did, perhaps we would know peace.For the man who is beautiful is beautiful to seebut the good man will at once also beautiful be.(Fragment 50) You can find me on...Youtube | Instagram | Twitter| TikTokYou can join our book club over on Patreon... (this was our book club pick for June)PBB Book Club"
18,https://www.goodreads.com/user/show/102819965-rosemarie-bj-rnsdottir,Rating 5 out of 5,"these fragments of sappho’s poems are so so beautiful. her poems have such a quiet longing and sadness to them while still being so full of passion.here are some of my favourite fragments:fragment 31“your sweet speaking and lovely laughing—oh it puts the heart in my chest on wings for when I look at you, even a moment, no speaking is left in me”fragment 34“stars around the beautiful moon hide back their luminous form whenever all full she shines on the earth silvery”fragment 51“I don’t know what to do two states of mind in me”fragment 55“Dead you will lie and never memory of youwill there be nor desire into the aftertime-for you do notshare in the rosesof Pieria, but invisible too in Hades' houseyou will go your way among dim shapes. Having been breathed out.”fragment 95“but a kind of yearning has hold of me—to die and to look upon the dewy lotus banks  of Acheron”fragment 147“Someone will remember usI sayeven in another time” fragment 168B“Moon has set  and Pleiades : middle night, the hour goes by, alone I lie.”"
