,user_links,user_ratings,review_text
195,https://www.goodreads.com/user/show/5134026-paula-lyle,Rating 4 out of 5,Some books you cannot read so much as experience. 
196,https://www.goodreads.com/user/show/7345695-laura,Rating 2 out of 5," I feel exhausted. Take me, Echthroi."
197,https://www.goodreads.com/user/show/3887790-rachel-rooney,Rating 3 out of 5,I don't know if I will keep going with this. I just don't get why people love these books so much! This is probably closer to 2.5 stars for me than 3.
198,https://www.goodreads.com/user/show/82824168-jay-demoir,Rating 1 out of 5,This book was unbelievably boring
199,https://www.goodreads.com/user/show/3202732-wendy,Rating 2 out of 5,Got tired of meg whining. 
200,https://www.goodreads.com/user/show/65249206-tyler,Rating 2 out of 5,the mitochondria is the powerhouse of the cell
201,https://www.goodreads.com/user/show/63028700-henry,Rating 4 out of 5,"A classic which very successfully weaves science, fantasy and faith into a beautiful story."
202,https://www.goodreads.com/user/show/9086236-chaitra,Rating 2 out of 5,"One of the things I wanted to know in this book was what happened to Camatosz. Turns out A Wind in the Door is set two years after A Wrinkle of Time, and there is no mention of Camatosz. Neither are Mrs. Whatsit, Who or Which present. I should have liked this better, and I might have, if I didn't feel like throwing things at all characters except for maybe Charles Wallace. What is it with Meg? There's her six year old brother, black and blue because he gets beaten by bullies in his school, talking about how difficult it is for him to be the brilliant son of two brilliant people. Meg, agreeing with him that their parents didn't do them favors, but in her case it's because she'd never be as beautiful as her mother. Her brother is very sick and hurting and this is what she thinks of. God Meg, get some perspective, why don't you. Then we get told over and over that she loves her family, and yes, she does, but this girl is so tone-deaf and needy that it's awfully annoying. And there's the giant Teacher, who teaches, I'm not sure what. He says Meg has to do three tasks, and then says he's not sure what the trials are. Meg has to find it herself. She has a partner, a cherubim, who recognizes the tasks for her. Why the teacher was needed, I'm not sure. However, I do think Meg drew the short straw in the Teacher department. We get to meet two other Teachers and both of those seem more responsible than Meg's guy. Especially the snake. And in any case, ancient beings once again shirk their duties and let teenagers do their jobs without even any instructions. There is Calvin. The random dude has a name I can finally retain. He's quite randomly added to the plot even when he's not anywhere close to the events occurring. He is also actually quite sufficient to the plot without actually adding another character, Meg's real teacher. He's okay for Meg's first task and the denouement about what the evil things really are, but there was no real reason for him to join them in their further trials. He gets a choice and he opts to go with them, so it's not like he was ""really"" needed. It's more like Meg gets a chance to throw some exposition at him for the benefit of the reader. But, Meg is usually the one the exposition gets thrown at - in fact she's being told what to tell Mr. Jenkins by the cherubim - so there wasn't any need for Mr. Jenkins' character. I'm not willing to believe in Meg's growth arc yet, because whatever maturity Meg had gained at the end of the first book, there was no evidence of that in the second.This is a book of Madeleine L'Engle's philosophies, and while I don't think they're necessarily bad, there's one thing I really can't get on board with. It's conforming to mediocrity - Charles Wallace is brilliant, others in his school are not, even the teachers. And the solution is for Charles Wallace to hide, to pretend that he is less than what he is, so that the bullies can feel better about themselves I guess. No. One of the main reasons I didn't want to read the first one out loud to my own child is because of the same theory present in the first book. It's a little exacerbated here. Stop protecting the bullies, maybe the kids who are so intimidated by a few big words that they throw punches at little ones are the ones that need adapting, maybe they are the ones who need lessons by beings who do not look like them, and are vastly wiser than they are. (That is why I prefer Narnia, with all its Christian connotations, where one arrogant thing gets turned into a dragon to learn compassion). The final thing that bothered me, and it's not even important at this point, but the end plot is pretty much the same regardless of the setting. There is someone whose arrogance is their undoing (Charles Wallace in the first, Sporos in the second) and Meg is the only one who can save them because she can fill everything with love. It's kind of not even mentioned any more that Meg's intelligence sets her apart, her sole concern is for her appearance. I'm trying to read these with an open mind because this book series is so beloved, but I can't see what others are seeing. "
203,https://www.goodreads.com/user/show/27138736-amy-meyers,Rating 2 out of 5,"Sigh. 2.5, maybe a 3? I don't think I'll re-read this one ever again. There were a lot of things about it that really didn't make sense to me. If L'Engle is trying to help Christians in their faith, she's way too mystical to help much with this one. It actually irritated me at times: She still pushes evolution ""I've been reading Darwin, but he hasn't helped me much,"" says Charles Wallace; I can't tell how much of her science is fiction, how much fact (it seems mostly science fantasy), how much religion; I hate books where the main characters go through ""tests,"" but it's not clear what they are or why?--basically bad plot development; bad character development--why is Mr. Jenkins a major-ish character in this sequel at all??; kything seems like some sort of Buddhism or Hinduism or just plain sorcery but prettier; terms like ""Xed"" that you're not sure how to say for a while...just oddities all throughout it. I didn't feel a tie to Meg or Charles Wallace either in this book or in Wrinkle, but at least in Wrinkle, it was much better. Sometimes the philosophizing is good, sometimes a bit pushy. Some quotes:""Her father must have mentioned the terrible thing which Proginoskes had just shown her, the terrible thing which was terrible precisely because it was not a thing, because it was nothing. She could hear, too clearly, her father's voice, calm and rational, speaking to her mother, 'It isn't just in distant galaxies that strange, unreasonable things are happening. Unreason has crept up on us so insidiously that we've hardly been aware of it. But think of the things going on in our own country which you wouldn't have believed possible only a few years ago.""This reminded me a little of C.S. Lewis:""Meg had turned...at the pain in her mother's voice, and had seen her father reach across the table for her mother's hand. 'My dear, this is not like you. With my intellect I see cause for nothing but pessimism and even despair. But I can't settle for what my intellect tells me. That's not all of it.''What else is there?' Mrs. Murry's voice was low and anguished.'There are still stars which move in ordered and beautiful rhythm. There are still people in this world who keep promises. Even little ones, like your cooking stew over your Bunsen burner. You may be in the middle of an experiment, but you still remember to feed your family. That's enough to keep my heart optimistic, no matter how pessimistic my mind. And you and I have good enough inds to know how very limited and finite they really are. The naked intellect is an extraordinarily inaccurate instrument.'""I wondered if Andrew Peterson got his idea of the importance of names for his Wingfeather Saga from this:""...one of their chief weapons is un-Naming--making people not know who they are. If someone knows who he is, really knows, then he doesn't need to hate. That's why we still need Namers, because there are places throughout the universe like your planet Earth. When everyone is really and truly Named, then the Echthroi will be vanquished."" Mph. This was too close to ""knowing yourself"" postmodern jargon and hate speech connected...didn't feel comfortable with that.I kind of liked the importance of denying yourself in order to grow up...""When Sporos Deepens, it means that he comes of age. It means that he grows up. The temptation for farandola or for man or for star is to stay an immature pleasure-seeker. When we seek our own pleasure as the ultimate good we place ourselves as the center of the universe. A fara or a man or a star has his place in the universe, but nothing created is the center.""I think the conflict resolution was really stupid. She named WHOM??? Are you kidding me???????? Not saying more, because it's a spoiler, but it just doesn't make sense at all, to any Christian. The enemy as presented in this book cannot ever be reclaimed or evil is good and good is evil, and nothing is nothing anymore. Just doesn't make sense."
204,https://www.goodreads.com/user/show/111431082-claire,Rating 4 out of 5,"The sequel to A Wrinkle in Time, this is another short novel that packs a punch with fantastical imagery and a strong set of morals. I picked it up for a little escapism (as a treat), and while some bits reminded me of the struggles our own country and world are facing at the moment, overall I found it a good read. It was great to see some more non-earth characters and settings, though they could have been a bit better developed; my imagination is out of practice, so sometimes it was hard for me to picture them in my mind's eye.Passages that stood out:Meg asked nervously, ""Is it dangerous, this-this ripping in the sky, or whatever it is?""""Meg, we really know nothing about it. It may have been going on all along, and we only now have the instruments to record it.""""Like farandolae,"" Charles Wallace said. ""We tend to think things are new because we've just discovered them.""""It isn't just in distant galaxies that strange, unreasonable things are happening. Unreason has crept up on us so insidiously that we've hardly been aware of it. But think of the things going on in our own country which you wouldn't have believed possible only a few years ago.""Meg had turned from the kitchen sink at the pain in her mother's voice, and had seen her father reach across the table for her mother's hand. ""My dear, this is not like you. With my intellect I see cause for nothing but pessimism and even despair. But I can't settle for what my intellect tells me. That's not all of it.""""What else is there?"" Mrs. Murry's voice was low and anguished.""There are still stars which move in ordered and beautiful rhythm. There are still people in this world who keep promises. Even little ones, like your cooking stew over your Bunsen burner. You may be in the middle of an experiment, but you still remember to feed your family. That's enough to keep my heart optimistic, no matter how pessimistic my mind. And you and I have good enough minds to know how very limited and finite they really are. The naked intellect is an extraordinarily inaccurate instrument.""""If someone knows who he is, really knows, then he doesn't need to hate.""Ahead of her was a tremendous rhythmic swirl of wind and flame, but it was wind and flame quite different from the cherubim's; this was a dance, a dance ordered and graceful, and yet giving an impression of complete and utter freedom, of ineffable joy. As the dance progressed, the movement accelerated, and the pattern became clearer, closer, wind and fire moving together, and there was joy, and song, melody soaring, gathering together as wind and fire united.""You must stop thinking about size, you know. It is both relative and irrelevant."""
205,https://www.goodreads.com/user/show/43483275-andrew-sammut,Rating 1 out of 5,"There are very few books which I give a single star upon completion. This is one of them. It's a shame since I had higher hopes after enjoying the first book so much. Meg being in Charles Wallace created a very weird aura. And if there's a character who knows the names of all the stars in the universe, why doesn't he just go about and name them all before they are wiped out of existence? This volume literally just went about in pointless circles and it just feels as though L'Engle is proud to have created so many new words to describe the universe and creatures which have very little character development despite their lengthy descriptions and extended narrative. Bored me out of my mind ngl I think I am going to get rid of the box set because I don't see myself reading the rest of the series. Frankly, I am surprised that this one has an average rating of 4 stars. At least we get a glimpse of Meg's future love life, Calvin. As a Family Guy enjoyer, the name Meg never rubs me the right way and Meg's character and attitude in this volume is almost as terrible as the family guy Meg who is one of the few characters I despise. They both deserve all the bullying for being pretentious and acting superior just because of their parents' intellect. They should be smarter than that, they should know how to behave socially and what's expected from them by society and how to act in a social context. Both Meg and Charles Wallace suck, one could perhaps also blame the way they were raised. I suppose you could argue that geniuses are hardly ever respected by society but an author has to at least have a shred of intelligence to write genius characters and L'Engle obviously lacks such a trait. The interview provided even confirmed this. There were points in this book that were hardly comprehensible and L'Engle lost her own trail of thought, describing the same scenarios and giving the same details over and over again. Awful read, it's a shame that kids are exposed to such novels because they are hardly imaginative or original. Very disappointed :(What do you think of this one or the series in general?"
206,https://www.goodreads.com/user/show/5082359-bev,Rating 4 out of 5,"Meg Murry and Calvin O'Keefe are off on another fantastic journey. This time to save Charles Wallace and the universe. Charles Wallace is very sick--that is, his mitochondria are very sick. And Charles Wallace is one of those people in history who is so important that their existence has wide-ranging effects. If Charles Wallace dies so too will much of what is. To save Meg's brother, they will need to team up with Proginoskes, a cherubim who looks like a drive of dragons; Blajeny, a cosmic Teacher; Sporos, a farandola (a fictional part of the mitochondria); and...of all people, the despised Mr. Jenkins, school principal.Most of the responsibility will rest on Meg--who is, in the grand scheme of things, a Namer. She has the power to give people and things the understanding of their real name. As Proginoskes tells her, once people really know who they are, they don't have any reason to hate. Hate and war give power to the Echthroi (likened to fallen angels) who are driven to un-Name everything and destroy all of creation. Meg is given three tests--through which she learns how to name, how to love--even those we don't really like, and how to overcome power of un-Naming. She draws strength from her friend Calvin and from Mr. Jenkins--who learns to value his own worth enough to make sacrifices for the children. I can remember reading this series as a child and loving the mysteriousness, adventure, and wonder. It is very easy to lose yourself in L'Engle's world and not worry whether everything makes sense or not. She has a very sure way of combining science with religious themes that makes them all tie together very nicely and gives reader very interesting battles between good and evil that capture the imagination as well as entertain. It was great fun to revisit the world of the Murrys again and lose myself in fantasy as I did when I was young.First posted on my blog My Reader's Block."
207,no user info,Rating 3 out of 5,"“The Time Trilogy” is a set of three science fantasy books written by Madeleine L’Engle, including: A Wrinkle in Time, A Wind in the Door, and A Swiftly Tilting Planet. In the second book, A Wind in the Door, Charles Wallace is feeling ill. Ms. Murray identifies a problem in the farandolae of his mitochondria. On top of that, he is also being bullied and isolated at school because of his extremely high intelligence. His school principal, Mr. Jenkins, refuses to protect Charles. One day Charles tells Meg about a drive of dragons that Charles has seen roaming around. Meg gets proof of this when she finds weird feathers. They also identify the dragons as a single Cherubim. The Cherubim is led by a humanoid creature named Blajeny. Benjy then tasks the kids with defeating the echthroi, the things that been destroying Charles Wallace's Farandolae. Meg's first task is to differentiate the real Mr. Jenkins from the two ecotri fakes by trying to find the potential good in him, which meg is successful in. Instead as viewing Mr. Jenkins as a purely hatred filled person, she views him as, “ something deeper, more real, beyond, past, through the senses, something which was the true person” (455). This shows that it may not seem like it, but there is good in everyone. The protagonists then travel into Charles Wallace's mitochondria to persuade a larva farandolae to pursue its role as a mature fara. However, Mr. Jenkins is invaded with the echthroi and the cherubim has to sacrifice himself to save them. In my opinion, this story was a little but easier to follow that the first because you are already familiar with the characters, so you can understand the plot better. However, I didn't know that there was any relation with the previous book besides the characters and that made the story seem a little odd and out of place. The conversations seem a little bland and not smooth enough to seem realistic. Overall, the second book is similar to the first in that it is too fantasy-like to be fully convincing."
208,https://www.goodreads.com/user/show/53920101-shannon-greene,Rating 2 out of 5,"I feel sort of bad for giving this low of a rating, because this is such a quintessential children's novel and because Madeleine L'Engle is such a legendary author. But try as I might, I could not get into this book.First of all, it is super weird that in this book there is absolutely no mention or no connection to ""A Wrinkle in Time,"" the first book of the ""Time Quintet."" Meg and Calvin and Charles Wallace had previously gone on this crazy adventure to rescue Dr. Murray, and yet their experiences are never once discussed even in passing. It is like ""A Wind in the Door"" is completely standalone book with no connection to ""A Wrinkle in Time.""Furthermore, it is as if no character development happened between ""A Wrinkle in Time"" and ""A Wind in the Door."" Throughout the whole second book, Meg was still the same insufferable, whiney girl that we discovered at the beginning of the first book. She had traveled to other planets and other galaxies in ""A Wrinkle,""--risking her own life for her father and her brother--yet she was still disbelieving and hard to convince during her adventures of this book.Finally, the book had a super abrupt ending. There was this huge buildup with a lengthy amount of time introducing the characters, explaining farandolae and mitochondria and Echthroi, and going over the need to be ""Named."" Then, there is quite a bit of time spent on Meg's first ordeal (naming the true Mr. Jenkins) and Meg's second ordeal (getting the farandola Sporos to deepen). Then, very quickly, readers are moved to the third ordeal, and then it is over in flash and a bang. Suddenly, they are all back in Charles Wallace's room as if nothing had happened.Overall, the most redeeming quality of this book was the idea of being ""Named,"" and that everyone has something within them that is worthy of being loved, even the mean principal Mr. Jenkins."
209,https://www.goodreads.com/user/show/30079754-octavia-cade,Rating 3 out of 5,"I know there are people that simply love this series, but I've yet to manage anything more than basic liking. It baffles me, mostly. There's a lot of it I do like - and I liked this better than Wrinkle in Time, if only because less of it is this strange semi-religious view of the universe. Basically, as in the previous volume: I like the characters. By which I mean the human characters. The determined mysticism that wafts around all the non-human characters leaves me absolutely cold, though. And when that mysticism touches the human characters, I kind of stop caring about them too. Let me give an example: I felt much, much more for Meg when she went to see Mr. Jenkins to try and stop her little brother being bullied than I did when she was in screaming agony from the creatures that wanted to X her. That... doesn't do much for suspension of disbelief.I do see what L'Engle is trying to do, and I'm going to keep reading the series regardless, but if a children's fantasy series is going to play with spirituality and the structure of the universe, then the approach that Philip Pullman takes, in his Dark Materials universe for example, is one that really speaks to me. This doesn't. And that's alright, because different approaches appeal to different people... and L'Engle's approach, I can't help it, reminds me of crop circles and crystals and all things woo. Meg's parents can be as super-sciency as can be, but when their daughter is dancing circles within the mitochondria of cells as they sing to the universe, while mentally communicating with an invisible dragon who is really a cherubim, well. This is the type of thing little Fox Mulder ate up with a spoon, I bet. "
210,https://www.goodreads.com/user/show/29990277-chad-ryan,Rating 3 out of 5,"I wanted to like this book more than I did.Conceptually, the book is really cool. I love how L'Engle jumps around from the cosmic to the microscopic, ultimately to show the interrelatedness of all things (which our fixation on size & time masks, which results in seeing reality as fragmented). (Whereas A Wrinkle in Time took the characters further & further out into expanse of the universe, A Wind in the Door takes them further & further into the recesses of the human cell!) The bizarrely diverse cast of characters are quite fun, and they also demonstrate interrelatedness, but of a different type: of the material, magical, & spiritual dimensions of reality. In terms of themes/meaning, like A Wrinkle in Time, there are a number of dialogues w/ gems of thought-provoking wisdom. (I especially liked the concept of being ""X'ed"": you either join the bad guys and get X'ed...or you join the good guys and allow yourself to be X'ed--either way, you will getted X'ed. L'Engle brilliantly leaves unresolved the question of the fates of those who have been X'ed in these two different ways, ultimately leaving it up to the reader to discern what fate God [I suppose?] assigns them to.)But there are significant weaknesses in this book. Although the concepts, characters, & themes are entertaining & thought-provoking, they are also half-baked (or even a quarter-baked in some cases!). This is mostly b/c there are simply too many of them! Some concepts aren't given enough space to be developed, and others are developed extensively but poorly so that it is difficult to understand what it even is (e.g., naming/loving, kything). As for themes/meaning, I'm convinced that it's a difficult book to analyze b/c the book itself isn't even sure what it's about."
211,https://www.goodreads.com/user/show/74548615-jane-maloy,Rating 5 out of 5,"This is the second installment of the ""wrinkle in time"" series and I just find her writing so very endearing. The emotions and innocence between the characters is beautiful and adorable all at the same time. I love the relationship between the siblings ESPECIALLY. The imagery that she uses is so thematic to today's world even though it was written 50 years ago. She explains (on multiple levels) how caring for your peer is caring for yourself and she also dives deep into the theme of depression and the allure of feeling nothing and how nice that must be. There are characters that try to derail their lessons purely by saying ""come with us and you will be nothing and FEEL NOTHING"" and to so many people fighting depression this rings SO TRUE it's incredible. Lastly, she talks about looking for the good in people who you are certain are you enemy and find that good and holding on to it for dear life because it could save you. Empathizing with others will save us all <3 Going to take a break from this series for awhile because it honestly takes up a lot of head space to imagine all the things she wants you to imagine.Favorite quotes: ""she saw with a flash of intuition that her kything was like a small child's trying to pick out a melody on the piano with one finger, as against the harmony of a full orchestra""""I don't understand your feelings. I'm trying to, but I don't. It must be extremely unpleasant to have feelings.""""Meg sighed with a kind of anxious fatigue"" ""But human begins need Deepening places too. And far too many never have any. Think about your deepening places, meg."" ""It is only when we are fully rooted that we are really able to move."" "
