,user_links,user_ratings,review_text
117,https://www.goodreads.com/user/show/28598311-d-viaurvandil-ericsson-e-pereira,Rating 5 out of 5,"I read A Wrinkle in Time several years ago and loved it, so recently decided to reread it and continue with the whole ""Time Quintet"". A Wind in the Door greatly surpassed my expectations. I always hold the highest esteem for books that are not only enjoyable to read, but that call me to something higher and have the moral depth to continue doing so for the rest of my life. 	Having recently celebrated another birthday, welcomed my second child into the world, and begun seeking spiritual help for some long-term struggles, I have been recognizing the dire need for authentic and deep relationships with people whom God has put in my life to help me toward holiness. I have tended to be 'transactional' in my dealings with others and turned to myself as the only person I can really know and understand. There are glimpses though, of times when I was able to lay aside concern for myself, open the ears of my heart, and listen to the soul that was in that moment interacting with me -- time of particular tenderness with my wife, time of awe-struck wonder at the birth of my children, time of shared grief at the senseless loss of a family member. It is these glimpses that A Wind in the Door peers through and turns into mighty gusts of inspiration to love. To know somebody, to truly know somebody, and to love that person in truth and spirit, that is one of the highest heights of human experience.	To know someone, to love someone as he is, and to see the Good in him when one is tempted to see only the Bad is a spiritual weapon. It is one of the primary spiritual weapons God uses with us to fight off the seductions of Satan and his demons. When one has received Christ in death and rebirth, has been anointed to be His ambassador, and partakes of His Body and Blood, one can more easily recognize those times when the temptations of the Enemy only lead to a personal un-doing, to a disintegration of the person that is only truly whole when serving God. This starts with God seeing one as he truly is, the faults, the heart, the desires, the potential, and the good one has done and will do. He meets such a person where he is – as He met Abram with his desire to be a great nation and turned him into the spiritual father of countless billions, as He met the apostles and turned their nets to a much more important catch, as He met the woman in sin and transformed her future. God starts by seeking us out, seeing us bare and raw, and asking us to follow – there is no greater way to destroy the machinations of devils than this.	We too have this power. How many accounts do we have of martyrs willing going to their deaths and converting the dutiful soldiers around them? How many have been brought into the Faith because the liturgy was so beautiful that those who were looking for Heaven didn’t know if they had suddenly entered it? How many have had their lives uprooted from a diseased tree and grafted into Life because of a heartfelt listening, talk, and wise counsel? How many passions have been starved due to loving discipleship from a caring leader? Countless many. This power comes from a heart full of love, especially the kind of love God has for us.	A Wind in the Door shows us how something as simple as finding a way to love someone unlovable is greater than being able to move mountains, how a little girl, unsure of herself, misfit, and not popular, shows herself mightier than angels and more important than queens. She is powerful because she learns how to love.	Loving someone is not always easy, nor does it seem Important to love in little ways everyday. A kind response even when exhausted is a little thing and a little love, a letter received in the mail is a little thing and a little love, a chat over a pot of tea is a little thing and a little love, but they have the power to set someone on to greatness, and in that little act of love, a person can be a hero.	One has the temptation to view the ‘little things’ in life as of hardly any cosmic significance. This is especially true of those who love epic fantasy literature of heroic eucatastrophes or science-fiction stories which explore the extreme limits of human experience and speculation. But the everyday actions of a typical daddy at home – reading bedtime stories, playing hide-and-seek, getting honey-do lists done, or picking up flowers and a card for one’s wife “just-because” – are not easily understood as Significant.	Significance comes though, not selfish honor, or grand adventure, or danger and suffering, but how your actions weave into the tapestry set before you. How are your actions, no matter how mundane, contributing to the pattern, design, and beauty that only you, and your unique position can create? Of course, a good number of people have the calling to great deeds of daring, as the need arises and as Providence dictates. As Gandalf says, “All you have to decide is what to do with the time that is given to you.” But a great many of us have deeds need-doing much more pressing than slaying dragons and throwing down corrupt rulers. 	So the tiniest of creatures can be a miracle-worker. A farandolae who lives in a mitochondrion can affect the fate of lives. Sporos of a Wind in the Door can be a slayer of those evil beings who desire to un-make (destroy) everything, even though he is made up of nothing but a few atoms himself! All through accepting his calling in life, to choose to direct his love outward, to others, instead of toward serving his own particular personal fancies. 	You too, stay-at-home mother, are essential to the great Providential rescue of all of history, you too, dutiful husband of a typical job, are a man of great renown, you too, obedient child of the Father, add a necessary gust of breath to the great and mighty Wind in the Door."
118,https://www.goodreads.com/user/show/45513351-lucas-lima,Rating 4 out of 5,"Meg, Calvin e outros seres totalmente esquisitos devem enfrentar a ameaça dos Ectroi, que buscam destruir tudo que há de bom, começando pelo nosso garoto Charles Wallace.Esse segundo volume torna essa história ainda mais curiosa. O primeiro livro, possivelmente por ser o mais famoso da série e pelo filme, torna os personagens e ambientações mais fáceis de serem digeridas. Neste, a mente de Madeleine vai longe. E entendo como isso pode afastar diversas pessoas. Mas, para mim, o como essa história é cativante e as mensagens importantes que nos passam são muito legais. As questões sobre estar e ser, sobre o quão importante no infinito do universo o tamanho realmente não o é, é muito bonito. Não é uma leitura simples, mas por baixo, você tira mensagens importantes. Recomendo."
119,https://www.goodreads.com/user/show/16438074-liz,Rating 3 out of 5,"Didn't enjoy this as much as A Wrinkle in Time. I was hoping for more adventures with Mrs Whatsit, Who, and Which but instead got a bunch of confusing stuff about mitochondria? It started out promising with the Echthroi/duplicate Mr. Jenkinses (which reminded me some of a Doctor Who episode) but once Meg and Co. went ""inside"" Charles Wallace, it was just weird. I kept having to reread passages because I was *so* confused. The overall message of love was good but it got kinda lost in the mess of weird words."
120,https://www.goodreads.com/user/show/30149353-corey-shannon,Rating 4 out of 5,"Ok I see you L’Engle, I see you. If A Wrinkle in a Time was a foundational exposition for the Time Quintet series, providing language and world structure, A Wind in The Door was the first taste of Rising Action and a development in the trajectory of the Murry family’s story. The concept of Teachers and Namers and the calling of Creation to step into vocations like these captivated my attention immediately. I observed it as a unique expression in this storyworld of helping readers to recognize the sacred that blooms in every crevice of Creation, and our responsibility to steward that beauty with care and intention, with the very heart of God that does all things out of love. How glorious a calling to be given to be deemed a Namer, and declare the love of God over another, to proclaim that they are beloved through and through?The way in which L’Engle wove the self-sacrificing love of Jesus throughout every galaxy and microscopic world was invigorating and challenging to grasp, and called out to that piece deep in my soul that longs for the Kingdom to come in full throughout all of creation. I think I’m most impressed by the imagination within writers like Lewis and L’Engle to extrapolate basic gospel truths and weave them so seamlessly into worlds of dizzying glory and complexity. Very excited for the next installment in this series!"
121,https://www.goodreads.com/user/show/32297632-krissy,Rating 4 out of 5,"This was the second book in the A Wrinkle in Time series and was a bit darker than the first book. I missed some of the characters from the first book, but overall it was just as fun and whimsical. There were themes of religion, bullying, and good versus evil, while challenging our perception of what really matters. I would rate this installment as 3.5 stars."
122,https://www.goodreads.com/user/show/56446521-anne-readeatgamerepeat,Rating 3 out of 5,"I kind of regret waiting this long to read this book, it was an interesting read, it was nothing great but it also wasn't bad. It also didn't feel like a sequel in that, apart from all the main characters, there is very little overlap with the first book (this might be because its been a long while since I read the first book and I just don't remember). I liked the premise, it was interesting enough to keep me entertained, but nothing special. "
123,https://www.goodreads.com/user/show/120053009-brendan-dell,Rating 3 out of 5,"Slight disappointment compared to A Wrinkle in Time. This one was not as fun and easy to follow and didn't really have the magic that AWIT had. Also, other than the character dynamics, there was not really an obvious connection between AWIT and this book. Still a decent work of Y/A sci-fi/fantasy, but had higher hopes given the whimsy-ness of AWIT."
124,https://www.goodreads.com/user/show/7228318-michelle,Rating 4 out of 5,I had a little more difficulty with this one than A Wrinkle in Time. Maybe it's because this one was more about what is within you and the connections of everything. But still enjoyed it. Now to get the 3rd one.
125,https://www.goodreads.com/user/show/4700090-angela-johnson,Rating 5 out of 5,I enjoyed this far more than A Wrinkle in Time. Meg is more mature and more palatable to me. The ideas were quite complex. I wonder if children have an easier time imagining the characters and ideas such as Sporos and the Echthroi?I’m excited to read the next in the series!
126,https://www.goodreads.com/user/show/34189280-bekah-craig,Rating 2 out of 5,"Not my favorite by any means. It could just be that I don't read much sci-fi but this was very hard to follow for a children's book. My eight year old concurred. We both found it confusing and not particularly engaging. In fairness, we listened to the audiobook in pieces on several car rides. It probably flows better if you're more intentional about reading it."
127,https://www.goodreads.com/user/show/162568182-desiree-dunlap,Rating 4 out of 5,"It’s hard to sum up the genius of Madeleine L’Engle’s literature. I learn something about God, myself and the world in every book I read. I laugh, cry, and sit in wonder in every one of them. She was masterful. Brilliant and comical and prophetic and revelatory. I’ll never stop learning from her. That’s all - for now 😂"
128,https://www.goodreads.com/user/show/26259-jenne,Rating 2 out of 5,"So much arguing! Especially annoying since I listened to the audio version. Also, a teacher who keeps telling you not to ask questions is not a good teacher. "
129,https://www.goodreads.com/user/show/25580994-enola-stevenson,Rating 4 out of 5,Oh I would have loved this as a kid! Wonderful science fiction fun with a positive deeper meaning beneath... I do enjoy pre-reading books for the boys 💖
130,https://www.goodreads.com/user/show/1164958-robin-reynolds,No Rating,"I enjoyed it in the beginning, but the second half just dragged for me, it was just boring to me."
131,https://www.goodreads.com/user/show/61170697-els,Rating 4 out of 5,"...interesting. Though oddly enough, I fully understand and believe the concept, just not... not this execution."
132,https://www.goodreads.com/user/show/92580791-emma-galloway-stephens,Rating 5 out of 5,I will never be smart enough to understand this book. But I can tell you this is the book I needed to read at the end of 2020.
133,https://www.goodreads.com/user/show/123516897-lia,Rating 3 out of 5,Lepsza od pierwszej części. Kocham to w jaki sposób połączono tutaj naukę z zagadnieniami fantastycznymi.
134,https://www.goodreads.com/user/show/145633851-rachel,Rating 5 out of 5,I definitely did not fully understand the last half but I still loved this book.. I wish I would have read it as a child. Wonder filled.
135,https://www.goodreads.com/user/show/119398280-joyce-t,Rating 2 out of 5,"The first book was better. I didn't like this book nearly as much. Charles is as awesome as ever, but I felt like the plot was just lacking."
136,https://www.goodreads.com/user/show/2085099-christine,Rating 4 out of 5,"Probably more like 3.5, but Madeleine certainly writes lovely books."
137,https://www.goodreads.com/user/show/71843033-sriya-mudumba,Rating 5 out of 5,great book
138,https://www.goodreads.com/user/show/159648479-abby-aguilera,Rating 4 out of 5,"This is one of those books that made me think a lot and I'm still not sure I understood everything L'Engle was trying to tell me. I'm not sure I liked it as much as the first, but it has had me thinking ever since I finished it and that in and of itself is special."
139,https://www.goodreads.com/user/show/164541586-jacqueline-harrison,Rating 4 out of 5,I didn’t think this was quite as good as the first or the third but I still enjoyed it. 
140,no user info,Rating 4 out of 5,This was not as interesting as the first one.
141,no user info,Rating 5 out of 5,"It was a very good book. It has nothing to do with anything that happens in the first book and really isn't a sequel. It is more of a companion book, a story abou the Murrys."
142,https://www.goodreads.com/user/show/63613212-celene-fraticelli,Rating 5 out of 5,Another amazing book by this amazing writer. L'Engle mixes science and magic in the most spectacular way. 
143,https://www.goodreads.com/user/show/9894400-katie,Rating 3 out of 5,"Ehh. I remember parts of this book from reading it as a kid. Not sad that I read it again, but sad it wasn't as good as I remembered. Definitely for a kid."
144,https://www.goodreads.com/user/show/165581436-katie-kaboom,Rating 4 out of 5,"This book isn't as whimsical as the first! Its still really good, I found it more mature than the first book too! Though I loved the new addition in characters, Progo is my everything, I think part of me still loves the first one ! There were moments in this one that had me PAUSE. Because they were so deep and spiritual in their moments; Mr. Jenkins apathy being the biggest discussion to catch me off guard in the best way possible. ""You have to be completely rooted to heal"""
145,https://www.goodreads.com/user/show/30404466-autumnatopoeia,Rating 5 out of 5,"Even better than the first! A blend of mythology and science fiction, like I've only read from C.S. Lewis. Strong themes of love and faith, but with a new perspective. On to book three..."
146,https://www.goodreads.com/user/show/61268875-heidi,Rating 4 out of 5,"Like the first book, the story is simple enough to understand and carries unexpected weight. ""Where doesn't matter.""I enjoyed it and look forward to reading the rest of the series."
147,https://www.goodreads.com/user/show/838641-amy,Rating 3 out of 5,I found myself mainly annoyed while reading this. Seemed like a never ending whine fest but thank goodness for magic and science. 
148,https://www.goodreads.com/user/show/84213695-rae,Rating 4 out of 5,"4.75! I honestly am not sure how I went through life not knowing this was a series of five! Delightful as the first, maybe just a half smidge not as magical, but memorable nonetheless. "
149,https://www.goodreads.com/user/show/7442996-cheryl,Rating 3 out of 5,"Read as a kid after the thrilling experience of A Wrinkle in Time and recall being disappointed. In its defense, it had a hard act to follow!"
150,https://www.goodreads.com/user/show/4777527-ricardo-mar-n,Rating 3 out of 5,"3 / 5Una curiosa mezcla de metafísica, biología molecular y teología, que si bien puede parecer retadora, termina siendo una buena lectura sobre el poder de la amistad y la determinación."
151,no user info,Rating 4 out of 5,"This book was a little harder to follow for the kids but they loved it anyway and were instantly ready for number three when this ended. We had some amazing conversations as a result of reading this book:-love is an action, not a feeling -easy to love those who love you, but what credit is it to you? But to love those who persecute you...- the act of naming and the confusion from un-naming. This was my favorite conversation which flowed into knowing who we are by turning outwards and serving. -the great and real ongoing cosmic battle between good and evil And more! Onto the next book! "
152,https://www.goodreads.com/user/show/37517683-olivia-swindler,Rating 5 out of 5,Madeline L’Engle tells a magical story. I love the way her stories take deep themes and weave them into adventures that are simple yet poignant stories.
153,https://www.goodreads.com/user/show/150601406-lena,Rating 5 out of 5,było sobie życie x biblically accurate angels x filozofia x usa lata 60
154,https://www.goodreads.com/user/show/3194777-viana,Rating 4 out of 5,I remember reading this when I was younger. I didn’t realize until re-reading it how much of it had lodged itself into my subconscious. I liked this story even more than “A Wrinkle in Time.”
155,https://www.goodreads.com/user/show/91407554-deanie-nelder,Rating 3 out of 5,"Unfortunately, the second book in the Time Quintet is no A Wrinkle in Time. While the characters are still as interesting as they were in the first book (maybe more), the plot is all over the place, and the author doesn't go nearly into enough depth to make the book work well."
156,https://www.goodreads.com/user/show/8922262-gus,No Rating,These are the craziest books
157,https://www.goodreads.com/user/show/70579317-jerrod-griebel,Rating 4 out of 5,"""Here we are, at the height of civilization in a well-run state in a great democracy. And four ten-year-olds were picked up last week for pushing hard drugs in the school where our six-year-old is regularly given black eyes and a bloody nose"" (97).And with this quote, Madeleine L'Engle welcomes the deeper story behind her novel A Wind in the Door (the sequel to A Wrinkle in Time). The basic story of this novel is both simple and complex, and it could be summarized in a sentence or two. But the depths of its implications and the layers of its meanings are deeply spiritual, theological, and philosophical. In an effort to save her brother Charles Wallace from a mysterious sickness, Meg joins forces the Teacher Blajeny, the cherubim Proginoskes, her best friend Calvin, and a most unlikely character from her brother's school in order to fight off the Echthroi (fallen angels) and convince the faradolae to Deepen within the mitochondria of Charles Wallace's biological cells. Sound too complex for a young-adult novel? Well, that goes to show the depths that L'Engle is willing to journey in her novels.As I read, though, it wasn't all that hard to follow. And that actually leads to my only complaint: occasionally, the characters spend so much time explaining what's going on to one another that I began to lose interest. I'm sure it's important and necessary for youth reading this book, though, so I can't be overly critical. Why I did give this novel a higher rating though, lies in its references to the Bible and the nature of our existence in a sinful, broken world. On this journey, Meg is partnered with Proginoskes and must complete three tasks, the first of which is to Name which of the three Mr. Jenkinses is the real one (the other two being Echthroi). In doing so, L'Engle alludes to Genesis 2:19-20, looking at the power of humans to Name and speak the truth of someone or something, a power that we often overlook and abuse in our day-to-day lives as we speak of others. Later, Proginoskes is described as putting off ""a violent wind, searing tongues of flame"" (212-213), which is a clear reference to Acts 2:2-3. It's these references, along with quotes like ""If someone knows who he is, really knows, then he doesn't need to hate"" (111) or ""Love. That's what makes persons know who they are"" (114) that give this novel a unique richness that I found so appealing. By no means are L'Engle's A Winkle in Time novels for everyone. But her attempts at speaking spiritual truths in young-adult fiction (especially in writing these during the 1970s, just after the ""sex, drugs, & rock-n-roll"" era) show her tenacity and resilience in speaking truth in fiction.To finish this review, I'll end with a profound, sincere quote that speaks a lot of truth, especially to overly-analytic people like me. At this point in the novel, Meg overhears her scientist parents speaking about the seriousness of what's occurring, both in their son and in the galaxy. (Did I mention there are rips occurring out in the galaxy? Yeah, there's a lot happening in this book.) Amid all of that, though, Mr. Murray says this to his wife: ""There are still stars which move in ordered and beautiful rhythm. There are still people in this world who keep promises. Even little ones, like your cooking stew over your Bunsen burner. You may be in the middle of an experiment, but you still remember to feed your family. That's enough to keep my heart optimistic, no matter how pessimistic my mind.  And you and I have good enough minds to know how very limited and finite they really are. The naked intellect is an extraordinarily inaccurate instrument"" (98, emphasis added)."
158,https://www.goodreads.com/user/show/9636598-hannah,Rating 4 out of 5,"My favorite things about this series so far: L'Engle's creations and interpretations of people and creatures. They're quirky and wild in unexpected ways; I love it. Also, I love how she melds science fiction with fantasy in somewhat believable ways.I enjoyed this sequel to A Wrinkle in Time but not as much as the first. Everything that happened was interesting, but the plot was a bit disjointed. And Meg...is kind of a spaz."
159,https://www.goodreads.com/user/show/127267503-msbzowy,Rating 2 out of 5,"Miałam takie wysokie oczekiwania. I klops. Choć mam dość mieszane uczucia, jestem bardziej na „nie” niż na „tak”. Mnóstwo dziur w fabule, wątki znikąd, biologia, fizyka, astronomia, matematyka i magia w jednym, ale nic nie jest spójne i wystarczająco wyjaśnione. Jeśli ta książka dedykowana jest młodemu czytelnikowi, to bardzo mu współczuję. Postaci są tak słabo zarysowani, że szok. Ojciec Meg? Wspomniany może 2 razy w całej książce, a okazuje się, że jest dość kluczową postacią jeśli chodzi o rozwiązanie tajemnicy. Zmieniłam z 3 na 2 gwiazdki, bo przypomniałam sobie o wielu rzeczach. Hate to say it but porażka. "
