,user_links,user_ratings,review_text
7,https://www.goodreads.com/user/show/2969647-maciek,Rating 4 out of 5,"Growing up in Poland you couldn't escape but be exposed to Polish war movies and dramas. The war defined this country and its people, with the country being completely destroyed and around 5,6 million people dead; because the Western powers trusted Stalin the country borders also changed, with parts of eastern Poland being ceded to contemporary Ukraine and Lithuania. But the rotten top of the cake came when the country fell under the influence of the USSR, and disappeared behind the Iron Curtain for over half a century. However, Polish people are stubborn: the 1980 Solidarity led to the creation of the Soviet's block first trade union, and the subsequent protests formed a wave of reactions throughout Europe, which eventually led to countries breaking away from the Soviet sphere of influence and gaining independence.So what did the Polish people do during all these grim years? And they were grim all right: imagine walking into a store and seeing nothing, literally nothing on its shelves - and then going into another one and seeing empty shelves again, and in another one, and another. Food stamps were not welfare - number of goods one could purchase was limited, with most not being available at all. The black market flourished for those who could afford it, but mostly people stood in long queues to buy whatever was available at the moment. Everything was scarce.This is not Black Friday but a normal Polish week in the 70's and 80's.You'd be surprised to hear that culturally the country wasn't doing so bad. It was during this time that it produced classic motion pictures and dramas, most of which are highly regarded to this day for their witty social humor and relentless mocking and parodying of the opressive regime, in particular its absurd bureaucracy. It was the time when science fiction could be used as political commentary in thin disguise, and so was music. With severe limits imposed on them, people sought to express themselves and to great effect - even in sports. In 1974 FIFA World Cup Poland got the third place (which is practically unbelieveable when you look at the contemporary face of Polish football) after losing 0:1 to West Germany in a dramatic match - the game was goalless for 76 minutes as both teams struggled on the rain soaked field.The war also made an impact on Polish entertainment. Two of the most popular and enduring Polish TV series have both been about it: The first, More Than Life At Stake was a suspenseful espionage drama about a Polish double agent in the Abwehr in occupied Poland, which cleared the streets when it aired as people were rushing to those who had a television set to not miss an episode; the second, Four tank-men and a dog was a whimsical series about the adventures of a T-34 tank crew and their dog in the Polish army. It was largely a pro-Soviet propaganda piece, made to whitewash the Soviets but people loved it - and still do. How I Unleashed World War II is a series of three comic films about a Polish soldier who is convinced that by an incredible strain of coincidences he has started the second World War and wants to undo it, constantly getting himself into trouble on different theaters of war. The movies poke fun at the German soldiers relentlessly and brought some joy to people of the country which suffered so much at their hands. And it is these whimsical films that I was reminded of when I read City of Thieves. David Benioff is an estabilished American screenwriter who wrote screenplays for the HBO adaptation of Game of Thrones and movies such as Troy and X-Men Origins: Wolverine. City of Thieves is purpotedly based on true experiences of his grandfather during the siege of Leningrad.Leningrand is now named Saint Petersburg, and is located near the Gulf of Finland in northwestern Russia. It is the second largest city in the country with over five million inhabitans, and has formerly served as the capital of the Russian Empire. All great Russian revolutions of the early 20th century took place there - the Revolution of 1905, the February Revolution and the pivotal Russian Revolution of 1917 which abolished Nicholas II and ended the Russian Empire and led to the creation of the Soviet Union. After Lenin's death the city was renamed ""Leningrad"" to honor him; the name was changed to Saint Petersburg in 1991. Today it is an important Baltic port and a cultural center - the place of birth of Dmitri Shostakovich, Vladmir Nabokov and Ayn Rand, the setting of Crime and Punishment. Through its middle flows the river Neva, and in its center sits the Winter Palace - the former residence of the Russian Monarchs, described to me by my mother as the grandest building she ever saw.The city is also the site of the deadliest siege in the history of warfare. From September 1941 to January 1944 the German army severed the last land connection. Over a million of Red Army soldiers and hundreds of thousands of civilians lost their lives due to the bombings, famine and terrible cold. In 1945 it received the Soviet honorary title of ""Hero City"" - an award it shares with Moscow, Odessa, Kiev and Stalingrad among others.[image error]Benioff's novel is presented as fiction, although it's more than implied that the material is at least partially biographical - with creative edits here and there - the novel's unnamed narrator lives in Los Angeles and writes ""screenplays for movies with mutant superheroes"", and visits his retired grandparents in Florida. He intends to write about his grandfather's experiences in Leningrad and publish them. The elder obliges: when he cannot remember certain details, he instructs his grandson to make it up - since he is a writer. What follows is a quite engrossing novel which kept me turning the page with intensity way larger that i have anticipated.You have never been so hungry; you have never been so cold. these words open the narration of Lev Beniow, who lives alone in an apartment in Leningrad. His mother and sister fled the city when it was still possible, but he refused; his father - a poet - has been captured by the NKVD, and Lev feels the obligation to defend his home from the invaders. Lev lives in severe conditions, and together with a group of friends they almost make do; one day a dead Luftwaffe pilot falls from the sky, killed not by another plane but by the extreme cold. At attempt to loot the body is spotted by the Soviet officials, and despite the fact that the punishment for looting is death Lev helps his friend (and a secret sweetheart) escape, being caught in her place. He is taken to prison where he is to await his execution, and there he meets Kolya Vlasow, a deserter from the Red Army. Kolya is everything Lev is not - cultured, witty, charming and socially refined, and quite given to bragadaccio, particularly when it comes to relations with the opposite sex.Expecting the worst, Kolya and Lev are brought before NKVD colonel Grechko, who offers them an offer they can't refuse: he will let them live if they can find a dozen eggs. Grechko needs the eggs for his daughter's wedding cake - they're the only missing ingredient. Although he and the boys both know that in Leningrad there are no eggs in Leningrad, he also knows that when put against a wall man can sometimes do what can only be described as miraculous. He has nothing to lose, while the boys have everything. While the colonel might be perceived as kind of a bastard, he is a weird sort of way a likable person: he gives the boy a waiver which will give them immunity from the Soviet soldiers, a hundred rubbles and five days to return with a dozen eggs. There is no use running away: the environment will kill them, and if it doesn't the colonel's men will hunt them down and kill them, and if they are crazy enough to try to leave the city they will be killed by the Germans.And so begins this fine yarn, which despite its relatively short length holds more than a few surprises up its sleeve. Its lenght is not a detriment - Benioff does not aim to write a historical epic about war. His screenwriting expertise will make sure that the narrative is taut and compelling, with new developments occuring quickly one after the other. Although the novel moves very swiftly, the issues it touches upon are never toned down or simplified for the sake of trying to appeal to the audience. The harshness of life in Leningrad is shown well, and the brutalities and absurdities of war (where else would two boys be sent on such a quest?) are on full display, with several brilliant set pieces which are bound to affect any reader - although the novel might at first glance seem to be adressed to young adults, the author does not shy away from the violence, of which there is a fair amount - some of it quite graphic and really effective. None of it is graphic for its own sake, and the novel never descends to a simplistic bloodbath.The main joy comes from seeing the interaction between the two main characters. Lev is a great narrator: an intelligent and opinionated young Russian, who is shy around girls and irritated and frustrated about his situation, his country and his father; Lev is very sympathetic and a great storyteller. Kolya, On the other hand, is a great jester with irresistible charms, one who never stops bragging about his abilities and accomplishments (especially when it comes to women). While Lev is a bit subdued and quiet, Kolya is often arrogant and full of himself, claiming to be an erudite expert on almost anything - from philosophy and literature to warfare and women. As they embark on their quest to find the eggs their friendship progresses, and it's a delight to see it grow. Since the novel is written by Lev's grandson, the wording does not aim to accurately reflect the way people spoke and wrote around the time: the author writes the story as a contemporary man, not one in the 1940's, but it does not take anything from the novel - I would argue that it allows the readers to immerse themselves in it better. Along their way on the quest for a dozen eggs Lev and Kolya meet many colorful characters, all of which are well developed - the author never uses pure stereotypes and cardboard cutouts, and gives weight not only to the main players but to the supporting cast as well. The sense of war and everpresent danger, is strong in this one, but so is the sense of adventure and fun, despite all the horrors and grimness. Benioff knows how to use dark humor and not sound completely cheesy or over the top, never going into the maudling and overly sentimental territory where many other writers would jump right in to squeeze the emotions out of the reader like you squeeze juice out of a lemon. The novel charms its reader, quickly weaving its spell, and suddenly we are completely captivated and unable to put the damn thing down.I had so much fun with reading this novel, which was a very pleasant surpriseWhile it is definitely not a straight account of the siege of Leningrad, I can see it as a great gateway for readers to fuel their interest about that particular place and time (and it is fascinating stuff). City of Thieves is suspenseful and engaging, with great characters and an engaging storyline. I had a marvelous time with this novel, which in its compact size managed to contain an engaging story about coming of age during the war, and all that comes with it - the harshness, cold and hunger, but also friendship, adventure and love. Great stuff!"
8,https://www.goodreads.com/user/show/41918078-debbie-w,Rating 5 out of 5,"This adventure story, which focuses on the relationship between two young men thrust together in search of a dozen eggs over a five-day period in war-torn Leningrad, is filled with tension and black humor - definitely my kind of story! I especially loved the multi-faceted character, Kolya, because I was always eager to hear what he would say/do next! Narrated by Ron Perlman, this audiobook was difficult to put aside when life called to me.Although the setting is during WWII, this is not your typical war story. Heartwarming and heartbreaking - highly recommend!"
9,https://www.goodreads.com/user/show/405390-kemper,Rating 5 out of 5,"A terrific book that proves you don't have to write 700 or 800 pages to have real depth. I'm fascinated by how Benioff managed to describe the characters enduring terrible hardship and the worst of one of the most brutal battles in history, but the book doesn't read as grim or overly depressing. That's not to say that there isn't real drama, horror and sadness, but the natural humor of characters keep it from being just another book about the horrors of war. "
10,https://www.goodreads.com/user/show/730754-ken,Rating 4 out of 5,"You know how annoying it is when a book’s ending is so unrealistic that you say to yourself in disgust, “This would never play out like this in real life!”? It’s happened more than once, right? But a funny thing sometimes happens on the way to the forum. Sometimes your peevishness gets assassinated. Sometimes you’re so damned entertained by a book that you act like a sailor on leave and say, “Ah, what the hell!” Sometimes you’re so amused by the characters that you see that suspension bridge of disbelief and you cross it -- cheerfully, yet.This is the case with David Benioff’s oddly mesmerizing historical foray, CITY OF THIEVES. The quixotic quest book offers a little something for everyone. Russophiles and history buffs will love it because it’s set in Leningrad during the siege, and the author has done his homework, making the setting and background events accurate. Coming-of-age fans will like it because the protagonist, a tough but runty Russian Jew who is only 17, will work his way into the apple core of your heart. Humor enthusiasts will take to it because it is rich with witty badinage, much of it thanks to Kolya, the Red Army sidekick whose libido leads him AWOL and into deep doo-doo with the Russian military.Together, Lev and Kolya are spared death (one for breaking curfew, the other for looking for love when he should have been on guard with his unit) if they can bring back a certain colonel one dozen eggs. Why? The colonel’s daughter is getting married at the end of the week and needs a huge wedding cake in a city that is about as eggless as a grunting rooster. Ridiculous? Sure. Fun? Indubitably. But the sights our heroes come across during their journey are anything but laughable and, at times, downright gruesome.War is hell, yes, but it also offers ironies in spades. Ante up, then, because Benioff is dealing. You might consider Kolya a tad over-the-top, and you might agree with me that the showdown with the Germans toward the end “stretches things a bit,” but what the hell – if you’re charmed, you’re in a good mood; and if you’re in a good mood, you tend to let certain things go. Thus, the suspension of disbelief. Thus, the four stars. Thus, the hearty recommendation, reservations notwithstanding. This one’s a page-turner. This one I think you'll like."
11,https://www.goodreads.com/user/show/8655084-phrynne,Rating 5 out of 5,"What a wonderful book and why have I not read it before? It reminded me of The Boy in the Striped Pajamas both for its remarkable story and the quality of the writing. The book is written as a retelling by the author of his Grandfather's early life, more specifically ""one week in 1942, the first week of the year, the week he met my grandmother, made his best friend and killed two Germans."" During that week the Grandfather, Lev, was just 17 years old and living in Leningrad which was enduring the Nazi siege of 1942. Various events cause him to meet up with Kolya, a Russian deserter who is only a few years older in years but much more in experience. Together they set out on a ridiculous quest and witness many of the awful atrocities that occurred during that war.The characters of Lev and Kolya are what makes this book. Kolya is by turns funny and infuriating but is always lovable. Their dialogue is frequently hilarious which prevents the story from becoming overwhelmingly sad and horrifying. The history was amazing - how those poor people survived starvation during the siege! I had not come across ""library candy"" before. The will to live brings about some incredible invention.A sad, sad ending with a sweet epilogue. I have another favourite book:)"
12,https://www.goodreads.com/user/show/12618229-jeff,Rating 4 out of 5,"It’s all about the quest.When I read books, I like to do a little research about the author, time period, the book itself, etc. I was interested to learn that the creator of the video game, The Last of Us, drew inspiration, in part, from this book.The Last of Us is a game my son keeps begging me to play. It takes place in the near future, has nothing to do with World War II era Leningrad, and from what I’ve watched bears no resemblance to the book.It’s all about the quest.In the book, the quest is to obtain a dozen eggs for a NKVD Colonel, so his daughter can have a wedding cake. Leningrad is under siege by the Nazis and people are eating the paste from library books, so finding eggs will take some doing. In the games, you generally have an end point too, but you can get sidetracked by doing multiple side quests. Examples:“Mister, can you rescue my puppy. He’s in a den of necromancers.”“I lost my sword in a cave about 50 years ago. It would bring a tear to this old soldier, if you could recover it for me. Oh, and it’s guarded by 100 zombies. They’re fast. And they wield weapons. And they use magic. Did I mention there is really powerful zombie when you get to the final room? I’d do it myself but …I’m old. Thanks again. Zeus, bless you!”“There’s a den of mutant drug fiends about a mile outside of town. If you kill them all, I’ll give you a bottle of water, five bottle caps and the whole town will “like” you.”You do have options. You could say no, punch the asker in the face, or simply walk away with their pathetic pleas ringing in your ears.There’s no straight line from point A to point B in the book either. It’s never that simple. Fortunately, Lev, our intrepid hero, doesn’t have to find the eggs by himself. Kolya, one of the more interesting characters, I’ve come across in a while, is in on this errand with him. Kolya is the guy that’s handsome, funny, charming, and good with his fists and can talk his way into and out of any situation. More or less the perfect companion.In most of the better games you have companions that you can choose from, usually one at a time. Companions range from drunks, mages, guys who can transform into werewolves, 7 foot-300 pound mutants who are off their meds, smoking hot vampire warriors, automated trolls and talking dogs. The latter is not as cool as it sounds, he won’t stop talking/barking if you’re trying to sneak up on enemies. The book doesn’t lack for humor, pathos, adventure and excellent characterization. It’s a timeless tale of summoning one’s inner resources and facing down doubt and fear in the most trying of situations. But in the end, it’s all about the quest."
13,https://www.goodreads.com/user/show/63168028-peter,Rating 5 out of 5,"EndeavourCity of Thieves is a really entertaining book that not only takes into account a period in the Second World War, that has its own defining history, but it concentrates on the relationship that develops between two men under unique circumstances of threat and war. It is an exhilarating but fearful story where the main protagonists, Lev and Koyla, have been tasked to undertake a mission in war-torn Leningrad which is almost absurd. It is Russia, winter, people are starving, freezing, the city is war-torn, and life is precarious. In the midst of these horrendous conditions, Lev and Koyla are both held in jail pending execution. They are offered a pardon if they find a dozen eggs for the colonel's daughter's wedding cake, during the relentless German assault on the city.The story takes the two men on a shocking mission where they will need to negotiate many challenges that test their resolve. The men build a friendship that deepens as they navigate the obstacles and dangers at every turn with striking humour even in the darkest situations. As the relationship builds we see a shift in the respect towards each other and the younger man, Lev, becomes much more assured. Benioff develops this relationship and interaction through adversity and adventure with such observational mastery.I bought this book with a ribbon on it that said if you don’t like this book you can have your money back. Needless to say, I still own the book and it’s going nowhere. Highly recommended."
14,https://www.goodreads.com/user/show/5032725-debra,Rating 4 out of 5,"Bring back some eggs he said. My daughter needs them for her wedding cake he says....Sounds simple, right? Except this is wartime and eggs are nowhere to be found. The Nazis have invaded Leningrad and Lev Beniov has been arrested and thrown in a cell with a slightly older and more experienced deserter named Kolya. The men are tasked with finding eggs for a powerful Soviet colonel instead of facing the firing squad.Thus, begins Lev and Kolya's journey through the rough and extremely dangerous streets of Leningrad. There they find starving people willing to do the unimaginable to survive. They find danger, friendship, lust, fear, pain and hope. This book is raw and powerful in that it does not hold any punches when showing the hardships of war. People are willing to go to extremes to survive and prove that they are stronger than they look and braver than they think.See more of my reviews at www.openbookpost.com"
15,https://www.goodreads.com/user/show/43881851-ron,Rating 5 out of 5,"
“If you want to talk about Leningrad, we talk about Leningrad.”
So begins the story of Lev and Kolya in what I will say is the best book I have read this year. I’ve read a number of books that are in some way related to WWII over the past 12 months. This happened without planning. It’s just that some of the very best books are in this category, so I wanted to read them: Vonnegut, Philip K Dick, Wiesel & Kristin Hannah. Vonnegut wrote a satire based on reality. Dick wrote a science-fiction piece about what could have happened. In City of Thieves, Benioff (who I now wish would write more and more books, but hey, I know he has a few irons in the fire) creates a story of fiction set within the true siege of Leningrad (St. Petersburg), fondly known as Piter to the Russians who lived there. The then Leningrad is a world and a lifetime away from me (probably you too). It didn’t feel very far while reading. I was with Lev and Kolya the whole way, these two mismatched cohorts that I grew to love.Lev and Kolya are just boys really, forced by situation to be men. They don’t even know one another in the beginning of this story, one caught for looting, the other labeled a deserter. Neither is really guilty, but war creates labels. To save their own lives, they are given a chance: find a dozen eggs for the colonel so that his daughter may have a cake for her wedding (there is little to no food in the city – people are starving). Send two young men to find eggs: sounds like a preposterous premise. Well, it’s the sort of thing, along with some great humor, that keeps City of Thieves from being overly oppressive. It straddles a line with levity, and by doing so, it is better.What made this book special was its characters. Who they were is why I cared about them. Lev is a 17-year-old, skinny, big-nosed, Russian Jew who’s consistently mistaken for being 15. Insecure, but severely loyal. By appearance, Kolya is all that Lev is not: tall, blonde and blue-eyed and happens to look like a German. He is confident, and out-spoken to a fault, but underneath that there is no vanity and no judgment. Even in the middle of danger, Lev can’t help but see potential love in every girl he meets, and Kolya can’t help but instigate every possible situation. To me that seemed so human.Finally, I thought the story got better as it went along. As the plot developed the tension deepened, and there were three big scenes towards the end, each staggering to me in a different way. I’ll be thinking about this one for quite awhile."
