,user_links,user_ratings,review_text
26,https://www.goodreads.com/user/show/11183856-kelly-and-the-book-boar,Rating 4 out of 5,"Find all of my reviews at: http://52bookminimum.blogspot.com/

Russia is also the place where a defector and a looter became an unlikely duo on a quest for . . . . 

More specifically, this is the story of . . . . 
“One week in 1942, the first week of the year, the week he met my grandmother, made his best friend, and killed two Germans.”
If cellmates Lev and Kolya can supply a dozen eggs in time for the Colonel’s wife to bake a cake for their daughter’s wedding they can save their hides. Along the way they will come across cannibals, a rooster rather than a hen, Germans, an epic chess game and one highly anticipated bowel movement.I have owned this book forever. Many thanks to Emily for suggesting I make it one of my selections for the Winter Reading Challenge. I had no idea what I was missing out on. For a slim novel this one surely packs a punch. Recommended.

One more to go!"
27,https://www.goodreads.com/user/show/8228243-andy-marr,Rating 4 out of 5,"Brutal, but good."
28,https://www.goodreads.com/user/show/1526851-will-byrnes,Rating 3 out of 5,"This is a lovely, coming of age novel about a young (17) man in Nazi-besieged St Petersberg, Piter to the locals, who finds himself accompanied by a Soviet army deserter, named Kolya as they try to survive the horrors of war. It is, of course, a bleak landscape, with people driven mad by hunger and desperation, some to the point of cannibalism. What are people capable of? What is our young hero capable of? Can he kill? I quite enjoyed this book. It was engaging from front to end, with nicely drawn characters and payload in the form of an inside view of life under siege. "
29,https://www.goodreads.com/user/show/2752994-dem,Rating 4 out of 5,"Having read and loved Child 44this book was recommended to me by a friend and he was spot on in his recommendation as I loved this Novel.The siege of Leningrad lasted from August 1941 to January 1944 and resulted in an unknown death toll which included around one million citizens.This is the story of Lev Beniov, who was jailed for looting the body of a dead Nazi paratrooper who landed in the city. He is sent to Jail where he meets with a young and confident soldier called Kolya who is jailed as he has been found guilty of desecration. The two young men are then given an impossible and brilliant task - to acquire a dozen eggs for the wedding cake of the daughter of an NKVD officer who has confiscated the duo's ration cards. This book is a real page turner and there were times in the book when I thought I can’t read any more as it is really difficult reading in places and then Benioff would introduce a bit of humour and you continue to read until he shocks you again and believe me he really knows when and how to shock the reader. I loved the characters in this novel they are so well written and you really care about them as they novel progresses. Benioff really brings this book alive as you can feel the hunger, the cold and the pain of the citizens of Leningrad , there were times I even felt I was knee deep in that snow! and that is what makes this book a 4 star read.This is a real page turner and a 4 star read. nr"
