,user_links,user_ratings,review_text
222,https://www.goodreads.com/user/show/7741393-cassidy,Rating 5 out of 5,"This book is for anyone who has a vulva or who has any hope of intimacy with someone who has a vulva. 😂Seriously, maybe I was just raised in a sexually repressed culture, but this book was absolutely eye opening. First, yes, it’s about sex. The title and about 1/3 of the chapters make that very clear, BUT it’s also about understanding the female body, it’s about the cultural discrediting of female voices in regard to our own bodies, and it’s about the lack of knowledge that most people have about what’s going on in a female body and brain. (Seriously, the lack of scientific understanding and awareness of like, over half the population’s body functioning is appalling…but patriarchy.)I think the thing I loved the most about this book is that while it’s a book about sex, It’s also about ALL the misinformed cultural and media focused messaging around being female from sexuality to body image to stress cycles to brain functioning to leading fulfilling relationships. So, I repeat: if you have a vulva (and aren’t offended by words like “vulva” and “clitoris” and “orgasm” I suppose-because those words are very prevalent in this book, for good reason 😂) I would HIGHLY recommend this! "
223,https://www.goodreads.com/user/show/159788011-maria-dischinger,Rating 5 out of 5,"“Like your genitals, your sexuality is perfect and beautiful exactly as it is. You are normal. Beautiful. So when you notice yourself feeling dissatisfied with your sexuality, when you notice shame or frustration or grief, allow yourself to direct those feelings away from yourself and instead focus the emotions towards the culture that told you the wrong story.”just as I finished the last chapter I leaned over to David and said, “I want to send this to every woman, every person, I know.” There is SO much I wish I could say about the good and needed work of this book. Emily Nagoski is doing some dang good stuff.I took this book in chunks because each chapter was so rich, so prompting of so much reflection, and so PRACTICAL. I ordered a copy just so I could have in my therapy office because, let me tell you, the question “is there something wrong with me?” comes up with almost every client when you get into sex. This book repeats more times than I could count: “you are perfectly normal,” and that’s a message worth repeating 💛"
224,https://www.goodreads.com/user/show/15249098-donald-powell,Rating 5 out of 5,"A comprehensive review of female sexuality in America. The author, a Phd. in Behavioral health, offers many concrete ideas within a well integrated creed to help women be happier and healthier about their sexuality. She deals with culture, individual history, individual trauma, biology and psychology (especially introspection) and is very persuasive. She does not ""man bash"" at all. Since the book is about women's sexuality she does not discuss it but I suspect she would agree men have sexual issues from our culture too. Like all good ""self help"" books, she espouses time tested principles of patience, tolerance, kindliness and love. She is very positive and reaffirming in every sentence, realistically dealing with many difficult topics. Her theme is based in logic, science, scholarly support, and positivity, making this book stand out in this genre. Everyone would benefit from reading it whether or not you nod in complete agreement."
225,https://www.goodreads.com/user/show/47651405-ana-dias,Rating 5 out of 5,"This book was a really nice surprise as I picked it from the bookstore a bit sckeptical about another ""self help"" book about women sexuality. But it is everything but that. I believe it can be relevant for women and men, regardless of sexual orientation, if in a relationship, if struggling with something or not. You will learn about science, society and history and most importantly that you and everyone else is not broken, ""we are all made of same parts, just organised in different ways"". You might get very upset, like me, about how patriarchy and long standing societal believes really can damage women (and men shall I say) but better to be more and more aware of it and take it one step at time to make things change. Starting with you, and the knowledge and friend-like, non-judgemental advice in this book can surely help with that."
226,https://www.goodreads.com/user/show/143495376-jessica,Rating 4 out of 5,"This book honestly took me a long time to finish, for no particular reason other than it was more technical than I anticipated, which is just simply more difficult for me to consume all at once. It was so so interesting and I think I learned so much — it would probably be a worthy re-read later in life or later into a long term monogamous relationship. The only thing that bothered me is the fact that her metaphors, while very helpful, sometimes feel a bit… infantilizing? I think I don’t love when authors directly address the audience, and the way she writes feels like she’s talking to me except sort of not in a good way sometimes. Like when she asks us, “Guess what?” I’m kind of just like, girl I’m not guessing and you know I’m not guessing. Just tell me what. But regardless, so much good information about sex and so many myths about sex debunked. Loved the content."
227,https://www.goodreads.com/user/show/125936263-shaimaa,Rating 3 out of 5,"This was a truly eye-opening, transformative, and liberating read. Regardless of whether what is said here is scientifically accurate or not; this book normalizes our seemingly lonely sufferings/struggles/worries regarding our sexual wellbeing, rendering them solvable. Many reviews go into detail about the content of this book, so I’ll keep it short. Any married couples (especially women who are the main target audience for this book) should and need to read it. The sense of liberation and understanding and acceptance of my own sexual wellbeing after finishing this book is simply indescribable; when a book make you feel this way, you know it’s a very well-crafted book that is written from a place of sympathy and care.My only complaint is that it was very repetitive and the metaphors were very overdone. We’re adults, just get to the point 🥲"
228,https://www.goodreads.com/user/show/58096532-clarissa,Rating 3 out of 5,"First things first: I really like this book cover.This book brings up some of the latest scientific discoveries to debunk myths and improve your sex life. It doesn't get into the nitty gritty details of the science behind the brain and sex but it does provide some insight into women's physiology and the psychology of sexual arousal and pleasure. It is a lot of therapy and self-affirmation. Nagoski informs and reiterates throughout the book that ""we all (men and women) have the same parts, just organized differently"" but that does not make you abnormal. Everyone experiences sex and pleasure differently and we should be open to exploring what works for us. Basically, we should stop believing any preconceived notion about female sexuality (and male sexuality) created by the patriarchy it sucks.3.5 stars"
229,https://www.goodreads.com/user/show/37050412-jillian-humphrey,Rating 3 out of 5,"I loved that this book centered women’s sexual experiences and several parts were really interesting and helpful (non-concordance, spectatoring, dual control model, etc.) Overall I’m glad I read it, feel thankful for the conversations it sparked, would recommend it to certain friends, and wish more books like it were available. I took away a couple stars because the author and I don’t share a sexual ethic — I don’t think pornography, for instance, is morally neutral — and these kinds of moral issues came up frequently. Also, some parts of the book seemed condescending or cheesy, and I was confused when she mentioned that we live in a sex-negative culture. I think our culture is sex-obsessed but misogynistic, which feels very different than sex-negative. She also mentions that the Judeo-Christian tradition has a low view of sex and the body. Doctrinally this is not true. At the same time, I unfortunately understand why she thinks that.Some parts were 0 stars, some parts were 5 stars. There is a lot here I’ll keep with me."
230,https://www.goodreads.com/user/show/7381871-allyson,Rating 5 out of 5,"With the same friendly, funny voice as Burnout: The Secret to Unlocking the Stress Cycle, Emily Nagoski explores the many myths and misconceptions about how human sexuality works. As with Burnout: The Secret to Unlocking the Stress Cycle, the book speaks directly to women and is mostly for women, but there's a lot for (hetero) men to learn here too...about their partners, but also about themselves.This isn't a ""sex book"" per se, so if you're expecting a manual of positions or techniques, you won't find it here. More important than any of that is the exploration of the multidimensional reality that is human sexuality (the author makes clear her caveats about the material and its relevance to transgender people). Who knew things were so complicated? And that everything that ""they"" have been repeating to us our whole lives is pretty much wrong?I learned a lot and enjoyed learning it. Nagoski has a gift for making uncomfortable and complex topics easy to digest and even fun to read about. I recommend this book unreservedly!"
231,https://www.goodreads.com/user/show/14937189-bridget-arnold,Rating 5 out of 5,"As a single person who is not sexually active, you’d think this book wouldn’t be super applicable. In a lot of ways it wasn’t. The main target demographic, from what I could gather, was married women. That being said, I definitely needed to hear a lot of what she had to say. Homegirl was out here talking about self-compassion, mindfulness techniques, anxiety management, grief management, feelings your Feels, self-care, and meta emotions. And let me just go on a tangent for a sec about meta emotions. That section for me was this ah-ha moment of like “oh, there’s a word for that?” Spoiler: it’s basically how and what you feel about your feelings. As someone who has a lot of feelings about their feelings, this was an eye-opening vocab moment. Made me feel a little less alone, for sure.So I’m giving it 5 stars because I needed the humor, the insight, the occasional tough love, and of course, the sex-related worksheets. If you’re my mom and you see this, no you didn’t."
232,https://www.goodreads.com/user/show/162438657-ivanellis-rodriguez,Rating 3 out of 5,"Im giving the content of this book a solid 5 stars⭐️. Very valuable information that every women should know. However... I'm giving the book itself, and Emily as writer/educator, 2 stars ⭐️. It took me 6 months to finish this book. If it weren't for, the valuable information, I would had just added it to my DNF. I can understand that maybe she's trying to teach scientific terms to a broader audience but there are way too many unnecessary and absurdly long metaphors. I also hate that she was constantly ""in this chapter I'll explain this"" or ""in the following chapters I'll explain that"". Like ma'am, just give me the information, the data, and the conclusion, and stop beating around the bush! Overall, I highly recommend the book, but beware of poor delivery and writing."
233,https://www.goodreads.com/user/show/24985536-clare-carter,Rating 4 out of 5,"My lovely friend Erin recommended this to me! Thank you Erin! I really enjoyed how accessible and easy to read this book is. It’s the true sex ed everyone should have gotten in school. I don’t think anything Emily said in here blew my mind or anything like that, but she writes in such a friendly manner—like I’m just having a chat with her. And I just felt like all her topics were very well researched and well put together. The only critique I have for this book is it’s very focused on straight couples. Which—to be fair—I believe Emily has spoken out a lot about sexual experiences outside of just manxwoman so I don't want to just totally diss her or anything.Idk, as someone who identifies on the Ace spectrum, I was just hoping for more focus on that. I got a lot out of this book but Emily really emphasizes “feeling normal so matter who you are or what you like.” Like the messaging was great. But in a weird way I didn’t feel normal at all because this book never…mentioned me? Idk if that makes sense. Anyway, overall I think this is a perfect, great, educational but easy ready."
234,https://www.goodreads.com/user/show/4095021-kate,Rating 5 out of 5,"It took me a while to read this book, in part because I wanted to digest every chapter. Nagoski approaches an often uncomfortable topic with humor, heart, and understanding which made this book much more accessible and enjoyable to read. Some of the stories she told and examples she wrote about really resonated with me and my personality. This book was recommended to me by a few friends and I've recommended it to some friends as well. Nagoski has truly helped me change my mindset about many things and I am here for it. "
235,no user info,Rating 5 out of 5,"I highly recommend for anyone who has questions, concerns, or curiosity about their own sexuality. I was coming from a very religious background myself, and hadn't learned much about sex beyond the mechanics, and had lots of questions. I did not want, however, to just read a Cosmo style list of positions and porn maneuvers. This book is body and sex positive, educational, and interested mostly in individual pleasure and success rather than adding more to expectations. Give it a try, hopefully it will give you more info about yourself too."
236,https://www.goodreads.com/user/show/128368210-allison,Rating 5 out of 5,"Everyone needs to read this book. Every single person. It is such a great display of the way that society can affect our lives and penetrate our unconscious functions and how it keeps us from joy. Not only does this book help to explain and normalize women’s sexuality, but it also seeks to teach each of us how to let go of “normalcy”, trust our bodies, and ultimately lead ourselves and others in our lives towards JOY. There should be no shame or guilt in experiencing pleasure. In reading this book, I felt an overwhelming sense of finally seeing what I’ve experience be explained and gaining a better understanding of why I feel the way I feel and how to heal from the wounds that society and myself have created surrounding sexuality. Seriously read this book!Ps when a book mentions the Rhesus Monkeys you know it’s good "
237,https://www.goodreads.com/user/show/147001478-meg-mccarthy,Rating 4 out of 5,"I think every woman should read this book and others like it (with the note that this book is really only geared towards cis women which the author comments on and addresses at the beginning of the book). It is incredibly accessible and normalizing. Because of its accessibility, however, it can be really simple at times if you’re more familiar with this area/subject and very repetitive. There are also quite a few eye roll moments, but I understand what the author was trying to accomplish and I appreciate her goal and intention. "
238,https://www.goodreads.com/user/show/161865635-meg,Rating 2 out of 5,"There were some interesting points and concepts, but I really struggled with the delivery/conversational tone of writing. I went in with an open mind, expecting to absolutely devour but it felt like such a chore to finish. Far too many metaphors (so exhausting!!!), rhetorical questions and call backs. I understand that the intention was to make the science and concepts easily digestible for a wide target audience, but personally found the approach super frivolous and patronising. The science felt overshadowed by metaphors and the writers tone. I just want the facts as is without the silly analogy. I did take away some new insights and learnings, but was a long and hard journey to get to the end. Despite my 2 star rating, I think many people would benefit from reading it. For me it was a case of right message, wrong messenger."
239,https://www.goodreads.com/user/show/30337709-anastasiia-s,Rating 5 out of 5,"Лучшая нон-фикшн книга моего 2019го. Считаю, что ее нужно включать в обязательную программу образования. И эта книга — лучший подарок, который может себе сделать девочка, девушка или женщина :) Книга о понимании своей сексуальности, основанном на научных данных. Книга о принятии своей уникальной личной сексуальности, основанном на огромной любви, теплоте и заботе, которую проявляет авторка по отношению к своим читательницам. Уверена, ваша жизнь станет лучше и счастливее после её прочтения.Мужчинам тоже искренне рекомендую к прочтению. Все мы живем в одной и той же культуре, основанной на нереалистичных ожиданиях и уменьшить её давление будет полезно всем. Как минимум один мой друг написал мне, что читает книгу взахлеб."
240,https://www.goodreads.com/user/show/59643790-wierik-jansen,Rating 5 out of 5,"This is an exceptional book that teaches so much more than what's on the cover. Besides the topics you'd expect in a book like this, Nagoski discusses anatomy (both female and male!), stress and mental health, the influence of media and culture on one's views on sexuality and so much more.Despite the fact that this book is written for women, there is so much in here that applies to men as well, not to mention the fact that the information in this book is good to know for everyone regardless of gender."
241,https://www.goodreads.com/user/show/27596978-tonya-rogers,Rating 3 out of 5,"This was a really interesting book. I learned a lot, and i think it’d be good for everyone to read, male or female. There were a lot of elements of CBT and meditation that were interesting but not new to me, but i think if you’ve not spent time thinking about CBT and/or meditation, it would be revealing for a lot of people. "
242,https://www.goodreads.com/user/show/5774432-vee,Rating 4 out of 5,"The author gives a caveat at the beginning of this book that it is very cis focused and she is not wrong. It is also quite heteronormative though she does include a few stories following a lesbian couple. As others have mentioned it is also a book that is quite heavy in metaphors. AND it is fantastic. I learned a lot, I stayed engaged, and I would highly recommend this book."
243,https://www.goodreads.com/user/show/91211801-booked-shaye-bwrt,Rating 3 out of 5,"This is a very informative book. But a lot of the info is kind of common knowledge. I found a lot of stuff being said, I kind of already knew. I almost wish the book wasn’t PINK , so that more men would read it. I think it should be promoted more towards MEN. The book advocates for consent , trust , & understanding the clues of the body. There also isn’t any science behind the information being said. It kind of written as if I was an appointment with a Sex Therapist. "
244,https://www.goodreads.com/user/show/10717543-alexa,Rating 5 out of 5,"Really fantastic read that reframed the way I think about and have been taught to think about sex, pleasure, and sexuality. Nagoski is a terrific writer and I love when she references using the word “should.” Believing that you “should like this” or “should do that” suggests you’re wrong or doing something wrong in the first place, which isn’t true. Really thought-provoking read."
245,https://www.goodreads.com/user/show/31790284-elena-marjineanu,Rating 5 out of 5,"Despite its cheesy title, this was indeed a very, very good book. Coming from a sex-negative culture, I’ve learned a lot of stuff about female sexuality. First: we are all normal. We are made of the same parts just organized in different ways. Second: no two people are alike. Third: we seem to have either sensitive sexual brakes, or sensitive accelerators. Sex-negative culture has trained us to be self-critical and judgmental about our bodies and our sexualities, which is interfering with our sexual wellbeing. If there is only one change you make after reading this book this is to reduce your body self-criticism and relax into pleasure."
246,https://www.goodreads.com/user/show/126746233-qing-mirabella,Rating 5 out of 5,"This is THE book that every female needs: it tells you one thing that you probably heard, but don’t always believe - you are beautiful, period. But seriously, it really teach you to live with confidence and joy. I enjoy the blend of anatomy, physiology, psychology, studies, stories etc to get her points across. The practice session at the end of each chapter is also highly relevant. Not a book to binge reading, no secret recipes, just read on, practice the kindness, and live with joy."
247,https://www.goodreads.com/user/show/125145662-allie,Rating 4 out of 5,"I liked the anecdotes from the characters/people whose stories we followed, the metaphors, and the repeated idea that we all vary and are normal! (Mostly about cis women, but gives that disclaimer at the start & notes that there should be more research that includes trans women and non-binary folks!)"
248,https://www.goodreads.com/user/show/151453102-saskia,Rating 3 out of 5,"This book wasn’t what I expected it to be. I was looking for more of a sociology/ psychology lens and Nagoski takes a more scientific/ biological approach to women’s sexuality. I didn’t find anything groundbreaking in this, or that I leant anything new, but it is all good information. My only major criticism is that there are too many metaphors. Like WAY too many."
249,https://www.goodreads.com/user/show/160319916-kira-doerwald,Rating 5 out of 5,"I didn’t pick this up cause of any issues in my current sex life, don’t be nosy lol. But because every woman I’ve ever talked with about sex has had a problem in her sex life at some point in some way shape or form. This was so informative and so positive and so reassuring and made me think of all the women I’ve wished could love themselves as well as they deserved. 10/10. "
250,https://www.goodreads.com/user/show/113600088-viktoriia,Rating 5 out of 5,"the knowledge in this book is solid gold, and i wish everyone would read it, especially the parts on responsive desire, brakes & accelerators, stress management (!!) and genital non-concordance. however, it could be a bit less repetitive, and i would really appreciate it if the author touched on asexuality too. still 5/5 though."
251,https://www.goodreads.com/user/show/108568831-anna,Rating 5 out of 5,I loved this book. I recommend to anyone who is interested in learning about sexuality. A balanced combination of science and self-help content. Pleasant reading.
252,https://www.goodreads.com/user/show/6278820-inge,Rating 4 out of 5,3.5 stars
253,https://www.goodreads.com/user/show/36699189-carlina-scalf,Rating 5 out of 5,"I'm a big fan of Emily Nagoski, and this book was as enlightening, fascinating, and comforting as I suspected it would be. Younger Carli would have benefitted from having access to this information (especially in her Catholic school health education days). Come for the interesting science, stay for the central message that ""we're all different, and that's completely normal."""
254,https://www.goodreads.com/user/show/427746-camille,Rating 5 out of 5,"This is an excellent book about women and sex that is about WAYYYYY more than women and sex. I highly recommended it for women and any other people who have or would like to have sex with women. I recommend it for people who have sex, have had sex or would like to have sex with anyone. I also recommend it for people who have or have had stress or trauma-- sexual or otherwise. I feel like anyone could get at least a little something from this wonderful, lovingly crafted book."
255,https://www.goodreads.com/user/show/134460865-meg-garner,Rating 2 out of 5,Technical DNF at 93%This book had great ideas and interesting points but they were talked about so repetitively and clinically that it became a drag real quick. I got annoyed with it but I’ll admit some aspects did help put certain things into perspective 
256,https://www.goodreads.com/user/show/30564321-ophelia-x1f49b,Rating 3 out of 5,Hmm didn’t blow my mind. There was some insightful commentary but unfortunately I found it quite repetitive. 
257,https://www.goodreads.com/user/show/119607734-emily-wilson,Rating 5 out of 5,Time to break the taboo everyone! It’s also time you correctly learn what actually happens and how to be confident with yourself and embrace pleasure without judgement. 
258,https://www.goodreads.com/user/show/137472759-kellsie-herrmann,Rating 4 out of 5,"The metaphors were super helpful and the inherent message - you are normal - was freeing. Each chapter held a gem that, when you think about it you probably already knew, but maybe it was conceptualized in a new and fitting way. "
259,no user info,Rating 5 out of 5,Every person on the planet should read this book. 
260,https://www.goodreads.com/user/show/5792978-claire,Rating 5 out of 5,Must read
