,user_links,user_ratings,review_text
65,https://www.goodreads.com/user/show/5251385-jacqueline,Rating 5 out of 5,"This is a really interesting and important book that I would recommend to any of my girl friends (or any woman reading this, really, and any man who's curious) who struggle with their sex life and feeling completely comfortable with sexual matters, whether that involves a partner or not. Without going into too much detail about my own sexual issues (I know my loyal GR followers are thirsty for those juicy tidbits, but you'll have to buy me a beer first), I found this book incredibly educational. And not just involving sex and becoming more comfortable with your sexuality, but becoming comfortable with YOURSELF in general, and practicing self-compassion with all aspects of yourself. And that totally makes sense, because to be truly comfortable with sex, you need to be present and mindful, and that starts with working on yourself and being kind to yourself. How can you orgasm or enjoy sex if you hate yourself and feel like you're broken, or that there's something wrong with you?The author dispels a lot of myths involving sex which actually blew my mind. I always considered myself a relatively sex-positive and well-educated person in that sense, but there was actually so little that I knew, and so many misconceptions that I had.A few topics:- Arousal nonconcordance- Changing the context to enjoy sex- Spontaneous desire vs responsive desire- A lot of other things I'm too lazy to explain. You'll have to read the book yourself.Edit: I had to mention that this happens to be my 69th book read this year *chuckles immaturely*"
66,https://www.goodreads.com/user/show/76852995-jennifer-reinhard,Rating 5 out of 5,"This is the first 'sex ed' book I have ever read and I learned so much from the author. We have been programmed since a very young age with certain scripts and stories that we often do not realize how we label ourselves (our feelings, thoughts, behaviours) and others as normal and abnormal all the time, which is ridiculous if you really think about it. I especially liked the part about self-compassion and nonjudgement. I have already recommended it to many people around me; grab a copy!:)"
67,https://www.goodreads.com/user/show/63585765-maryna,Rating 5 out of 5,"Обов""язково читати жінкам, щоби зрозуміти - з вами все нормально. Обов""язково читати чоловікам, щоби зрозуміти, що відбувається в голові у жінки в процесі. І до. І після. І взагалі, що там відбувається. %)Шкода, що я прочитала цю книгу в 38. Але добре, що не у 108)))))"
68,https://www.goodreads.com/user/show/81489765,Rating 4 out of 5,"Десь добра третина книжки корисна навіть чоловікам, головне звертати увагу на наукові факти."
69,https://www.goodreads.com/user/show/74358199-miriam,Rating 5 out of 5,"“Do I think that living with confidence and joy and respecting everyone’s sexual autonomy could play a role in preventing cancer, solving the climate crisis, or building world peace? Yes, actually” (313).All of Nagoski’s writing in this book is informative, accessible, and empathetic like the above. She discusses the subject matter with humanity and empowerment. I learned a lot and will be hanging onto this book for reference. This is the book they SHOULD teach in grade school, instead of abstinence, or nothing, or information rooted in the patriarchy.Book 3 of 19 of Reading all the books on my physical to-read shelf (if anyone is following along/cares: since I'm a BOTM member, this number is going to move up and down as time goes by, but hopefully, I will EMPTY THIS SHELF at some point)!"
70,https://www.goodreads.com/user/show/24947897-ulrika-pe,Rating 4 out of 5,"4,5🌟Daži no atspēkotajiem mītiem mani pārsteidza, lai gan tie nav jauni pētījumi. Tas vēl vairāk aktualizē tos informācijas avotus, kam uzticamies izglītojoties par savu seksualitāti! Sieviete nav vīrietis, uzsver autore un “bauda esi Tu visa!” Brīžiem bija sajūta, ka autore pasaka, ko pateiks, pasaka to un tad pasaka, ko tikko pateica, bet būtiski tas netraucēja - informācija nogulās smadzenēs. Tostarp mani ļoti aizrāva aprakstītā stresa izregulēšana jeb stresa cikla pabeigšana. Visi esam dzirdējuši par pirmatnējām reakcijām, sastopoties ar “lauvu”, bet kā ir mūsdienās, kad “lauva” nav notikums, bet process?No sirds iesaku izlasīt ik vienai sievietei, lai sajustu savu “normālību” un unikalitāti reizē - autorei ir izdevies nodot šo vēstījumu. Daži teikumi aizkustināja līdz asarām."
71,https://www.goodreads.com/user/show/68246225-emma,Rating 4 out of 5,"All my Midwestern girlies who had heinous or nonexistent sex ed: this book is for you! This is a comprehensive and engagingly written guide to how (mostly) cis women's sexuality works, both physiologically and mentally. Nagoski often uses metaphors of things like gardens to describe most of the scientific processes she mentions; not everyone will like this, but since I struggle to understand science I can't really visualize, it worked for me. This is a book I'd consider rereading in print to soak up some of the material I might have missed by listening to the audiobook. Some of the ""you are normal and beautiful and wonderful"" made me roll my eyes a little, but maybe the eye-rolling is what the patriarchy wants me to do. Note on the format: I listened to the audiobook, read by Nagoski. She does a fantastic reading, and there is even background music that I think was composed by her sister."
72,https://www.goodreads.com/user/show/2294085-david,Rating 5 out of 5,"""When people ask me, 'Am I normal?' they're asking, 'Do I belong?' The answer is Yes, you belong in your body. You belong in the world. You've belonged since the day you were born. This is your home. You don't have to earn it by conforming to some externally imposed sexual standard.""This book is so good. I cannot recommend it enough. I may not be the intended audience for whom sex educator Emily Nagoski writes (I am a heterosexual male), but my partners have been women, I have women in my family, as well as many female friends, and this book deepens my understanding of what cisgendered women have been subjected to, as well as what their biological experience is like. Plus, the sexual experience is a human experience, and I found myself not only learning from, but identifying with many of the key takeaways:* Arousal non-concordance, the mismatch that happens between the biological self (genitals) and the subjective self (thoughts/desires). ""I am totally turned on, but my equipment isn't quite in alignment,"" and vice versa. Non-concordance is normal and experienced by all genders, but women have a MUCH greater degree of non-concordance, and this is incredibly helpful to know when with partners. Non-concordance is also exacerbated in those who have experienced sexual trauma/abuse, such as I did as a really young boy. This helped crystallize so much of what I have experienced.* Learning to let go of shame and self-judgment around sexual preferences, desires, as well as letting go of the ""I should be..."" thoughts. As long as you are not hurting yourself or others, your fantasies and cravings are NORMAL. All of them. Enjoy.* We're all made of the same parts, just organized in different ways, and all unique to the individual. Everyone's body is equally lovable.* Orgasms. They can happen or not. And it's all normal. Change the goal from Must Orgasm, to Experience Pleasure.* The female experience. This, of course, is THE reason why Emily wrote this book. The messaging women have received since time immemorial regarding not only sex, but their biological bodies, is deplorable, even dangerous (the history and science of the Hymen is particularly eye-opening and disturbing).I can't say the messaging has been great to any gender, but it's clear women have not been allowed to be sexual beings, but rather sexual objects. I don't know if I'm guilty of contributing to this (I suppose I'm more Woke than Bro), but I now cannot un-see it and thus will always make better choices about my actions and words.There is so much more packed into this easily accessible book, that I'll leave the rest for you to discover. Emily's writing is clear, articulate, humorous, poignant, and above all, compassionate. She truly cares about this information reaching those it needs to reach -- which, IMO, is everyone.Learn about your partner. Learn about yourself. Learn about your kids. Learn about the world. Read this book and start positively changing the messaging we spread about sex. I mean, we wouldn't be here without it."
73,https://www.goodreads.com/user/show/1484853-simone,Rating 4 out of 5,"This is an amazing book. A must read for anyone with a vagina or people interested in being sexually involved with vagina have-ers. As Nagoski argues for too long we've basically thought about women's sexuality (when we think about it) as men's sexuality lite. There's a model of men's sexuality which is overwhelmingly fast-responsive and concordant, and when women's sexuality doesn't match that ideal it's considered broken. But this book is about more than just the science behind why women's sexuality is different than men's sexuality. Not better, not worse, just different. This book is warm, funny, and generous. Nagoski encourages women to own all their feelings and be gentle with themselves, not just with regard to their sexuality, but in all aspects of their lives. More than any other book on the science of sex that I've read this is a book that focuses on the context of feelings and why understanding that contexts matters. ""The day you were born, the world had a choice about what to teach you about your body. It could have taught you to live with confidence and joy inside your body. It could have taught you that your body and your sexuality are beautiful gifts. But instead, the world taught you to feel critical and dissatisfied with your sexuality and your body. You were taught to value and expect something from your sexuality that does not match what your sexuality actually is. You were told a story about what would happen in your sexual life, and that story was false. You were lied to. I am pissed, on your behalf, at the world for that lie. And I'm working to create a world that doesn't lie to women about their bodies anymore. I can't change the injury that the world inflicted on you, and neither can you. What you can do is heal. Like your genitals, your sexuality is perfect and beautiful exactly as it is. You are normal. Beautiful. And as long as you're not experiencing pain, you're healthy. So when you notice yourself feeling dissatisfied with your sexuality, when you notice shame or frustration or grief, allow yourself to direct those feelings away from yourself and instead focus the emotions toward the culture that told you the wrong story.""Indeed. Everyone please read this book and we can rage against the culture together. "
74,https://www.goodreads.com/user/show/3335221-kaila,Rating 4 out of 5,"It took me a long time to read this book because the writing style annoyed me so much. SO MUCH. The anecdotes, the smarmy metaphors, the constant use of Star Trek style explanations (Like a balloon and...SOMETHING BAD HAPPENS.) It got on my nerves. A LOT. She started talking about sleepy hedgehogs, the little monitor, and rats who listen to Iggy Pop, as well as others. I would have been happier with the science, I forgot what ""sleepy hedgehog"" meant basically immediately. It was like she was writing to be That Cool Professor Who Gets You Kids. I make Iggy Pop references! Y'all get that, right? We're on the level?It's very monogamous. Not straight, so that's good, but not a book for someone who identifies as asexual. If I remember correctly, all the examples in the book were in a long term, sexual, life partnership. That got frustrating.So why 4 stars?It's a self-help book. This book is therapy. It's about accepting yourself. There was a refrain she kept saying, ""You are ok. You are normal,"" and every time it made me cry. Writing that right now made me cry. Stupid crying. Being told I'm ok is like the number one thing to make me form a little puddle on the ground and ache about how I don't actually feel ok.It's heartbreaking that women (or maybe people in general) have to be told that, but here we are. Sexual shame is insidious and infiltrates all sorts of parts of someone's life. Come to find out, that's ok. That's normal. Embrace it and make it a part of your story so that it doesn't remain shame forever but is simply part of your tapestry, an intricately woven web of a million influences forming to make a beautiful, sexual being, who has learned to turn around and say This is Me and I Am Lovable."
75,https://www.goodreads.com/user/show/13631897-al,Rating 2 out of 5,"Suffers from what a lot of popular self-help/non-fiction books suffer from, which is that they're about 50% longer than they need to be. In the case of this book, part of that extra 50% is its own marketing -- which was kind of frustrating because I've already bought the book, so why are they still trying to sell me on it? The rest is a lot of repetition of things just stated. The other 50% also suffers because the writing is at points infantilising and talks down at the audience, which makes me wonder who Emily was thinking of when writing the book?In any case, she definitely did not have me in mind. Which is perfectly fine. But even though this wasn't written for me, and I found the way it was written particularly frustrating, I still think that some of the information in it is quite useful and would recommend it to certain people.What I think would be great though is if the information could be synthesised by someone else and turned into a 2-3 hour online class divided into short 10-15 minute bite-sized chapters. Now that would be a 5-star course."
76,https://www.goodreads.com/user/show/727334-amy,Rating 4 out of 5,"This is a really good book that I think has something for everyone. Emily Nagoski does a great job of making the information compelling and fun. I think reading this book could really help a lot of people better understand themselves and their partners. Much of what we've been told about sex is not accurate! And I think this could really help people better grasp the truth about human sexuality in an engaging and interesting fashion. And that book cover ... come on! It rocks! This one will change your misconceptions and make you re-think much of what you probably think you know about sex. There is nothing stuffy or boring about this book - you won't yawn from boredom. Nagoski does a great job of weaving research, human physiology, psychology and human sexuality in a way that made it read like something fun rather than something informative. I love learning without really realizing I'm learning! I highly recommend this book to one and all! "
77,https://www.goodreads.com/user/show/8544773-kitty,Rating 3 out of 5,"iseenesest kasulik raamat, kust sain mitu uut ja huvitavat asja teada, aga oh, kuidas ta venis mu käes. jube palju energiat oli pandud kinnitamise peale, et kõik inimesed ja nende kehad on normaalsed ja ilusad ja väärtuslikud ja võivad ise otsustada jne. aga ma seda osa juba teadsin ja alailma oleks tahtnud edasi kerida ja veidi rohkem teadust. üksjagu patroniseeriv või nämmutav toon oli ka kasutusel. okei, mõned metafoorid ikka kuluvad ära asjade selgitamisel (ja see aiakujund nt oli täitsa kena ja asjalik), aga üle ka ei pea pingutama nendega.kaks põhilist asja siit meelde jätta vast: arousal nonconcordance (see, et suguelundite reaktsiooni järgi ei saa mõõta seda, kas inimene tegelikult erutunud on või naudib või toimuva heaks kiidab. eriti kui see inimene on naine, aga üldisemalt ka) ja spontaneous vs responsive desire.põmtselt sellega olen nõus, et nagu alapealkiri lubab, võib siit kogutud infoga asuda oma suguelu muutma küll."
78,https://www.goodreads.com/user/show/17058997-oksana,Rating 5 out of 5,"Як на мене, цю книгу варто прочитати кожній жінці, а для мого покоління, яке й близько не знало нічого про сексуальне виховання – маст рід. Книга не лише про секс, як може з��атись на перший погляд, книга про самоприйняття та самоусвідомлення, про доброту і терпіння до самої себе.Дуже сподобались історії окремих жінок та пар, а також метафори, які часто застосовувала авторка, щоб пояснити складні психологічні процеси: ""квітучий сад всередині кожного з нас"", ""зграя птахів"", ""маленька радниця"" та ін. Міні-конспект найцікавіших аспектів собі на згадку:- нонконкординативність- сила сексуально позитивного контексту- гальма та запалювання, вимикачі та вмикачі- цикл завершення стресової реакції- культурні міфи про жіночу сексуальність- метафоризація анатомії- мета-емоції"
79,https://www.goodreads.com/user/show/39550089-jennie,Rating 5 out of 5,"2016: This is, hands down, the best book I've read all year. My expectations for this book were extremely high, because it was so highly-recommended by several of my friends, and it exceeded every single one of them. Yes, it's a book about sex, but it's a book about all parts of sex-- from anatomy to expectations to having feelings about your feelings. It's nonjudgmental and features both heterosexual and homoesexual examples. I will be giving this book to every Mormon bride I meet from this day forward. Cannot recommend highly enough!!!"
80,https://www.goodreads.com/user/show/67667382-montserrat,Rating 5 out of 5,I know sex now😎
81,https://www.goodreads.com/user/show/28781546-ana,Rating 4 out of 5,"After reading this book, I immediately knew that I would come back to it for years to come. It is dense with research and easy-to-apply-in-real-life instructions for a better understanding of yourself, sexual situations in general and, in particular, your sexual relationships.Did I mention this book is funny? I didn't? Well, now you know."
82,https://www.goodreads.com/user/show/5876727-jocelyn,Rating 1 out of 5,[Writes an enormously long rant about this book based on my own sexual experiences; remembers that my openness is not how everyone else in my society treats talking about their sex lives; deletes it; decides on the condensed version]Don't be mislead by the title; this book is *really* not for you if you are disabled. 
83,https://www.goodreads.com/user/show/29939051-paula-g,Rating 5 out of 5,"No tengo palabras suficientes para expresar cómo de necesaria es esta lectura para cualquier persona con vagina, de verdad. "
84,https://www.goodreads.com/user/show/91048915-natalie,Rating 5 out of 5,"Це воно!Насправді, то так добре дізнатися, що те, що ти вважала нормою для себе, таки підтверджується.Одна з тих книг, яка поглиблює знання про себе, свою сексуальність, тілесність та ментальність."
85,https://www.goodreads.com/user/show/6537209-ekaterina-egorova,Rating 1 out of 5,"This is very, very bad. Patronizing, repetitive, and uninformative. The good news is that Audible allows returning books which I didn't hesitate to do in this case."
86,https://www.goodreads.com/user/show/39291362-ljiljana-ipragi,Rating 5 out of 5,"Ako mene pitate, izuzetno važna knjiga koju treba da pročitaju i žene i muškarci. Možda jedna od najpoučnijih koje sam pročitala, i to ne iz ove, već generalne životne oblasti. Jako, jako dobra. "
87,https://www.goodreads.com/user/show/54177521-isaac-jones,Rating 5 out of 5,"Recommended for all my fellow white, liberal men out there wanting to virtue signal how feminist they are"
