,user_links,user_ratings,review_text
155,https://www.goodreads.com/user/show/81103111-maziar-mhk,Rating 3 out of 5,"
زارا!، تو با پول هات چیکار میکنی؟  فاصله می خَرَم - چطور؟ - رستورانایِ گرون، بخشِ فِرست کلاسِ هواپیما، هتل هایِ گرون، تو همه یِ اینا، فاصله می خَرم. تو این دنیایِ پُرِ آدم، گرون ترین چیزی که میشه خرید، فاصله ست
صفحه 105بَکمن، این شادومادِ ایران زمین، شُهرتش رو مدیونِ خلقِ رمانِ ""مردی به نام اُوه"" س. شهرتِ نامتوازنِ این رمان، در قیاسِ با سایرِ آثارش، شده حلوایِ تلخ!. داستان اینه که، متاثر از اثرِ ""مردی به نام اُوه""، که شاهِ+کارهایِ بَکمن هستش، بقیه آثارش دیده نمی شه، لاقل به راحتی و مُجرد و مستقل از اون ذهنیتِ قبلی، دیده، خونده و پسندیده نمی شه. در مورد ترجمه هم، حس می کنم، خانم رعایی، زورِ سرعتی زده تا اولین ترجمه از این اثر رو، خودش بِده بیرون. این وسط، سرعتِ موردِ انتظارِ ایشون، کیفیتِ موردِ توقعِ ما رو قورت داده. اَصن اَزش راضی نیستم. ترجمه های ""فرناز تیمورازف"" از آثارِ بکمن، وسواسِ مُکفی و خوش خونیِ خاصی دارنتو این اثرِ جدید الترجمه، داستان چن نفر که خیلی اتفاقی تو یه گروگان گیری درگیر میشن، با فلش بَکی به یه خودکشی تو ده سالِ پیشِش روایت میشه. شدتِ اتفاقی بودنِ ملاقاتِ این جمع، اونم بعدِ ده سال، یِکَم مسخره طوره راستیتش. ""بکمن"" تو این اثرِ جدیدش، افتاده تو خطِ نسخه پیچیدن. به این معنا که، از اون روایتِ خالصِ مردی به نامِ اُوه، فاصله گرفته. یکی نیس بِش بگه، مردِ مومن!، حاجی!، عمو!، چون مشهور شدی، دلیل نمی شه حس کنی روحِ ذهنِ داستایفسکی تو جسمِ قلمِ تو حلول کرده!. جالب تر اینکه، یه حسِ میهن پرستیِ خیلی عُریانَم پیدا کرده. مثلاََ خیلی زیرپوستی، برندِ سوئدیِ ""ایکیا"" رو تبلیغ میکنه یا اینکه رو بحثِ کاهشِ آمارِ فرزندآوریِ سوئدی ها، خیلی مانور میده و با احساساتِ مخاطب بازی می کنه. نویسنده، یه جایِ کتاب، خلاصه داستانو اینطور روایت میکنهاین رمان، داستانِ یک پُل است، و داستانِ احمق ها، و البته داستانِ یک گروگانگیری و یک بازدیدِ آپارتمان. اما داستانی عاشقانه هم هست. در واقع، داستانِ چند عشق. فصل 52 - صفحه 224"
156,https://www.goodreads.com/user/show/1418580-wendy,Rating 5 out of 5,"Fun, Funny, Quirky and Sad!This novel had my head spinning in such a wonderful way!One really bad idea can ruin a person's life! Anxious People is the story of a bank robber and a hostage taking during the Open House of an apartment for sale. Comedy ensues as the police try to rescue the hostages and determine exactly what happened. The author reminds us, on numerous occasions, that this is a story of idiots, a roomful of people unbeknownst to each other and how there lives will forever be changed on this day.In true Backman style he delivers magic on every page.Loved it!"
157,https://www.goodreads.com/user/show/40997852-nicole,Rating 3 out of 5,2.5 starsThis book was underwhelming compared to Beartown. Lots of useless chit chat. A friend warned me it’s not as good but I still expected a better story.. I have been looking forward to this book but I can now say I’m disappointed. Not say it was terrible because it’s not. It’s just not good enough.
158,https://www.goodreads.com/user/show/45796209-bkwmlee,Rating 5 out of 5,"I’ve been wanting to read a Fredrik Backman book for a while now (I have pretty much all of his previous works on my TBR), but hadn’t found the time to do so until recently when I was approved for an ARC of his latest novel 
Anxious People
 (which is scheduled for publication next month). Of course, I had high expectations going into this one given the reputation of the author — well, after I finished reading, my first reaction was: Wow! Now I know why Backman is such a beloved author to so many (my second reaction was: I need to go back and read all his previous books, like asap!). This book was so unlike anything I’ve read before. On the one hand, this was a sad story where each character had at least one (in some cases more) issue they were trying to deal with -- issues “serious” enough so as to make their lives seem utterly miserable and hopeless: be it a painful memory from their past that they were trying to suppress, worries over an uncertain future after entering a new stage in life, fear of losing loved ones due to circumstances beyond one’s control, feeling helpless in the face of life’s many injustices, etc. There were also some “heavy” topics explored in the story, such as death, suicide, divorce, betrayal, emotional and psychological distress, etc. But yet, this was not a “heavy” read at all – in fact, truth be told, this was actually one of the funniest books I’ve ever read! Yes, I know it sounds odd – after all, how can a story be so sad and heartrending one minute, to the point that I’m tearing up, yet so witty and hilarious the next minute that I found myself laughing until my insides hurt? Therein lies the brilliance in the way Backman crafted the story – the topics were heavy, yet the light-hearted tone in which this was written didn’t diminish the issues in any way...in fact, it did the opposite in that it actually made me pay more attention to the circumstances that caused the characters to be in the predicaments they ended up in.  Speaking of the characters, they were another reason why I loved this book so much. All the characters were so brilliantly written – every behavior, emotion, quirk, personality flaw, etc was so spot-on! Also, each character had distinctive personalities, yet their experiences and behaviors were so relatable and resonant on a personal level that with every single character, I actually found something in common either with myself or with someone in my life (in fact, I was nodding my head so often when I came across some familiar trait / habit / circumstance with the characters that I ended up with a neck cramp after I finished reading, lol). If I had to sum up this book, I would say that, in essence, this is an ingeniously-told, character-driven story that, at its heart, explores the trials and tribulations of what it means to be human.  Another thing I loved about this book was its cleverness in terms of structure. On the surface, it sounded like a really simple story – so simple in fact that, after the first 10 pages or so, I thought for sure the story was over, as what else was there to tell? A lot, it turned out! The “simple” story turned into multiple seemingly unrelated threads, with various tidbits of information added here and there as the story progressed that seemed to alter the narrative slightly -- just when I thought I had things figured out, well, it turns out I had nothing figured out at all! The way all the variant threads came together so perfectly and flawlessly at the end, I only have FIVE WORDS* to describe my reaction: Fredrik Backman is a genius! (*inside joke for those who read the book). If this review sounds a bit vague, note that this was done on purpose, as nothing I say (or write) about this book will be able to do it justice. You need to experience this wonderful book for yourself – and sooner rather than later! Oh and if you’re like me, who usually only skims the Acknowledgements section after finishing the book, you may want to actually read this one, as it was as much fun as reading the book itself! Received ARC from Atria Books via NetGalley."
159,https://www.goodreads.com/user/show/68802200-chasity,Rating 5 out of 5,"“That’s the power of literature, you know, it can act like a little love letter between people who can only explain their feelings by pointing at other people’s.” Yep, that’s exactly how I feel about Backman’s books- little love letters that control all my feelings. I expected Anxious People to be good, but was a bit afraid it couldn’t live up to Beartown. While Beartown is still my favorite, this lived up to what I hope to get out of Backman. Anxious people could be unbelievable at times, but I think maybe that was part of the point. Backman always refers to fairytales and good stories, and that’s exactly what he told. I wasn’t attached to the characters at first, and thought- “nope- not gonna cry over this one.” But, once I got invested, that theory went out the window. Complex characters, fun storyline, and so, so much more. "
160,https://www.goodreads.com/user/show/15546696-nilton-teixeira,Rating 4 out of 5,"Rounded to 4 stars.I confess that I had no idea what to expect.When I started reading this book I immediately had goosebumps because some lines were very strong and witty.I loved the writing and I thought that the structure and development of the story was brilliant. There were so many interesting twists.But this is not my favourite work by this author.Although I found some parts funny, not once I laughed out loud. There is too much quirkinesses. There were times that I was tired of it as I found repetitive. A small dose would have made me appreciate this book a lot more.The characters are interesting, although a bit rude, and nicely developed for such small book (I have never met a group so bizarre in a bizarre situation).The author’s understanding of the human nature is impressive and I believe that the translator did a great job.There are some great tender and moving moments but I wasn’t touched like I was while reading “Beartown”, my favourite book by this author."
161,https://www.goodreads.com/user/show/3865693-lindsay,Rating 1 out of 5,"This book was the worst. Every other chapter repeats and the off chapters involve annoying and frustrating characters who do nothing to push the plot along. It’s as though they’re annoying for nothing. The characters are also depressing with divorce, homelessness, infidelity, suicide, etc. I read and read hoping to eventually feel like this book would redeem itself, but instead, I just started resenting it. I’m usually pretty lenient with books, but wow. This book was so annoying that it made me angry. I want my time back. And I get that it was meant to be a comedy, but unless you like jokes based on pedantic annoyances, this book isn’t funny. (And for the record, I have GAD, and this is nothing like how many anxious people act. To act as so is a disservice to those folks working through their anxiety.)"
162,https://www.goodreads.com/user/show/7101240-shelovesthepages,Rating 5 out of 5,"Yes. Yes. Yes. Read this book immediately. I laughed and I cried. It was the kind of book that I never wanted to end. And the quotes. This book has all the quotes. You'll be wanting some post-it flags to remember all the amazing lines that Freddie B has given us. You'll love the characters because, as Backman says, they're idiots....in the best possible sense of the word. They're infuriating and endearing. They're shallow and caring. They are the most amazing bunch of idiots you'll ever read about. This is a book that will stay with me for a lifetime.⭐⭐⭐⭐⭐ 5 StarsI highly recommend this read!"
163,https://www.goodreads.com/user/show/108913620-not-my-high,Rating 5 out of 5,"4.5 Serio świetna, poruszająca, zabawna, przemyślana książka. Nawiązałam silną więź z bohaterami i większości rzeczy za nic bym się nie domyśliła. Plasterek na czytelnicze serceTW samobójstwo, myśli somobójcze, depresja i zdrada (jest to ważne w tej historii, ale nie przytłacza i jest poruszone z szacunkiem, dlatego uważam że książka będzie odpowiednia dla osób 13+)"
164,https://www.goodreads.com/user/show/17957823-erin,Rating 4 out of 5," Thanks to Netgalley and Atria books for an egalley in exchange for an honest review. My favorite Swedish writer is back with a series of quirky characters and one heck of a very strange scenario. But as I have realized in reading Frederik Backman's books, it's better to tighten your seatbelt and enjoy the ride than to ask serious questions. I was more than ready to read one of my eagerly anticipated novels of the fall.  A bank robbery. A hostage drama. A stairwell full of police officers on their way to storm the apartment. It was easy to get to this point, much easier than you think. All it took was one single really bad idea. This story is about a lot of things, but mostly about idiotsI don't know about my fellow readers but I enjoy a story in which several flawed individuals manage to make a situation even more crazy than it originally was. No doubt Backman was amazed by what police officers Jack and Jim had to encounter during the interview of the witnesses. All I know was I couldn't stop laughing. But I don't want people to walk in thinking it's just straight up comedy. Rather there are some fairly serious topics that Backman tackles- infidelity, suicide, mental illness etc. These are handled with the most care and as the storyline progressed I became increasingly attached to Zara, Jules and Ro, Roger and Anna-Lena, Estelle and even the rabbit ( you'll see)! Fantastic unforgettable read! Goodreads review published 03/08/20 Expected publication date 08/09/20"
165,https://www.goodreads.com/user/show/56574709-lucy,Rating 5 out of 5,"This is a story about a lot ... and I loved it all 😁.I enjoyed the writing style, the characters, the dialogue, and the constantly developing storyline. This is a story about lots of things, but mainly about the way our life and interactions affect others. There are eight anxious people in the story and a father-and-son police team I won't soon forget. Overall, this is a funny and touching story with a beautiful message.I used both the Kindle edition and audiobook. If you have the choice between print or audiobook, I recommend the audiobook. Read by Marin Ireland, the story really comes to life. Now I can't wait to watch the Netflix series based on this book!"
166,https://www.goodreads.com/user/show/141624019-anabel,Rating 5 out of 5,"""one of the most human things about anxiety is that we try to cure chaos with chaos."""
167,https://www.goodreads.com/user/show/2795921-justin,Rating 5 out of 5,"I’ve tried to read A Man Called Ove at least three times. I’ve never been able to finish it, and because of that I’ve unfairly written off Backman and everything else he’s written since then. Oh, I’m aware of his books. I see people reading them and loving them, but I just shrug him off every time. Until now. Anxious People had a compelling plot m, and I decided to give this guy another shot. Hot damn, I’m so glad I did! I seriously can’t remember the last time I had this much fun reading a book. Probably Then We Came to the End by Joshua Ferris. I guess I can remember. There’s probably plenty of other times, too. Man, I loved this book. Anxious People is a lot of things, and it openly admits that to you as you read through it. There is a bank robbery. There is a hostage situation. There are twists and turns. There is a lot of humor. Oh, and there are anxious people. Anxious police officers, anxious hostages, and anxious bank robbers. The book bounced around a lot, moving the story forward, revealing more details, but it also spends time unpacking all of the characters in interesting ways. It’s a pretty moving story, too. It’s not really about the robbery or hostage situation. Those things are definitely there, and there are plenty of twists along the way related to them, but the story is ultimately about the anxious people. There are so many underlineable quotes or sentences in this thing, so much that I felt like I could relate to. I don’t want to give away much, but the main themes of the book are pretty universal, and I think there is something for everyone here. It’s a lot of things at once, but this book is just a lot of fun to read. I was laughing out loud often, and I was a lot of other emotions at other times. I had a tough time stepping away from this story to do life stuff, and I highly recommend this to everyone who likes books (which includes you). If you don’t like books, I’m not sure why you’re here or on Goodreads at all. I’m now going to check out more Backman books. Here’s to second, third. And fourth chances. "
168,https://www.goodreads.com/user/show/34443678-maria-roxana,Rating 4 out of 5,"„Suntem doar străini care trec unul pe lângă celălalt, iar anxietatea ta o atinge în treacăt pe a mea când fibrele hainelor noastre se încurcă și se descurcă preț de‑o clipă în aglomerația de pe un trotuar. Și nu știm niciodată cu adevărat ce facem unii cu alții, unii pentru alții, unii împotriva altora.”„Asta‑i forța literaturii, știți, să fie ca mici scrisori de dragoste între oameni care nu pot vorbi despre sentimentele proprii decât prin cuvintele altora.”„Cel mai scump lucru pe care îl poţi cumpăra, în cele mai aglomerate locuri din lume, e distanța.”„Căci ăsta e rolul părinţilor – să fie umeri. Umeri pe care copiii să se urce când sunt mici, ca să vadă lumea, umeri pe care să stea când sunt mari, ca să poată atinge norii, umeri pe care să se sprijine când paşii le şovăie sau se clatină sub lovituri. Se bazează pe noi şi asta e o responsabilitate uriaşă, pentru că ei încă n‑au înţeles că habar n‑avem de nimic.”""De ăia care sunt doar frumoși te poți lipsi, Jullan. Dar ăștia care te fac să râzi, ehe, cu ăștia să stai și-o veșnicie!""”Planeta va supraviețui miliarde de ani și fără oameni. Nu ne ucidem decât pe noi înșine.””N-am spus că banii aduc fericirea. Am spus că fericirea e precum banii - o valoare inventată care echivalează cu ceva ce nu poate fi cântărit sau măsurat.”""Se spune că Dumnezeu râde e cei care își fac planuri. Dar se pare că nu ne învățăm minte niciodată."""
169,https://www.goodreads.com/user/show/3060349-karen-r,Rating 4 out of 5,"I have eagerly anticipated reading Backman novels ever since his first, A Man Called Ove. I have loved each one, having never felt let down. The characters he conjures up are unique, his creative and complex storytelling brilliant.This book was yet another joy to read. Backman’s interconnecting characters are flawed humans, quirky and unpredictable. His insight into the ups and downs of human behavior, the ins and outs of relationships flow in an absolutely perfect way. One of my favorites of the year!"
170,https://www.goodreads.com/user/show/71209063-stefanp,Rating 5 out of 5,"Kažu da čovjekova ličnost predstavlja zbir njegovih iskustava. Ali to naravno nije istina, barem ne u potpunosti, jer kada bi naša prošlost bila sve što nas definiše, ne bismo bili u stanju da podnesemo sami sebe. Moramo imati priliku da sami sebe ubijedimo da smo nešto više od grešaka koje smo počinili juče. I da predstavljamo svaki naš sljedeći izbor i svako naše sutra.Knjiga koja vrca od naivne duhovitosti, šarmantnosti i duboke ironije. Ovdje je sve naopačke. Ova priča lovi čitaoca od samog njenog početka, lovi ga na radoznalost. Priča je koncipirana da se ide iz mnoštva ka jednom. Bakman pokazuje kako ljudi samo dok se drže zajedno mogu da prevaziđu mnoge terete, i da sve što se desilo ili se dešava, ili će se desiti je samo istorija i proizvod neminovne ljudske sudbine koja je neumorna, i čiji su konci međusobno povezani. Ona počinje u jednom sumračnom tonu, potom polako tone u mekoću gdje se intimnost gasi, a onda odjednom neki nagli izlivi radosnih okolnosti. Iako se čini da je Bakman nekako preračunao junake, bilo njihovom simpatijom i antipatijom, usamljenošću i sudbinksom poznanstvu, on ih ne ostavlja praznim. Svi likovi kao da su dostojni svoje pažnje s obzirom na teatralno izvođnje svojih izvještaja o događaju. Svijet kakav je Bakman predstavio u ovom dijelu je naša otužna svakodnevnica.Banka, most, nekretnina. Ove tri riječi biće dovoljne da se zamrse i odmrse konci, i ispripovijeda ni više ni manje nego jedna zanimljiva priča o idiotima."
171,https://www.goodreads.com/user/show/4729956-crystal-craig,Rating 1 out of 5,"Unfortunately, this was a DNF. Anxious People isn't my first Fredrik Backman book; that honour goes to the hilarious, A Man Called Ove, a book I laugh about often.So, I opened the book, and of course, I read the dedication.""This book is dedicated to the voices in my head, the most remarkable of my friends.And to my wife, who lives with us.""I laughed. Yes, my sense of humour is fully intact. I thought I'd mention it because this is supposed to be a funny book. Still, I spent significant time rolling my eyes and adding permanent frown lines to my forehead. (That's not good—anti-wrinkle cream isn't cheap.)I stopped reading at the 40% mark; my review reflects that. I don't know what happened. I was excited to start, but I am disappointed. I didn't connect or care about the characters. The writing was wordy and overbearing. The police interviews were unrealistic; I felt like I was reading a TV sitcom script. Now I understand the book is about idiots. But it would be rather idiotic to continue reading when my level of enjoyment equals zero. Beartown is on my to-read list, so I'm not giving up on Fredrik Backman. However, I'm hoping Beartown has more Ove and a little less Anxious."
172,https://www.goodreads.com/user/show/2190064-nenia-i-yeet-my-books-back-and-forth-campbell,No Rating,*raises hand*You called?
173,https://www.goodreads.com/user/show/19611831-cherie,Rating 3 out of 5,"Light and whimsical, but too much whimsy for me. Too much over the top. I think my expectations were too high. Disappointing."
174,https://www.goodreads.com/user/show/279256-diane,Rating 4 out of 5,"This was a book I didn't expect to love, but I did.A friend whose reading opinion I trust had recommended ""Anxious People"" to me, but I was still a bit wary because I wasn't a fan of Backman's earlier book, ""A Man Called Ove."" (Yes, I know that novel is beloved and I'm in the minority for not liking it, but that's how it is.) Anyway, my friend knew that I hadn't cared for the Ove novel, but she insisted she thought I would like this new book, so I gave it a listen. First, I have to share that ""Anxious People"" is a great audiobook, narrated by the marvelous Marin Ireland. Her different voices for the characters were simply fantastic. It's been a few weeks since I finished it, and I'm still giggling about her performance of some of the bits in the book.There is no way to accurately describe the plot, other than to say it follows a group of characters who happen to be connected to an apartment viewing, which coincidentally is near a bank, which happened to be the place of an attempted robbery that same day. Hijinks ensue.I was a bit astonished at how cleverly the author wove together all the various plot points and characters. There was also a surprisingly thoughtful discussion of the problems with the banking and real estate systems, and their negative effects on society — none of which I was expecting but I appreciated it was there.In short, this novel was a delight, and also a pleasant distraction during an incredibly intense news cycle following the presidential election. Highly recommended if you enjoy clever comic novels that have a lot of heart."
175,https://www.goodreads.com/user/show/35179119-linda,Rating 4 out of 5,"Anxious People is my second book by Backman. It is quirky, absurd, hilarious, and humane. It is the story of a would-be bank robber who attempts to rob a cashless bank and, to avoid the police, runs across the street and ends up in an apartment viewing. Thus, the robbery becomes a hostage situation with the quirkiest set of hostages imaginable. I almost did not finish the book. The initial police interviews with an irritating real-estate agent and a hostile, defensive apartment viewer were over the top. However, I decided to stick with it. I listen to books on tape when I do my chores, and when I started to realize that I was looking forward to doing the dishes, I knew that Backman had hooked me yet again. I thoroughly enjoyed the book. It is a great escape written with humor and heart."
176,https://www.goodreads.com/user/show/142676921,Rating 5 out of 5,قبل خوندن آخرین رمان بلند بکمننگران بودم نکنه ازش خوشم نیادنکنه به اون عالی‌ای که می‌گن نباشهنکنه سرش هایپ شده باشم و ناامیدم کنهحواسم نبود، طرف‌حسابم بکمن لعنتیه.
