,user_links,user_ratings,review_text
76,https://www.goodreads.com/user/show/28485530-b,Rating 5 out of 5,"This was the perfect mix of comedy, serious topics, and heartwarming. I truly can’t express how perfectly balanced it was. The basis of the story is a hostage situation after a failed bank robbery. But the hostages are in an apartment viewing across the street, where our bank robber ran to when they though the police were after them- after they attempted to rob a cashless bank. The story is told after this has taken place, when the police are interviewing all of the hostages & the teller, desperately trying to find out how the bank robber disappeared. We learn of the backstories of each of our hostages, the most difficult witnesses to ever be interviewed (in a clueless/trying sort of way), because they’re so much more than this one event. TW: cheating, suicide, depression, gunsEvery character was perfectly fleshed out. I never felt like I didn’t know the characters enough, instead feeling like I’d known them for ages. I love how their stories connected & the relationships that were in this. I loved getting to know this gang and trying to figure out who the bank robber was & where they’d gone. I think the mystery was perfectly solved, and the perfect end to the story. I actually don’t have a single thing I would change about this."
77,https://www.goodreads.com/user/show/132118435-kezia-duah,Rating 5 out of 5,"This was absolutely phenomenal. From one second, I’m laughing my head off and next, I’m thinking way too deeply about life and the lives of people around me. The interviews were so funny, and I was wondering what the heck was wrong with these people. I’m glad it made sense at the end though. All the characters were so interesting. NO, seriously, all the characters were freaking unique. I swear I’m so used to reading so many boring, flat characters and, then once in a while, I'm blessed with this book. I just want to be as bold as these characters are when someone is holding a gun nearby. I also love how the twists kept coming. They weren’t super shocking, but they still gave me the feeling of “Oh, I did not see that coming!” Are all Backman’s books this good? If yes, this bitch is about to go on a Backman book marathon. I also really loved the ending. It was all about people understanding each other, which is such a great lesson. Great job Backman!"
78,https://www.goodreads.com/user/show/25258261-katie-colson,Rating 5 out of 5,"December 2021:I reread this to see what would go into my top books of the year.I am giving this 5 stars again but I will say it didn't slap as hard the second time around.It is fantastic. The quotes about adulthood and parenthood and depression are top notch. Most of those moments are in the first third of the book however.Upon a reread I realize that I put a bigger emotional impact on some of the moments then the book actually warranted. But it is a very sad and heart warming book. I highly highly recommend.Definitely going into my favorites of the year.March 2021:reading gabbyreads favorites: https://youtu.be/3jlTg6wIW5oEXCUSE ME?! My first Fredrick Backman and he came out SWINGING! I loved this book.I had the misperception that Fredrick Backman's writing was going to be above my reach. That I wouldn't grasp it. Boy was I wrong. This is fun and fast in so many ways while also being deeply emotional and philosophical. Everyone has said it but I cried. Oh I cried reading this. It just had a way of being so close to reality. In a ""this could be you"" way. Also, Zara is everything and I love her."
79,https://www.goodreads.com/user/show/60964126-ceecee,Rating 4 out of 5,"This is a story about idiots What? Yes, idiots! A bank robber attempts to rob a cashless bank asking for a very specific and low amount of kroner. It descends into a hostage situation at a apartment being viewed for sale by potential buyers. The hostages are eventually released after inevitably had pizza delivered - as that happens at every hostage situation, right? The police storm in, find blood but no robber. All the hostages are interviewed by police officers Jim and Jack a father and son, who are among others, anxious people. I love Bachman’s digressions which frequently aren’t, but it’s funny and is typical of how a mind flits from subject to subject. Well, mine does anyway! There are so many acutely pertinent and acutely observed statements about people, society, Stockholm (!) and Stockholmers, age gaps and social media among others. The writing is funny, emotional, heart breaking, heart warming, and moving in equal measure. The characters are fantastic, I especially like Estelle, the oldest hostage at 87. She’s fab. I have a sneaking admiration for London the bank clerk, who though rude, did provide so real laugh out loud moments. She’s ballsy too! What can I say about the hostage rabbit? Well, that’s an unusual image if nothing else, especially as he was trouserless!!!! That enters the realms of rather bonkers!! The interviews between Jack/Jim and the hostages are also barking, nuts, crazy but there is a reason ......... and I like it! The story is full of connections though you don’t initially see how they can possible be connected as they seem so random. Overall, a highly entertaining read that via zany humour makes some astute observations and keeps you interested throughout. With thanks to NetGalley and Penguin, Michael Joseph for the ARC."
80,https://www.goodreads.com/user/show/721595-melissa-semi-hiatus-due-to-work,Rating 5 out of 5,"Oh my, how I loved this book. It just spoke to me on so many levels, I absolutely loved how things fit together in the end. The growth of the characters, how they learned about themselves and about those they loved...just all the feels and I had tears streaming down my face for the last 10% of the book. It is a challenge to all of us to celebrate life, no matter how difficult, no matter how mundane. To reach out to others even when they are prickly and strange, to meet people where they are and let them into our lives and join them where they are. This book made me think of the quote ""What is it you plan to do with your one wild and precious life?"" Dive in. Don't be a Stockholmer. I voluntarily reviewed a complimentary copy of this book, all opinions are my own. "
81,https://www.goodreads.com/user/show/40464194-hamit,Rating 4 out of 5,یه گروگانگیری احمقانه با گروگان های احمق. واقعا لذت بردمبذارید کلیت قضیه رو براتون بگم. یه گروگانگیری رخ داده، گروگان ها آزاد میشن ولی گروگانگیر غیبش زدهالبته داستان همش در مورد گروگانگیری نیست. بیشتر در مورد شخصیت هاییه که درگیر این گروگانگیری هستن. درباره ی گذشته اشون، غم ها، شادی ها، عزیزانشون و ارتباط و تأثیری که هرکسی میتونه روی یکی دیگه بذاره راستی ده سال قبل از این داستان ها، یه مرد هم از روی یه پل پریده پایین و خودکشی کردهاصلا داستان در مورد یه پل ـهکتاب انواع و اقسام احساسات تلخ و شیرین و.. رو بهتون منتقل میکنهاون حالت معماگونه اش هم تا آخرای کتاب حفظ میشه و داستان ابدا جذابیتش رو از دست نمیده. واقع گرایانه هم نیست. نه شخصیت هاش و نه روایتشاین اولین کتابی بود که از بکمن خوندم و از قلمش خیلی خوشم اومد. همش تا اون مرز شعاری بودن پیش میرفت، ولی هیچوقت ازش رد نمیکرد و همین خوندنش رو خیلی لذتبخش کردالبته یه جاهایی توی شخصیت پردازی زیاده روی کرده بود که اونقدرا هم مهم نیستکلا از این کتاب هاست که وقتی تمومش میکنی، حال خوبی بهت دست میدهنسخه ی فارسیشم مستقیما از سوئدی ترجمه شده و خوب و قابل قبولهالبته یه جاهایی ویراستاری رو به اعضا و جوارحشون گرفته بودن و ما هم به ناچار میگیریم
82,https://www.goodreads.com/user/show/39722464-arini,Rating 5 out of 5,"4.5 StarsHere’s some heavy stuff without actually being dreary or cringey and preachy.I don’t think I’ve ever been this amused, touched, and understood reading a mystery about a bunch of quirky obnoxious idiots who are trapped in some kind of a bank robbery and hostage situation during an apartment open house session. Being a cop in this book is a tough job.I think that the mystery is not meant to be taken too seriously because it’s just a disguise, a setup, or a literary device to convey the real lessons, messages, and little takeaways about life and being a human this book wants you to find and resonate with. All the characters are distinguished, realistic, relatable, and funny.There may be some who feel the book’s witticism and offbeat-ness grating on their nerves. Especially, the part during the interview between the police and the witnesses. I personally find it highly entertaining. Reading this book feels like a pat on the back in reassurance and an embrace.Overall, this author is a genius and his book the height of comedy fiction.
(Read as an Audiobook)
"
83,https://www.goodreads.com/user/show/64641295-antje,Rating 5 out of 5,"Pete Davidson can pack his bags bc Frederik Backman is THE FUNNIEST PERSON ALIVE. And btw, I cried reading thisIt’s 12 hours later (after finishing this book), and SPOILER ALERT, I’m UNWELL. Before the review itself, let me tell you something. About 4-5 years ago, I started reading “A Man Called Ove”, which is probably the most famous book from this author. I read about a hundred pages and never finished the book. Why, you may ask. It made me SAD, and not in a cute way (I like sad books but that was TRAUMATIZING. And the sadness started on page 1, like, what happened to HELLO??? HI??? HOW ARE YOU DOING???And then I read this one…And I was TRICKED. Cuz it was equally as sad, just packed in a humorous package. And I ate it up, and now I’m left empty. OOPSPLOT This book follows the events of one bizarre heist and the EVEN MORE BIZARRE aftermath, a hostage crisis. During an apartment viewing, a masked man barges in and takes all people present hostage. Through a series of weird events, the situation is resolved, but once policemen release the people and get in the apartment, the masked man is nowhere to be found. Where did he go and why is there blood on the floor?THOUGHTS I wouldn’t say this book belongs to a specific genre. It’s closest to a mystery, and trust me, PLOT TWISTS came out of nowhere, and there were so many of them. Every single page you turn you cry for help! (that’s how I like my books) We don’t really have a main character, the story follows the lives of about 10 people who are, totally “accidentally”, involved in this bizarre heist. Yeah, you guessed it, they’re all connected, but how, I’m not gonna tell you, you have to read it to find out (I’m doing you a favor, this book DESERVES TO BE READ). As I said, this book was BEYOND FUNNY (I love my gemini authors), but it was “laughing through the pain” ngl. I love how Backman cooked all these hard life topics and served them as an ice coffee that you can take on the go. So, it was very humorous, but don’t think about the meaning of the jokes, CUZ YOU WILL END UP CRYING. The writing style is so simple yet so unique and personal, unmistakably Frederik Backman. The book was indeed a bit long and the story did kind of drag, but it was still VERY WORTH IT. Also, I want to point out how this book is “job-interview-my-hobby-is-reading-this-is-my-favorite-book”material. I do say this EVERY TIME I end up liking a book, BUT PLEASE READ THIS ONE. It made me think about so many important aspects of life while also giving me the jokes, and LESSONS, and a good cry (the ending was so sad). It’s a piece of literature I’ll proudly put on my shelf (I’m so glad I have a physical copy) and force all my friends to read it! CATCH ME talking about it ALL THE TIME!STRAIGHT TO THE ALL-TIME-FAVORITES SHELF!TW: This book deals with the topics of depression and suicide. Your mental health should be your first priority, so if you’re easily triggered, don’t mind my raving and skip this one! Happy reading!💕🏩"
84,https://www.goodreads.com/user/show/8665845-debbie,Rating 5 out of 5,"Pogo-stick time!! Woo-ee!OMG OMG OMG, bulls-eye! This book hit the spot! I was so wound up, I had to grab my pogo stick and hop! There’s nothing like a book that grabs your whole being and then shakes you silly. Okay. Trying to calm down. First, anxiety is my middle name, so how could I NOT read a book called Anxious People? Heading to the book, I was all good-anxious. But I was also bad-anxious because of my horrible run-in with Backman’s A Man Called Ove. (I fretted; would I be able to like ANYTHING by this writer?) Gawd did I hate that book. Gawd did I love this book! Ove was about a curmudgeon who sent me screaming like a pissed-off maniac. This book is about a bank robber who I wanted to sit and drink tea with. The bad anxiety flew right out the window as I dug in.This book made me hop, alrighty. It’s got such a bizarre, juicy plot that kept flipping and twisting, all inside-out. Naysayers call it over the top, I call it hilarious and genius. And the plot is intricate as hell. At no time could I figure out where the story was going—I completely LOVE it when that happens, it’s such edge-of-my-seat fun. As a bonus, there’s a wild mystery that kept me guessing (where oh where did the bank robber go?), and the solve was so damn creative. The book was intricately constructed—a masterpiece, in fact. With each new turn, I nodded in awe to the writer. I saw him at his desk, I imagined his imagination.Okay, the plot is bizarre and luscious, but so are the characters. You have a bank robber, a bunch of hostages, a real estate agent, a couple of cops, and a psychologist. All quirky, of course, and all interesting as hell (which is a feat because they are all just ordinary people). Some of them are invited to my tea party, but there’s one meanie you can keep. Well, even she ended up with some redeeming qualities. Actually, I think that’s where Backman’s genius lies: He makes you sympathize with every single character by the end. He has tremendous insight into the human condition, into what makes people tick. The story is about how all of these players interact and grow close. Relationships are rich. And Backman is really good at making his characters seem real. He takes a regular, flawed person; grabs a magnifying glass; and voila. Then he puts them all in a pot and watches as each one enhances the flavors of the others. You end up with a fantastic cast of characters.I also loved the language; it’s stylin’. And there’s a lot of humor, and there’s wisdom. I highlighted a lot. Here are some samples: “The four biggest little words one person, anyone at all, can say to another: It wasn’t your fault.”“You need psychology if you think you’re a dolphin. You need psychiatry if you’ve killed all the dolphins.”“You can always tell by the way people who love each other argue: the longer they’ve been together, the fewer words they need to start a fight.”“The bank robber blinked so many times that it looked like Morse code.”“Beads of sweat bounced from hair to hair on his bare back, like a singularly unappealing pinball game.”“You’re like a self-help book, only in reverse.”“Estelle knew no better way of saying that she cared about people than to ask if they were hungry.”One nit (and it just won’t go out of my head even though I am telling it to): Almost all of the hostages give the cops a lot of guff during their interviews, and they don’t let up. It’s sometimes witty but mostly it’s just annoying—enough already. First, who wants to listen to people argue? And second, it’s totally unrealistic to have every single hostage give lip. I’ve decided that authors find it easier to write conflict than to write harmony. Whatever the reason, I think it’s overkill here.I could return to gushing but I’ll spare you. All I will say is, if you want an absorbing, funny, poignant read, check this book out! It tickled me pink."
85,https://www.goodreads.com/user/show/49501801-carolyn-marie-castagna,Rating 5 out of 5,"When I tell you I love everything Fredrik Backman writes ,I genuinely mean I love EVERYTHING Fredrik Backman writes!!!!! I bought this book the second it was published in November of 2020! I raced to the bookshop and felt a thrill when I held it in my hands! Then, naturally, I proceeded to not read it for more than a year! I knew I’d love it, because I love absolutely everything Fredrik Backman writes! The only other book of his I haven’t read yet is Brit Marie Was Here, mainly because I don’t want to not have an unread Backman book on my shelves! Luckily he’s still writing and I get to look forward to new releases, but I still didn’t want to pick the book up and finish it! Well, clearly I finally did! And I still have Brit Marie waiting for me on my shelf, so I don’t feel entirely at a loss for unread Backman books! So, Anxious People, where do I even begin! What I love about this story and his writing, besides absolutely everything, is his humor! This book deals with quite heavy and important topics, but every page is full of laughter and the silliness of our “idiot” human minds!He kept explaining what this book was about, and I loved that! It’s about: a bank robbery, a hostage drama, an apartment viewing, a bridge, but most certainly, it’s about idiots! All it takes is one really idiotic idea! What Backman does so brilliantly, is show that we’re all idiots in our own way! This books is in fact about all those things I just mentioned, but mainly, it’s about how everyone is just trying to live their life the best they can! Sometimes life makes us do really idiotic things, especially when it comes to the people we love! I couldn’t put this book down! The past few days, while reading this story, life left like a series obstacle keeping me from reading it, and that’s one of the best feelings! This book is also about caring for people you barely know. What I find even more beautiful, is how as readers we not only care for people we barely know, but for people who don’t even exist! These people were made up by one person, who we also barely know, but through a collection of words, it feels like we’ve known them all our lives! Life does make us do really idiotic things, especially when it comes to reading! (I will continue to not read Brit Marie, because I don’t want to not have an unread Backman book on my shelves! Yes, that’s absolutely idiotic!) Please please please read this book, as well as all of his other books! Thank you Fredrik Backman! Sincerely,An idiot :)"
86,https://www.goodreads.com/user/show/12800930-bharath,Rating 4 out of 5,"No one today can tell a story with quirky characters & great humour, interlaced with commentary on lessons for life like Fredrik Backman can. In this book, a lot of the characters act pretty funny (after all it is announced as a story of idiots) but bare their soul.There is an incident around 10 years back where a man jumped off a bridge to take his life. There are people who saw and some who didn’t but the thinking and future of many were impacted. The link to this incident, with the characters and incidents of today is absolutely brilliant.There is this person who decides to rob a bank but chooses one which is cashless, and next runs off to a nearby building where a group of people are viewing an apartment for potential purchase. The bungling bank robber now has a set of hostages who are difficult to control. Each of those at the viewing have a story and many experiences. This is a small town and a father-son duo are the two cops who arrive at the scene. A more experienced negotiator has also been summoned from Stockholm. There are events to handle and puzzles to unravel.The strength of Backman’s stories is always in the musings which accompany the characters behaviours and here again the messages laced with humour are outstanding – our modern lifestyles, priorities, struggles, relationships, mental well-being and above all purpose. The mental well-being aspects when covered indirectly was great, but the direct ones via the therapy sessions felt pretty lame to me including some distracting and largely meaningless prattle around veganism. A lot of the good things about the book were said in the first half itself and it felt like the plot was being dragged later. The tempo does recover at the end, with some excellent summarization & commentary. My rating: 4.25 / 5.A thought-provoking read in the usual Backman style you cannot miss."
87,https://www.goodreads.com/user/show/18643650-mark-porton,Rating 4 out of 5,"Anxious People by Fredrik Backman was a breath of fresh air, it was funny, interesting, meaningful and wonderfully paced. I really enjoyed this book about a Bank Robber who isn’t really that good at bank robbing and ends up taking a group of strangers hostage. To say anymore would be to commit a gross act of spoilage.The humour, as all good funny stuff should be, came when unexpected and was genuinely funny, not laugh out loud funny, but amusing. Chuckle-worthy.The author makes the point we, us punters, are a bunch of ‘idiots’ making our way through this world. We are all negotiating our dramas (big and small) and mostly seem to make it to the end of the day. This is our common thread – the thing that binds us. We walk past each other in the shopping mall, sit next to each other at the traffic lights and are blissfully unaware of the similar difficulties our fellow humans are experiencing. I must say though, whenever I fly into a city, I always look at the rooves of the houses I fly over and reflect on what may be happening in each of those little boxes – good and bad. Sometimes, we need an event to throw us into the company of strangers, to learn about the lives of others. This story really makes one realise how we all seem to just keep going (mostly) no matter what is thrown at us, or when it’s thrown at us and in whatever quantity. It really is quite sobering. The author covers all of this with a wonderful splash of funny stuff.A really enjoyable read.Also – it’s Christmas Day here in Australia at this moment. I’d like to wish you all a Merry Christmas – this GR community is a wonderful thing and I feel really privileged to have become acquainted with quite a few of you. Much love to you and yours 😊4 Stars"
