,user_links,user_ratings,review_text
236,https://www.goodreads.com/user/show/138927400-emerson,Rating 5 out of 5,هر کاری از دستمان برمی‌آید انجام بدهیم. حتی اگر بدانیم فردا دنیا تمام می‌شود. باز هم امروز درخت سیب بکاریم. آن‌هایی را که می‌توانیم نجات بدهیم..
237,https://www.goodreads.com/user/show/101780502-nastaran,Rating 5 out of 5,می‌دونم که اکثر کتابای فاخر و درست‌حسابی غم و اندوه دارن ولی من ته دلم داستانایی با پایان شاد رو دوس دارم. داستان‌هایی رو دوس دارم که پر از احساسات لطیف و سرشار از زندگی هستن...خوندن مردم مشوش، مثل طعم و بوی شیرینی خونگی، مربا و چای تازه دم تو یه عصر شیرین قبل از تعطیلاته. البته فضای کتاب اصلا اینجوری نیست. این داستان تو یه زمستون سرد و تاریک تو یکی از شهرای کوچیک سوئد اتفاق میفته. خودکشی داره و گروگان‌گیری و هفت تیر و سرقت از بانک! خیلی جالبه که نویسنده با تمام این‌ها تونسته چنین داستان شیرینی خلق کنه!اولش احساس کردم این کتاب توصیف یه مشت آدم احمقه و با خودم گفتم اینا چرا اینجورین؟! اما بعد کم کم همه چیز مشخص شد و چند بار غافلگیر شدم و از خودم خجالت کشیدم که چطور روند ماجرا رو زودتر حدس نزدم!عاشق حرفای فردریک بکمن در مورد عشق، خانواده، احساسات والدین و... شدم. جلسات روانشناسی زارا رو هم خیلی دوست داشتم. تو طول روز یهو به خودم میام و می‌بینم دارم درمورد شخصیت‌های این کتاب فکر می‌کنم. هر شخصیت انقد تو ذهنم جزئیات داره که انگار واقعا میشناسمش. حتی قیافه‌هاشون رو هم تو تصوراتم ایجاد کردم! اینم بگم که شخصیت مورد علاقه‌م لنارته😅😅😅🐰🐰🐰طرح جلد خیلی قشنگه! نمیدونم سلیقه‌ی کی بوده اما به نظرم از جلد انگلیسیش قشنگتره!من ترجمه رو دوست نداشتم. خیلی بد نبود اما خیلی هم جالب نبود. بیشتر از همه، قسمتایی که ضرب المثل های فارسی داشت حرصم رو درمیورد! امتیاز واقعی من ۴.۵ ستاره‌ست اما انقد حس خوب گرفتم که گردش می‌کنم به بالا.یه زمانی که مود خوبی نداشتین و بار زندگی رو دوشتون سنگینی می‌کرد؛ بیاین سراغ این کتاب :)
238,https://www.goodreads.com/user/show/50297885-joy-d,Rating 4 out of 5,"The plot of this book sounds outlandish: the worst bank-robber ever accidentally takes hostages and finds out they are the worst hostages ever. A father and son, who work together in law enforcement, try to figure out what happened to the bank robber, who has mysteriously disappeared. Truly, though, the topic is conveyed in its title – it is about anxious people, and also about depressed people, suicidal people, and those that think they are not “good enough” or worthy of being loved. It is hard to explain this book without spoilers. It is like a big puzzle that is gradually assembled, all coming together at the end.Backman takes serious topics and examines them through the lens of an absurd situation. It is a very unusual mix of elements, but somehow, he pulls it off. The characters are quirky, each expressing one or more insecurities. Backman uses humor to illuminate human frailties. I felt empathy for these people. I chuckled a number of times at the author’s wry observations on our society. It is off the beaten path, clever, creative, and insightful.I obtained an advance reader’s copy from the publisher, Atria Books, via NetGalley. It is due to be published September 8, 2020."
239,https://www.goodreads.com/user/show/8119499,Rating 5 out of 5,"Αγαπώ τον Fredrik Backman. Είναι τόσο συγκινητικοί οι ήρωές του. Τόσο ιδιαίτεροι και ταυτόχρονα τόσο αληθινοί. Κάποιοι λένε πως ένα καλό μυθιστόρημα πρέπει να έχει δυνατή πλοκή, άλλοι υποστηρίζουν πως ο συγγραφέας πρέπει να δημιουργήσει ενδιαφέροντες ήρωες, άλλοι πιστεύουν πως ο τρόπος γραφής είναι το πιο σημαντικό. Ο Backman τα καταφέρνει όλα: ενδιαφέρουσα πλοκή, αξέχαστοι ήρωες κι ένας τρόπος γραφής που μιλάει κατευθείαν στην καρδιά. Το συγκεκριμένο βιβλίο είναι σαν το νερό που βράζει σε μια κατσαρόλα. Στην αρχή ζεσταίνεται, έπειτα κοχλάζει, βγάζει ατμούς και στο τέλος έχει τη σωστή θερμοκρασία κι είναι έτοιμο καυτό για να ρίξεις τα μακαρόνια. Κλείνοντας το βιβλίο ήθελα αμέσως να το διηγηθώ σε κάποιον. Είναι όμως τόσο δύσκολο να περιγράψεις τι συμβαίνει σε αυτό το βιβλίο (σε όλα του τα βιβλία) γιατί δεν μπορείς να μεταφέρεις τη μαγεία. Δεν γίνεται με τίποτα. Πρέπει να τον ανακαλύψετε, όσοι δεν το έχετε ήδη κάνει.Τον αγαπώ! Τον αγαπώ!"
240,https://www.goodreads.com/user/show/4332892-scottsdale-public-library,Rating 5 out of 5,"I've been on the waiting list for a couple of months now, but this quick read was well worth it! This book and its plot are not supposed to make sense- Backman even states at the beginning that this book is about idiots and idiotic happenings. There are several heartwarming moments throughout the book, and upon finishing it you'll most likely reflect on how to be more empathetic because everyone has a story they are not sharing. I quite enjoyed the overlap of humor and human reflection in the characters as well. Backman writes conversationally and to the audience, making it seem almost as if we the reader were another character looking into the story. The quick paced nature of the plot and twists and turns will make you want to finish in one sitting! -Hanna G."
241,https://www.goodreads.com/user/show/64899539-sylvie-semi-hiatus,Rating 5 out of 5,"5 Stars.This was my first Fredrik Backman book and I honestly had no idea what to expect from this. All I knew was that all of the books that he has written are highly praised. So I picked this up with high expectations and fortunately it didn't disappoint me one bit.I felt every kinds of emotions while reading this book: happiness, frustration, sadness, surprise you name it...I loved this book with every single fibre of my body. And If his other books are as good as this then I tend to read all of them in the very near future."
242,https://www.goodreads.com/user/show/16907451-erin-clemence,Rating 5 out of 5,"“Anxious People” is the newest novel by author Fredrik Backman, of “A Man Called Ove” and “Beartown”.  A seemingly normal open house, on the day before New Year’s Eve, is anything but ordinary when a bank robber (who had failed to rob a cash-less bank across the street) ends up holding the participants hostage. The hostages include two married couples who are vying for the apartment, an eighty-year-old woman, a man in a bunny suit and a seemingly uptight bank manager. As the police descend the bank robber must decide how far the hostage situation will go, and who, if only, of the hostages will be released. “People” is character driven, emotionally charged and poignant  (like all of Backman’s other novels)  while still managing to be downright hilarious and heartbreaking all at once. There is not an unlikable character in the bunch, and as they bond over their circumstances, each and every one reveals their vulnerabilities, and shows their human side. “People” has something for everyone, and there is at least one character that each and every reader will align with.Backman shines on a light on readers’ expectations and inner prejudices, as the bank robber is revealed to be someone completely unexpected. As only Backman can do, “People” also portrays the positive and caring side of humanity, even in dire circumstances. The short chapters make this novel easy to read and it is narrated almost completely in the third person. I was invested in each of the characters’ plot lines, and appreciated Backman’s unrealistic but completely cheerful ending. I am a huge fan of Backman’s work, and have been waiting on this one for a long time. A page-turning, hilarious plot with a big, fat dose of humanity is absolutely everything I wanted, and more. "
243,https://www.goodreads.com/user/show/11071314-maria,Rating 3 out of 5,"*3.5Am I happy I read this? Yes! Did this book leave me belly laughing at times? OMG YES! So why do I feel like it wasn't everything I wanted it to be? I guess I assumed this book would be more serious than I thought it would be, so maybe my feelings are just on me and what I expected. The writing is great, the characters are super weird and quirky and their dialogue us to die for (seriously, they're hilarious), but I just can't shake the fact that I was missing something the entire time. At the end of the day, it's a story about a parent and the lengths they will go to for their children. It's a story about understanding each other's difficulties in life, or choices. What's right and wrong. Love (self-love, acceptance, etc). Despite all these great things, I just didn't feel like I got as much as I wanted out of it). Maybe because I'm not a parent? I've read A Man Called Ove and Beartown by Backman before, and I loved the heartfelt characters and their stories. Compared to Anxious People, this new one just kind of felt a little disjointed between each chapter, from the way past and present interspersed to the witness interviews. It just wasn't as cohesive, or as clean of a transition that I personally enjoy. We jumped from one part to another, then went back halfway in-between the last chapter to find out more things. But like I said, this book is definitely really funny, and I did enjoy my time reading it. I just felt like I wasn't as connected to the story like I usually expect from Backman, so that did upset me a little. I know many people are loving this though, and I'm glad for all the 5 star reviews it gets!Ultimately, this book is about understanding yourself and others, and it is a book to keep on your radar and read. Whether this is your first book by him or not, I do think there's lots to be enjoyed about it!"
244,https://www.goodreads.com/user/show/7912849-kerrin,Rating 4 out of 5,"Since I normally enjoy Fredrik Backman’s quirky writing style, I was looking forward to reading his new release Anxious People. For the first part of the story, I wanted to rename the book Obnoxious People. Other than the two police officers, I didn’t like any of the characters. I wasn’t getting the “comical nature” of the book. Then about half-way through, the somewhat unreliable narrator gave a plot twist that changed the direction of the story. Afterward, I started to enjoy this convoluted tale more.In a small Swedish town, a bank robber attempts to rob a bank (but only for enough money to pay rent), but the bank is cashless and the robber gets no money. The bank robber runs across the street and stumbles into an apartment viewing. The bank robber locks the door and holds the people at the viewing hostage. Eventually, the bank robber frees the hostages. When the police enter the apartment, the bank robber has vanished into thin air.The novel starts with the hostages being interviewed by a young police officer, whose father is also his partner. The interviews are all quite difficult, and the witnesses seem like total idiots. Gradually, we learn the backstories of the bank robber, the hostages, the police officers, and also the psychologist of one of the hostages and the bank teller. These honest stories of ordinary, anxious people are the heart of the novel. Each of them asks themselves “What is love?” and “What would you be willing to do for love?”. Once the mystery of the disappeared bank robber is solved, the novel then provides the reader with the happily ever after stories of the characters.3.5-Stars rounded up to 4-Stars."
245,https://www.goodreads.com/user/show/3461034-trish,Rating 5 out of 5,"Bwahahahahaha! How can a story this tragic be so funny?! The answer is: Stockholm! ;)There is a bank robbery followed by a hostage situation. At least that is what the cops are calling it. In reality, the attempts were both so ridiculously botched that the only actual crime is how bad the perpetrator is at committing crimes. *lol*The hostage situation takes place at an apartment where prospectors meet. And boy, is that an idiotic bunch. *loool*Yes, the set-up is a bit of a far stretch but it’s still a nice frame for this story of failed marriages, the ruthlessness of banks ruining people, custody battles, various problems in various relationships etc. And then there is the son-and-father police team. *snickers*The topics addressed in this book can be quite dark (suicide) but the author knows that that is the perfect reason why to write this book in the hilarious way that he did. The „mystery“ isn’t actually one, I figured it out about 10% into the story but I think that was done on purpose - the less time readers spend trying to figure out a mystery, the more time they can spend with the characters and their problems.Honestly, this might not appear - at first glance - to be as profound as other books by the author, but boy, does it pack a number of punches. Not one big punch, but several smaller ones that don’t hurt any less.And yet, I laughed myself silly while reading this, just as the author intended, I’m sure. While simultaneously my heart broke a time or two.Therefore, this might be one of the more underrated books by this author, but it’s still brilliant."
246,https://www.goodreads.com/user/show/4675995-george-k,Rating 4 out of 5,"Πρώτη επαφή με τον Φρέντρικ Μπάκμαν (αν και στη βιβλιοθήκη μου έχω εδώ και πολύ καιρό το ""Ένας άνθρωπος που τον έλεγαν Οβ""), χωρίς αμφιβολία πέρασα ευχάριστα την ώρα μου, ένιωσα πολύ όμορφα διαβάζοντάς το, όμως οφείλω να πω ότι δεν ξετρελάθηκα κιόλας. Η αλήθεια είναι ότι με βάση τη βαθμολογία του βιβλίου στο Goodreads, αλλά και με διάφορα σχόλια αριστερά και δεξιά, είχα αρκετά υψηλές προσδοκίες, οπότε περίμενα κάτι που πραγματικά θα με εντυπωσιάσει, όμως απλώς πέρασα καλά. Ναι, καταλαβαίνω απόλυτα αυτούς που λατρεύουν τα βιβλία του Μπάκμαν: Δημιουργεί αξιοπερίεργους χαρακτήρες, έχει ωραίο και ιδιαίτερο χιούμορ, αγγίζει με τον δικό του ξεχωριστό τρόπο διάφορα κοινωνικά ζητήματα, ενώ σε κάνει να γελάς, να δακρύζεις (αν είσαι λίγο ευαίσθητος) και να σκέφτεσαι για τη ζωή σου και τους ανθρώπους γύρω σου, ενώ στο τέλος νιώθεις μάλλον αναζωογονημένος. Ναι, μου άρεσε το βιβλίο, έστω και αν σε κάποια σημεία η πλοκή έκανε κοιλίτσα και με έχανε λίγο. Χαίρομαι πολύ που το διάβασα -ειδικά αυτή την περίοδο-, γέλασα αρκετά και ένιωσα ποικίλα συναισθήματα. Και δέθηκα αρκετά με τους χαρακτήρες, όσο κουλοί κι αν ήταν. Και δεν πειράζει που δεν θα του βάλω πέντε αστεράκια. Το μόνο σίγουρο είναι ότι θα υπάρξει μέλλον με τον συγγραφέα (και όχι μόνο με το ένα βιβλίο που έχω στα αδιάβαστα)."
247,https://www.goodreads.com/user/show/146737464-georgiana,Rating 5 out of 5,"Later edit: tocmai am văzut miniseria și mi-am amintit cât de mult am iubit această carte! Dăcă ești sensibil, te simți puțin singur sau pierdut în drumul tău, te rog, dă-i o șansă! E tare frumoasă! Această carte mi-a redat apetitul pentru citit. E minunat scrisă, iar personajele sunt delicioase. Suntem atât de obișnuiți să putem etichete, să ne dăm cu părerea, să îi judecăm pe cei din jur, încât de cele mai multe ori, ne izolam în propria noastră lume imaginară.“Suntem doar străini care trec unul pe lângă celălat, iar anxietatea ta o atinge în treacăt pe a mea când fibrele hainelor noastre se încurcă și se descurcă preț de-o clipă în aglomerația de pe trotuar. Și nu știm niciodată cu adevărat ce facem unii cu alții, unii pentru alții, unii împotriva altora.” “Cel mai scump lucru pe care îl poți cumpăra, în cele mai aglomerate locuri din lume, e distanța.” “De aia care sunt doar frumoși te poți lipsi, Jullan. Dar ăștia care te fac să râzi, ehe, cu ăștia stai și-o veșnicie!” “Se spune că Dumnezeu râde de cei care își fac planuri. Dar se pare că nu ne învățăm minte niciodată.”"
248,https://www.goodreads.com/user/show/6526961-deacon-tom-f,Rating 4 out of 5,"To quote the Grateful Dead concerning, “Anxious People” by Fredrik Backman’s--”what a long strange trip it has been.”The book was quirky, wacky, clever and yet made profound points about the human condition, particularly empathyThis novel looks at a situation from a prismatic perspective. Seeing one shared event and how it is changing the course of eight lives at once eventually brought them all together.  A truly wonderful novel about a crime that happened, a would-be bank robber who disappears and others. It caught my attention. I became deeply concerned in the life of these people. It is written inusual prose but it works. Each of them are full of baggage like hurts, pain, secrets, and passions that are ready to boil over. The book is creatively constructed about friends, forgiveness, and hope in the most anxious situations.I recommend people to read this book."
249,https://www.goodreads.com/user/show/93394822-tala-x1f988-mrs-skywalker-reads,Rating 4 out of 5,"4,5 z serduszkiem uwielbiam to, jak poczułam się dzięki tej książce.Backman stworzył grupę irytujących bohaterów - fakt. A jednak strony książki leciały jak szalone (3:30 nad ranem kiedy to piszę), a ja odkryłam, że ich lubię. Nadal mnie irytują, a ich dziwne nawyki, zwyczaje i irracjonalne zachowania frustrują, ale są tak realistycznie i ludzko wykreowani, że nie da się im nie kibicować. I uśmiechać się z czułością, może odrobiną politowania.Książka napisana jest niesamowicie lekko, z fantastycznym humorem, nie popada jednak w głupotki. Wręcz przeciwnie, Backman z wyczuciem pisze o zdrowiu psychicznym, zarówno o wielkich kryzysach, jak i codziennych zmaganiach, w niektórych miejscach uderzając tam, gdzie najbardziej boli, w innych otaczając ciepłym kocykiem zrozumienia. Bo w końcu każdy z nas czasami (a może częściej niż czasami) sobie zwyczajnie nie radzi. Nie jesteśmy sami."
250,https://www.goodreads.com/user/show/47808844-nika,Rating 5 out of 5,"Піду плакати 💔пізніше спробую детальніше розповісти. Бакман це Бакман 💔те, чого й хотілося. Його добро та вміння писати для мене неперевершені."
251,https://www.goodreads.com/user/show/80316998-howard,Rating 5 out of 5,4.5 Stars for Anxious People (audiobook) by Fredrik Bachman read by Marin Ireland. This was some wacky characters in a unique situation with a strange backstory. 
252,https://www.goodreads.com/user/show/44095345-carmel-hanes,Rating 4 out of 5,"I like Backman, almost everything I've read that he's written. Some more than others, but all have been well-written and interesting. This one took me back to my initial exposure to him in A Man Called Ove, which I thoroughly enjoyed. Humorous, but also touching and apt in terms of the foibles of humanity. Anxious People gives us a bank robbery gone bad. Or good, as the case may be. The bank robber ends up with a motley assortment of uncooperative people, in a farcical rendition of how not to take hostages. Or who not to take hostage. The telling is purposefully confusing and a bit disjointed, moving back and forth in time, with teasers along the way. But it all comes together in the end, and the journey is strewn with little gems that are signature Backman, both the humorous and the apropos:""No one goes to see a psychologist to talk about all the times they weren't hit in the head by a swing as a child. Parents are defined by their mistakes.""""Not that this is in any way a defense of bank robbers, but they can have bad days at work, too. Hand on heart, which of us hasn't wanted to pull a gun after talking to a twenty-year-old?""And vintage Backman:""There are simply some things that all normal people understand that you must never under any circumstances do. You mustn't tell lies, you mustn't steal, you mustn't kill, and you mustn't throw stones at birds. we all agree on that.Except maybe swans, because swans can actually be passive-aggressive little bastards. But apart from swans, you mustn't throw stones at birds. And you mustn't tell lies. Unless...well, sometimes you have to, of course, like when your children ask: ""Why does it smell like chocolate in here?.....But you must never kill people. Well, unless they're Hitler. You're allowed to kill Hitler.""Backman can create a sense of someone and an indictment with a single sentence: ""...a woman called Zara. She's somewhere in her fifties, and beautifully dressed in that way that people who have become financially independent on the back of other people's financial dependency often are.""Backman makes me smile, and laugh out loud, and feel all warm and fuzzy inside. And that is just what I needed after some stressful weeks of life. He may shine a light on some of the ugly parts of life, but he does it in such a way that we can stand to look, and even feel good afterwards, as though it was wrapped in invisible hope all along."
253,https://www.goodreads.com/user/show/2195363-leslie,Rating 5 out of 5,"⭐️⭐️⭐️⭐️⭐️/5 Stars ""They say that a person’s personality is the sum of their experiences. But that isn’t true, at least not entirely, because if our past was all that defined us, we’d never be able to put up with ourselves. We need to be allowed to convince ourselves that we’re more than the mistakes we made yesterday. That we are all of our next choices, too, all of our tomorrows."" 

As with any Fredrik Backman book I've read since Beartown, I thought of Liz as I read this. It's been three years since she's been gone. I'll always treasure the memory of meeting her while meeting him. (I’m the one on the left!) For me, connecting with people about books is a special kind of magic. If you'd like to know more about that story, you can find it in my review of, ""Beartown."" I'm sorry, I haven't figured out how to post links to reviews yet.This book was beautiful. I felt it down to my core. On the surface, it's about a bank robber, hostages and police men. But like most Backman books, it's an iceberg. Those are merely the details we see going in. What's underneath is huge. It's messy and complicated, tangled and layered. It scratched and ripped at my heart until it was to the point of breaking. Then soothed and healed it. 🥰I think this is one of those books where it's best to go in blind. I will say that it took me a while to get into it but once I did, I simply couldn't put it down. Ultimately, it's a love story. More than one story. A collection of them woven into one book. And can't we all use a little extra love right now? 😘 “Your mom was right, the ones who make you laugh last a lifetime,” Estelle repeated, thinking of a British author who had written that nothing in the world is so irresistibly contagious as laughter and good humor. Then she thought about an American author who had written that loneliness is like starvation, you don’t realize how hungry you are until you begin to eat. "
