,user_links,user_ratings,review_text
47,https://www.goodreads.com/user/show/416888-heidi,Rating 4 out of 5,"4.5What I love about Tana French, even when I don’t always 5-star love each book, is that no two books of hers are alike. There are a lot of adjectives to describe The Searcher but suspenseful, action-oriented, page turning and surprising aren’t on the list. Because of that, some French fans may be disappointed in her latest. Me? I loved this book and how it both savored the “place” and was a thoroughly lovely, yet dark and human, character study- of both Cal, the American main character, and the town in Ireland that is his adopted home after retiring from the Chicago Police Force. This is a dissection of life in a small town where everyone knows everyone. Cal quickly becomes involved with a local mystery that no one really cares to solve. From there the book begins to darken and Cal faces judgement from his neighbors, his conscience and new friends. Again, this proves that French is just becoming a stronger writer with every book. Highly recommend this stand-alone mystery."
48,https://www.goodreads.com/user/show/51395417-brian,Rating 4 out of 5,"“…it’s a mad world we live in, hah? You’d never know where it’d take you.”I know a few people who love the books of Tana French, so when a friend lent me a copy of THE SEARCHER, I moved it up on my “to read” pile.This novel is a slow burn. It builds and creeps up on the reader. For the first 50 pages I was not into it, and then I was. It is not heart pounding action, or intellectual guessing games, it is just solid character writing in a very atmospheric setting.The plot, Cal Hooper (retired from the Chicago PD) moves to a small village in western Ireland. A child knocks on his door and asks him to investigate the disappearance of an older sibling. And from there French tells a story that is not about a disappearance, and certainly not a conventional mystery. It transcends that genre. French is deft at creating a living atmosphere and sense of place that is as much a character as anything else in the text. Lines like these I enjoyed:“The dark is busy around here.”“He enjoys the rain. It has no aggression to it.”“Here, the first light spreads across the fields like something holy is happening …”I would categorize THE SEARCHER as a literary mystery, although really the mystery is just the plot device that allows for character development. That does not mean it is boring. There is depth, yes, but also some nice twists. There was one surprise I did not see coming, and one that I did see a mile down the road. But the twist I knew was coming was handled in a manner I was not expecting and was thus still pleasing.The truth of human experience and interaction is demonstrated in THE SEARCHER, and that alone makes it good.I end with some more lines that I think demonstrate that point.* “…hammering on and on at something that’s never going to break gets a man nothing but tired and sore.”* “He sometimes gets the feeling that Donna has methodically erased all their good times from her memory, so that she can move on into her shiny new life without ripping herself up. If he doesn’t keep them in his, they’ll be gone like they never happened.” (This FLOORED me!)* “His four best buddies were among the reasons he left Chicago; the depth and detail with which they knew him had come to feel unsafe…”* “Everyone was always talking about talking, and the most moral person was the one who yelled at the most other people for doing the talking all wrong.” (This is from a moment in the text that in its entirety destroys “woke” culture, although I am not sure that was the intention)* “Everything he’s been since that moment has been worth nothing, and he doesn’t even know what the moment was.”* “Complicating this is the fact that he can’t remember the last time he was in a room with a woman he liked the idea of talking to, and he’s unsure whether this is a point in favor of sticking around or of getting the hell out of Dodge.”* “Seems like I’m always looking for something to hold me down. It just never works out that way.”* “…finds himself floored by both the vast importance and the vast impossibility of saying the right thing…”* “…but Cal learned a long time ago never to underestimate the spectacular natural wonder that is people’s stupidity.”"
49,https://www.goodreads.com/user/show/11183856-kelly-and-the-book-boar,Rating 5 out of 5,"
This isn’t going to have a happy ending.
There’s nothing quite like that feeling when you finish a book and think “now what the eff am I going to read after THAT?!?!?!?!” Man, bookhangovers – they are a rarity for me, but last night when I finished up The Searcher that’s exactly how I felt. I had only read (and enjoyed) Tana French once before, but my real life bookpal recommended this one . . . . with trepidation . . . . so I immediately downloaded it from the library. (I ride or die with my book besties because they don’t ever tend to steer me wrong.) I understand her hesitation on telling me about this one, though, because not only is it 450+ pages and she’s well aware I’m a dumb dumb baby who likes my stories wrapped up in about 100 pages less than that, but also because this one is a slow roller. But I’m telling you it was a slow roller in the best possible way for me. The story absorbed me like fog rolling across the backyard on my favorite types of quiet Saturday mornings out on the deck with my cup of Joe. I loved Cal instantly and grew to love him even more as the “why” behind how he had wound up in Ireland after retiring from the police force back in the States was explained. And I love a kid in a book about once a year, so kudos to you little Trey – you done good at making me fall in love with you as well. The mystery here doesn’t even get mentioned until nearly the 100 page mark, so I’m not kidding when I say you need to be patient and just let yourself be sucked in by the atmosphere for a bit. Not to mention, it’s not the most mysterious of mysteries. You KNOW things ain’t gonna end up great, you just have to keep reading for the details.I vaguely remember this being a bit of a miss when it was released, but again I’m not a Tana French reader historically so I was not trying to compare apples to apples. If I were to compare this to anyone, it would be David Joy – and that’s about the finest compliment I can give an author so it’s getting all the Stars.Oh, and if you’re wondering what I decided to pick up next I pretty much spun the wheel on my NetGalley backlog and ended up with Best Men. It’s completely different from this, but Max is already charming me."
50,https://www.goodreads.com/user/show/2967061-anne,Rating 4 out of 5,"Cal Hooper, a retired cop from Chicago, seeks escape in a pretty, remote and peaceful village in Ireland. He buys an abandoned cottage/fixer upper he plans to work on while otherwise relaxing. But shortly after his arrival Trey Reddy, a school-age kid, shows up wanting his help. Trey’s brother Brendan went missing several months ago. Trey has heard that Cal was a cop and wants his help finding out what may have happened to Brendan. From there we go on a meandering journey to get to know and to uncover the secrets of Cal’s new town and its people.Don’t go into this novel expecting anything like a Dublin Murder Squad story or a thriller of any kind. Yes, there is a mystery and some violence but it is the slowest, most unhurried mystery you will ever read. It moves at the same slow pace as the small rural Irish town in which it is set. The plot of this mystery meanders through the novel but, in French's signature style, the story is more about the psychologically nuanced characters and their relationships. Tana French takes her time beautifully describing the community, its townspeople and their gatherings at the town pub and the natural beauty of the area including the heather-filled mountains and the local farms. Some people will find the pace of this book too slow, just as I did at times. But I kept reading because I became very invested in the lives of the two main characters and enjoyed the beauty and depth of French’s writing which has never been better. I think this story will stay with me for a long time."
51,https://www.goodreads.com/user/show/5159766-l-a-starks,Rating 5 out of 5,"The Searcher is excellent as are all of Tana French's books.While set in the Irish countryside, it may be even more accessible and of interest to US readers because the protagonist is a retired Chicago police officer.The Searcher is poetic, filled with emotion and action, and offers a great way to escape the world for several hours.Although I got weary of sentences ending in ""but,""--a minor concern--Ms. French's dialogue & dialect is spot-on."
52,https://www.goodreads.com/user/show/17420799-olive-fellows-abookolive,Rating 3 out of 5,"Tana French's second standalone novel, The Searcher, stars an American former cop who has retired to a small town in Ireland. He wants to get away from the drama of his previous career, but that's not quite in the cards as a young kid of the town approaches him, concerned about a sibling that went missing some time ago.I haven't enjoyed any of Tana French's books as much as the first three in her Dublin Murder Squad series. This book - like the last standalone, The Witch Elm - was decent, but nothing that I'd want to reread.Check out my full review on Booktube."
53,https://www.goodreads.com/user/show/86858132-mike,Rating 4 out of 5,"A former Chicago policeman moves to Ireland for a fresh start and to renovate an old cottage. Happy to be left to himself, his life is upturned when a teenage boy requests his help to find his brother. A whimsical stand-alone novel, with great characters and the surprising happenings of a quiet Irish village. Not the usual hard crime type from Tana French the queen of suspense, but a most enjoyable read with a four and a half star rating."
54,https://www.goodreads.com/user/show/16471876-liz-barnsley,Rating 2 out of 5,"Up until now I've given every Tana French novel 5* easily, unfortunately for the first time and if I'm to maintain honesty, I can only give this one 2*. Mainly for the writing which is still of a high quality - where it fell down for me was in the story and length of time it took to get anywhere. Then when it did get somewhere pretty much at the end, it wasnt that interesting. Main character Cal, ex Chicago cop moved to rural Ireland to escape the rat race but somehow discovering people are people good and bad pretty much everywhere, I thought was a bit of a cliche for a writer of French's calibre. Her descriptive sense of rural life was beautifully crafted but there was too much of it. The Wych Elm, as an example, is a tome but I devoured every page, none of it was wasted time but with The Searcher I found myself skim reading great chunks just to get to an actual plot development. That underlying sense of tension, that feeling you are heading towards something you cant escape, that is one of the biggest strengths of previous books, it is entirely missing here in my opinion. Sorry to say the resolution felt phoned in and overall I only really finished it out of loyalty to the author and in the hope of a kick ass finale that would make it all worthwhile. I'll probably be a minority opinion and that I don't mind at all. I'll just settle in and wait for the next book. You cant always love everything your favourite authors put out. This is obviously that one."
55,https://www.goodreads.com/user/show/68708752-beverly,Rating 4 out of 5,"A stand alone mystery by Tana French, The Searcher is slow and takes its sweet time. You get to learn about the characters, as well as the gorgeous Irish countryside This is what I love about her books. You really feel like you know the people and they seem real to you. The Searcher revolves around a young teen's search for his missing brother with the help of a retired cop from Chicago. The unlikely pair's quest to find him creates a bond of common ground in their decency and honesty."
56,https://www.goodreads.com/user/show/1076079-karen,Rating 5 out of 5,"5 big ones! Tana French draws me pictures with words of settings that I can climb right into and see, hear, and smell the atmosphere for myself. From page 1, I am pausing to reread passages, in awe of her writing.This is a stand alone with nothing to do with her Dublin Murder Squad series at all. It takes place in the countryside of a small rural Irish town. A recently divorced ex-cop, Cal, from Chicago has retired there to a fixer-upper, and living alone in a strange place with suspicious sounds can make one's imagination go wild. Cal is warily making friends of the good ole boys who have been there forever and also a troubled kid who starts hanging around his place. These people are dripping in secrets. Cal didn't want to relive his cop days but is dragged into looking into a young man's disappearance. It has quite a few twists, which kept the pages turning. Not fast action or romantic, just good storytelling and terrific writing, with moral and ethical undertones."
57,https://www.goodreads.com/user/show/50603889-tammy,Rating 4 out of 5,"Taking place in the pastoral countryside of Ireland, French once again delivers a tense tale filled with memorable and complex characters who are all too human. A retired Chicago detective intending to enjoy repairing his crumbling Irish digs, becomes mixed up in the search for a local kid’s missing brother. Nothing is as placid as it appears in this small Irish village and backstories abound. The pacing of this novel is a bit slower than other of French’s novels but this in no way detracts from the suspense, atmosphere, or intelligent plotting at which the author excels. "
58,https://www.goodreads.com/user/show/796425-jeanette-ms-feisty,Rating 3 out of 5,"This is your periodic reminder that I do not consider three stars a low rating. It means I liked it and it coulda been better. Tana French writes beautifully about the Irish countryside and the people who inhabit it. This is a novel to be read more for the writing than for the plot, if ya know what I mean. And also for some of the colorful characters. I especially enjoyed the sisters Noreen and Lena--tough broads with good hearts. One of the nice things about living in a small town is that everyone knows you. If you're ever in a bind, people will try to help you. If you're going through a rough patch, the local store might give you credit till you can get back on your feet. If there's a death in your family, people will offer comfort and food. If your car breaks down, someone will offer you a ride. It's nice to be seen, to be known. One of the not nice things about living in a small town is that everyone knows you. This is especially not nice sometimes if you have lived all your life in that small town. Nobody will ever let you forget your history. You can't break out of the role that has been created for you. If you wet your pants in grade school, or got drunk as a teenager and jumped in the hot tub with all your clothes on, or married the wrong man, or couldn't hold down a job, no one will ever let you forget. And if someone new moves in to town, people will make sure to fill them in on your biography. For me, the above two paragraphs were what this novel was all about. Yes, there's a mystery, but the mystery itself is not as interesting as what it reveals about this charming and troubled Irish village. There's Trey, a teenage kid in need of a father figure, and retired Chicago cop Cal Hooper takes on a bit of that role, somewhat reluctantly. Eventually Cal agrees to search for Trey's missing brother Brendan. Cal discovers a lot of sinister shit in the process of trying to figure out what happened to Brendan. No town, however peaceful, is ever what it appears to be on the surface. "
59,https://www.goodreads.com/user/show/15237-amos,Rating 4 out of 5,"Have I told you how in love I am with this woman's words??!!  Most Tana French books have at least 10 sentences that are constructed so beautifully that I read said sentences over and over again. The Searcher didn't really have those. Instead it felt as if the whole book was one of those beautifully arranged sentences. The setting, the characters and the leisurely pace of the mystery equaled a ridiculously pleasurable reading experience.  I may have been smiling the entire read... 4 1/2 Stars. runoutandgetyouthisherestorybookyo"
60,https://www.goodreads.com/user/show/272909-blair,Rating 4 out of 5,"Honestly, I wasn't looking forward to reading this. My experiences of reading Tana French's work have varied from the very, very good (Broken Harbour, The Secret Place) to the underwhelming (The Witch/Wych Elm) to the inexplicably overrated (The Likeness). Having had mixed feelings about The Witch Elm, which like this book is a standalone, I wasn't necessarily expecting great things from The Searcher. On top of which, it just sounds really boring. Retired Chicago cop helping some kid find their missing brother in a small Irish village? Meh.So I was as surprised as anyone when I was quickly gripped by it. It's not the plot, not exactly: it really is just about a retired Chicago cop helping some kid find their missing brother in a small Irish village. (In someone else's hands it might be the perfect setup for a cosy crime series.) It's not the characters, either, as I never fully warmed to any of them. It's French's handling of the characters – and their surroundings – that brings magic to it. The tension simmering so soft and low you don't even notice it for a while; the exceptionally well developed bond between Cal and Trey; the beautiful menace of the wild countryside. It's not flashy, it's not twisty, and Cal is less memorable than many of French's protagonists. Yet I found myself struggling to put it down, reading hundreds of pages at a stretch. Rarely is a novel so quiet yet so compelling.I received an advance review copy of The Searcher from the publisher through NetGalley.TinyLetter | Linktree"
61,https://www.goodreads.com/user/show/3851259-sarah-hyatt,Rating 1 out of 5,"What just happened.I literally threw the book down with such force that I startled my kid.Boring, predictable and so disappointing. I didn't care about anybody at all, the whole thing felt phoned in, and it wasn't ever interesting. I was 80% done and was still waiting for it to be interesting.I also don't get all the reviews talking about how atmospheric it is. The setting! So vibrant! Yes, that's what made me fall in love with Tana French's books in general. I didn't get that from this book at all. I felt it was sorely missing. I skimmed the book before I read it and remember thinking, huh, that's a lot of dialogue. A lot of white space. But maybe I was remembering wrong -- and I still can't be bothered to go pull another book off my shelf to compare. Maybe I was remembering wrong, maybe I'm too used to reading on a Kindle, maybe it's just the appearance of it. No, it wasn't. It was really just a lot of conversation, not a lot of description, just skimming along at surface level without any deeper exposition or description or intrigue. I didn't like The Witch Elm much, but I liked the experience of reading The Witch Elm. It was a beautiful book, even if I hated everybody in it and the ending. The experience of it was what I expected. This one wasn't, at all."
62,https://www.goodreads.com/user/show/17042835-tim,Rating 2 out of 5,"Slow, long, too long, twist here and there, brutal. Extremely disappointing end. 3 of 10 stars"
63,https://www.goodreads.com/user/show/28198445-ivana---diary-of-difference,Rating 4 out of 5,"Wishlist | Blog | Facebook | Twitter | Instagram | Ko-fi I am so happy to be part of this blog tour for the very much anticipated book release of The Searcher by Tana French. Huge thank you to the Penguin and Viking team, for this amazing opportunity!
Synopsis:
Cal Hooper is a retired detective, and he moves to a remote village in rural Ireland. He’s fixing up this old house, and is getting used to this new mountain life, trying to forget about his previous profession of chasing criminals.That is, until one day, a kid comes to his door and asks for help. His brother is missing, and he knows something must’ve happened to him. But no one else in the village seems to care. Unable to leave this a mystery, Cal starts to ask questions.But the whole village seems like they don’t want new people messing up with whatever secrets they may have.
My Thoughts:
 The Searcher was a true slow burner. At times, it was even too slow for me, and I was struggling. However, I have never before read a book so well built, and despite the slow pace, I kept returning to it. This is my first book from Tana French, and I will definitely be reading more from her. I think the next one will be The Wych Elm, as I already have that one in my library. Tana French did such a good job at describing this rural village in Ireland, and its people. From the cold mountains, to the lovely cottage in need of renovating, to the pub and the people living in the village, it felt as if I was there. Even though I’ve never been to Ireland before.Cal Hooper was an intriguing character, and I loved his story. The reason he moved to the mountains, and the ongoing experiences helped me understand the issues he was facing, and I loved how he started to personally grow throughout the book, with Trey’s help. And as for Trey, I loved his personality too. The quiet, but also savage and arrogant character, that wasn’t afraid to be nosy. But also the innocent child that desperately wanted help and support, when they didn’t receive it before.The book was very dark and eerie throughout all times.And the people are savage and brutal, and you can feel this even when the conversations are about happy things. There was a certain eerie cloud surrounding this book, and I really loved that. I don’t think another book has made me feel this way before.As for the mystery, I feel that part was a bit weak. I loved the search itself, and the moments when Cal would try and dig deeper into what actually happened. But as any informal investigation, he couldn’t get too far. And the villagers didn’t try and help him too much. It was an interesting dynamic I really enjoyed. But the ending and the revelation weren’t too satisfying for me.The Searcher by Tana French is truly one of a kind. With its description, the rural scenery and brutality of the people, it’s one of those books that will give you slow chills down your spine."
64,https://www.goodreads.com/user/show/22727329-victoria,Rating 4 out of 5,"Slow burn of a novel with a slow burn realization.I usually shy from atmospheric storytelling, the plot buried in descriptive prose, but in French’s hands it serves the story well with an insidious darkness to this small town of seemingly affable Irish folk. Beware what’s beneath the veneer of joviality.French takes the outsider trope, adds a mysterious disappearance, a troubled kid, a provincial community and renders a finely honed, yet chilling story. While the ending didn’t quite sit well at first, the more I thought about it the more its malevolence seeped into my memory and the more I realized that, in that, it was brilliant.Creepy, nuanced and compelling, recommended for those that enjoy a slow build mystery with a literary intensity."
65,https://www.goodreads.com/user/show/5240149-brenda,Rating 4 out of 5,"Different than my usual read, but I enjoyed the change. As others have said, this is very atmospheric with strongly written characters, and the crime is mostly incidental."
66,https://www.goodreads.com/user/show/3409532-april-does-feral-sometimes,Rating 4 out of 5,"I wasn’t sure that I’d like ‘The Searcher’ by Tana French. The first hundred pages were pure domestic fiction. In the second hundred, I had finally decided that the main character, retired Chicago cop Calvin “Cal” John Hooper, forty-eight-years-old, was very likeable. By the next hundred pages, I was enjoying the mystery. By the last two hundred pages, I couldn’t stop reading! The book is exceptionally well written. I have absolutely no complaints about the author’s beautiful, almost poetic, lyricism, especially when describing the woody countryside and the small Irish village of Ardnakelty. I copied part of the book blurb below as it is accurate:Cal Hooper thought a fixer-upper in a bucolic Irish village would be the perfect escape. After twenty-five years in the Chicago police force and a bruising divorce, he just wants to build a new life in a pretty spot with a good pub where nothing much happens. But when a local kid whose brother has gone missing arm-twists him into investigating, Cal uncovers layers of darkness beneath his picturesque retreat, and starts to realize that even small towns shelter dangerous secrets.The local kid, Trey Reddy, is such a wonderful character, a fierce Watson to Hooper’s reluctant Holmes, by the middle of the novel I found myself hoping author French would return to these two characters as a series! But ffs please please please move the plot along if there is a next time!"
