,user_links,user_ratings,review_text
0,https://www.goodreads.com/user/show/4622890-emily-may,Rating 4 out of 5,"
Cal feels like he ought to stand on a street corner handing out warnings, little pieces of paper that just say: Anyone could do anything.
Goodreads tells me I was reading this latest Tana French book for twelve days, though I'd say a good ten of those days was getting through just the first hundred pages. The Searcher was another slow-starter from French, in my opinion. Neither this book nor The Witch Elm have grabbed me as fully as her Dublin Murder Squad books always did.That being said, once I did make it past those first hundred pages and finally settled into the rhythm of this story, I began to really enjoy it. Cal was far more interesting to me than Toby from her previous book. I also really liked the dynamic between the two main characters in The Searcher - Cal and Trey - and would liken it to a couple of other book relationships I've enjoyed, but it would be a bit of a spoiler to do so. The Twelve Lives of Samuel Hawley is one that comes to mind.French returns to what I feel she does best with this book: grit and grime. The Searcher takes place out in rural Ireland, an isolated place of farms and local folk who've known each other's nasty business for decades. Hands get dirty, animals get killed, skinned, and eaten, not necessarily in that order. Into this wilderness comes an American ex-cop looking to settle down for a peaceful life.Instead, Cal gets caught up in the disappearance of a local boy. Soon he is finding out that the idyllic place he imagined, the place of ""no handguns, no copperheads or cottonmouths or rattlesnakes, no bobcats or bears or coyotes, no black widows, not even a mosquito"" actually might be hiding all kinds of untold dangers. The comradeship and camaraderie between locals, which he so admired initially, begins to take on a threatening hue.French hits on a couple of current issues, too, weaving them in subtly. Police shootings feature, as does a critique of social media morality. In other words, the kind where people yell over one another to compete to be seen as the most moral, or ""woke"", but of course French doesn't use that word. I think, in the end, French really wanted to experiment by placing a stranger in the Irish setting she's by now so familiar with. She takes this Chicago cop who's used to having guns, pals on the force, and a back-up team at his disposal, and she strips all his resources and defenses away. Puts him in a strange land and lets him feel it out for himself. It's got the crime-solving excitement of the DMS books, but with an additional obstacle to overcome.I'm still waiting for another Dublin Murder Squad book, but this wasn't half-bad."
1,https://www.goodreads.com/user/show/16912659-dorie---cats-books,Rating 3 out of 5,"***NOW AVAILABLE***It pains me to give a Tana French novel 3 stars, this was one of my most anticipated reads of 2020. I loved the Dublin murder mysteries and even the slow burn of The Witch Elm, but this one just didn’t do it for me. A 3 from me doesn't mean it's a bad book, just not one that I loved!In looking back I realize that she does write male voices often but I think the choice of a retired ex-cop from Chicago perhaps just didn’t ring true to me. I live in Wisconsin but visit Chicago frequently and it’s certainly a far cry from the Irish countryside. I did like this explanation of why he retired, in part “I got weary, Cal said, bone weary.” He did. Every morning got to be like waking up with the flu, knowing he had to trek up a mountain”. So Cal decided to move to a remote town in western Ireland, why he picked this location exactly is never explained. Perhaps he thought it was just far enough that the badness wouldn’t be found here. Of course he’s proven terribly wrong because there are bad guys and good guys everywhere. He purchases a dilapidated house and starts to work on it from the inside out. It isn’t long before his solitary life is invaded and he is pulled back into the investigative life he left behind.We do meet some interesting characters here, one of which is Mart, Cal‘s neighbor. Surprisingly he seems to accept Cal, introduces him to lots of the neighbors at the local pub. He’s a more complicated character than we are at first lead to believe, but I pretty much had that figured out. Always watch out for the nice guys!My favorite character was 13-year-old Trey, a child wise beyond 13 years considering what Trey has had to live with. Trey's father ran off and the mother is left with a handful of children to raise with little to no funds. Trey has no support system whatsoever. The child doesn’t attend school because Trey's mother is too exhausted to care. When brother Brendan disappears, Trey is beyond upset, is certain he would never leave, that something terrible has happened to him. After getting to know Cal in a roundabout way Trey finally asks him for his help. Although he claims to have retired he can’t seem to leave the matter alone, which gets him in a whole lot of trouble. With his father-like feelings for Trey I had to like Cal more than a little, even though I wanted to shout things at him periodically!!Not much happened in this book until about the 80% point on my Kindle, it’s a long time to wait and I grew weary. It’s at this point that what is going on around here is uncovered, unfortunately it was quite predictable, given all the red herrings uncovered.I was really hoping for a wow ending that would pull this up to at least a four star, unfortunately that didn’t happen. I strive for honesty in all of my reviews and it gives me no joy to report that this Tana French novel left me very disappointed. I would love to see her go back to female characters, like Antoinnette the awesome inspector from the Dublin murders series. I will still follow this author because one disappointing novel doesn’t take away from the great novels she has previously written. It also hits at a bad time in our nation right now when reading a slow burn, depressing novel is hard to reconcile.Go into this one blind or read a variety of reviews, there are lots of reviewers who enjoyed this one more than I did.I received an ARC of this novel from the publisher through Edelweiss."
2,https://www.goodreads.com/user/show/124132123-lisa-of-troy,Rating 1 out of 5,"The slowest mystery that I have ever read.Cal Hooper is a retired police officer who finds himself in Ireland, fixing up a rather old house on a small spot of land. One day, he is minding his own business, living the simple life that he has always wanted, when a young boy stops over at his house. The boy wants Cal’s help with finding out what happened to his brother who has gone missing. When the police don’t care about your problems, who can you turn to? Apparently, Cal Hooper.The Searcher is set in modern-day Ireland, a setting that I love. Aside from the setting, I also enjoyed that the women were not depicted as boy crazed. However, this book is slow, painfully slow. I started listening at 1.5X speed and ended up at 2X speed. Every time, I tried to read The Searcher, I dreaded it.Most of the book is Cal fixing his house, descriptions of hunting (even very gruesome details), and a lot of people that don’t know anything. Rooks, the birds (not the chess pieces), were mentioned 40 times! There is so much filler in this book that the editor should cut at least 70% of the book. There just is not enough action.This is a book where the character loves to talk about every single possibility, every possible path. Usually, I enjoy hearing the character’s thoughts, but in this case, it is overly done. When there finally is a reveal, the author stretches it out so much. In my opinion, the author overly explains events. Most of Cal’s background information arrives in the last half of the book. This is just too late. By the time that his background is finally, finally revealed, I just did not care anymore.In conclusion, The Searcher is a solid pass from me. There are too many books to read for a pace this slow.2024 Reading Schedule	Jan	MiddlemarchFeb	The Grapes of WrathMar	Oliver TwistApr	Madame BovaryMay	A Clockwork OrangeJun	PossessionJul	The Folk of the Faraway Tree CollectionAug	Crime and PunishmentSep	Heart of DarknessOct	Moby-DickNov	Far From the Madding CrowdDec	A Tale of Two CitiesConnect With Me!Blog Twitter BookTube Facebook Insta"
3,https://www.goodreads.com/user/show/53701594-nilufer-ozmekik,Rating 4 out of 5,"Another outstanding, moving example of Tana French’s epic writing! With her remarkable skills she can create intense, realistic, dark, raw, rash portray of rural western Irish and let you have a memorable, breathtaking, journey!This small town is the real protagonist of the story. As you start your reading, you learn to listen its own people’s struggles, sadness, demanding, hard life choices and accept the dynamics between the relationships. The town was like living, breathing, functioning organism with its own rules and patterns. Everything starts with retired detective Cal Hooper’s moving to the small remote Irish who buys an old wreckage, dilapidated house by giving higher bid to beat a local man. Of course town’s people are reluctant to accept an outsider into their lives or welcome him with open arms. The loner ex detective accepts his faith and focus on rebuilding his new nest, feeling someone’s scrutinizing eyes over him: Trey, a local boy watches him behind prying eyes, coming from dysfunctional family. He needs urgent help of Cal to find his missing brother.Cal cannot find the peace in his new place and he reluctantly accepts to help the boy even though it means attracting more hostile threats of town’s people because he was about to open so many cans of worms and disturb the town’s people’s peaceful lives. The depictions and detailed composition of rural Ireland was captivating. The pacing and creative storytelling were satisfying as always. The characters were not easy to empathize with but throughout your reading you get used to their rough parts of their characteristics and accept them as they are. I’m giving four dark, mysterious, pastoral, impressive, meticulous depiction stars! It is always pleasure to read French’s books. Special thanks to NetGalley and Penguin Group/ Viking for sharing this remarkable ARC with me in exchange my honest opinions.bloginstagramfacebooktwitter"
4,https://www.goodreads.com/user/show/3672777-nataliya,Rating 4 out of 5,"
“I got weary,” Cal says. “Bone-weary.” He did. Every morning got to be like waking up with the flu, knowing he had to trek miles up a mountain.”
Unhurried. Measured and unhurried are the first words that came to my mind when I was thinking how to describe Tana French’s newest book, The Searcher. Not slow - although I’m sure you’ll hear that - but precisely and deliberately unhurried.I am not a huge fan of describing books in terms of other books or other authors, but I can’t think of a better comparison here. It reminded me of Stephen King at his best (or his best according to my opinion, for all it may be worth) - not the spooky stuff but those interludes when his regular Joe characters are settling in the rhythms of a small town, feeling out the place, before the shit hits the metaphorical fan, before things go wrong - but with enough foreshadowing that the fragile idyll is going to be over soon and bad things will come. 
This is the mood and the tone here. It’s set in rural Ireland, a tiny insular rural community where more and more places are being abandoned by the youth in search of opportunities. Cal Hooper, a retired Chicago cop coming to terms with life change after his divorce, moves to this tiny place in search of calm and quiet, hoping for peace. But the peace is too fragile to last.
“One of the things that had caught his attention, when he first started looking into Ireland, was the lack of dangers: no handguns, no snakes, no bears or coyotes, no black widows, not even a mosquito. Cal feels like he’s spent most of his life dealing with feral creatures, one way or another, and he liked the thought of passing his retirement without having to take any of them into account. It seemed to him that Irish people were likely to be at ease with the world in ways they didn’t even notice. Now that rifle feels like something it would be good to have in the house, the sooner the better.”
Cal plans to restore the dilapidated old farmhouse he bought. He works at it, and takes walks, goes fishing, and enjoys the countryside, and is feeling out his new neighbors who started forming tentative friendships with him and are starting to accept him into the fold. He’s content - but he feels like this cannot last, like something is waiting to happen, and so do the readers. And yes, his new peaceful life gets a bit upturned when a local almost feral kid from a good-for-nothing family tried to enlist Cal to help find that kid’s missing older brother. And suddenly the close-knit community is starting to feel suffocating and shoulder-to-shoulder against the stranger who is about to dig up some metaphorical skeletons from their resting places. Very quickly the reassuring things can become menacing.
“Their decades of familiarity, which seemed like a comfort at the beginning of last night, weave themselves into an impenetrable thicket; its layers obscure every action and every motivation till they’re near indecipherable to an outsider.”
 
This is very different from French’s much lauded Dublin Murder Squad books. In pace - much slower. In tone - more wistful and contemplative and subdued. In the mechanics of narration - unlike all her prior books, this one abandons the intimacy of the first person narration. In the setup - as a former cop, Cal is unable to conduct the usual police-style interviews, leaving him with the need to figure out things in a more subtle approach. And in the spirit of the story - this one is not really so much about solving a crime as it is about Cal himself and things that he will and will not do, about his own moral code and how far it can be pushed. Morals versus manners, as Cal would explain.
 “Cal has had enough of being discreet. He figures it’s time to kick a few bushes and see what scuttles out.”
It’s not a crime thriller, and if you go in expecting one you may end up sorely disappointed. It’s more of a literary novel by a writer who is known for psychological f*ckeries masquerading as crime novels. What happened to poor unfortunate Brendan Reddy is really not the point. What happens to the heart and soul of Cal Hooper and the community itself is the point. How the desired outcome is approached is what’s interesting - is the point getting what you should want or what you need? What do you view as justice - the punishment or the resolution? What is the goal of searching for answers? 
Ultimately it’s 400+ pages of unhurried and measured character study - and the locale itself is one of the most important characters here. It’s atmospheric, it’s well-written and well-plotted, and shows that French can do very well outside the setting and style of her Dublin Murder Squad novels. It’s captivating and nuanced, and that pub-moonshine-subtle warning scene is done so well that I read it three times in a row for sheer enjoyment of seeing a writer excel at her craft. And yes, there are a few issues tacked on too strong, too artificially likely to make this book feel more “current”, but they are easy to overlook.Don’t go into this novel expecting more of Dublin Murder Squad feel or your usual crime novel. It’s neither of those, and in this it is interesting and special. Prepare for the unhurried walks down Irish countryside while pondering morals, not manners - and before you know, French has done her magic again, differently this time but very much worth it.4+ stars."
5,https://www.goodreads.com/user/show/30978160-meredith-trying-to-catch-up,Rating 4 out of 5,"“The dark is busy around here.”The Searcher  is a character-driven mystery about a former cop whose quest to find peace in a small Irish town leads him into danger. Cal Hooper, a 48-year-old former cop from Chicago, moves to a small village in Ireland to start over. Struggling to come to terms with the demise of the marriage and end of his career, Cal throws himself into repairing his ramshackle cottage. His days are fairly prosaic until 13-year-old Trey shows up with a mystery for Cal to solve, the disappearance of Trey’s 19-year-old Brendan. To humor Trey, Cal begins to investigate Brendan’s disappearance. He uncovers a dark web in his new tiny town, which threatens to destroy all Cal has worked to build.This is a slow burn, atmospheric read.  Cal’s cottage, the woods, and the village all play significant roles in the story. Cal’s relationship with nature and his new surroundings is tied to the events of the book, which I found intriguing. However, there is a hunting scene involving a rabbit that I could have lived without.  This was my second Hurricane Zeta book, and the creepy undertones of the townspeople and the woods were enhanced by the storm and power outage. The narrative is told entirely from Cal’s point of view. I wasn’t sure about French writing an American character, but she pulled it off (there were a few times that had me shaking my head, as Cal’s voice felt forced,) but in the end, his character worked for me. The Searcher is slow, subtle, and different from other Tana French novels (in a good way). The mystery is more of a back burner, but it becomes a driving force towards the end. Really, this is about Cal coming to terms with loss and accepting his new life. I liked Cal, but Trey’s character was my favorite. Their friendship, while unexpected, works to hold this book together. There are a few surprises thrown in that I didn’t see coming, as I was so wrapped up in Cal’s head. The tension slowly builds, fueled by the atmosphere, leading to a tautly written, if somewhat anticlimactic conclusion.Overall, this was a surprisingly good read (after The Witch Elm  my expectations were low). I can imagine some readers will get frustrated with the pacing, especially in the beginning, but don’t give up--it’s worth the read! "
