,user_links,user_ratings,review_text
122,https://www.goodreads.com/user/show/1394928-laura,Rating 4 out of 5,"4.75 stars. I enjoyed this book so much. If you're not expecting a breakneck thriller, and you enjoy her other work, you should enjoy this one too. The first half was slow for many readers, but I really enjoyed it, and would've been happy if that pace and mood would've continued throughout. There was an older person mentoring a younger person they'd not previously met, there was a character who basically bagged their life to start over again in a different country, there was furniture / home restoration, there was the beautiful Irish countryside, a bit of nature writing bordering on magical realism in spots, so, so many things that make me extra happy when I run into them inside the pages of a book. Add to that French's excellent characterization and her magnificent writing, and a wonderful audiobook performance, great characters I enjoyed spending time with, etc., I could go on and on. I'd have given it five stars if it'd been less like a thriller and kept up the mood of the beginning. But when you read Tana French, you have to expect that! This wasn't over the top violent by any stretch, but it loses a quarter star bc of the difference between the first and second halves in that respect. I do hope she will make this book the first of a series. It would be absolutely fantastic and our main character is a retired Chicago cop who solves a mystery of sorts here. Would love to see him do more of this. This town and these characters have a lot more to say. Please, Ms. French 🙏🏻😀💙Edited to add: Yay, she’s continuing this series! The Hunter"
123,https://www.goodreads.com/user/show/11772404-rheama-heather,Rating 5 out of 5,"I have to admit I bought a signed hardcover copy, and I’ve marveled at Tana French’s signature more than once.I’ve already raved about my favorite author here many times. I’m accustomed to the beauty of her settings, dialogue so genuine my brain speaks it aloud, and the emotional undercurrents running deep through every scene. Her latest is every bit as worthy.Like all her work, I finished The Searcher and considered what exactly I just read.It’s the story of a man letting go of his marriage, his career, and even his country. It’s about Ireland, of course. Always. It’s an illustration of small town life in all its peace, struggle, and lack of privacy. It’s about unlikely friendships, some of which flourish and some that die a most brutal death. It’s a tale of losing your moral compass and resetting it, for better or worse. It’s about being the outsider. It’s the mystery of what happened to a promising young man who suddenly disappeared from his community.It’s not about furniture restoration, no matter how annoyed some readers are with that desk. The desk is busy work, distraction, a shared purpose, a focal point while more important things happen.I don’t believe it’s about defunding the police, but the great thing about literature is we all see different things in its pages.As usual, it wasn’t French’s mystery that hooked me. It was everything else along the way.Five stars again."
124,https://www.goodreads.com/user/show/36873041-amanda-never-mandy,Rating 3 out of 5,"
A retired detective thinks he can escape the big city job by moving but is quickly pulled into a mystery bigger than the town that harbors it.
I wanted to love this book because the last one was a dud. This one was an improvement but is still not the grand slam I expect from such an outstanding author. It does suck for her that the bar is set so high, but that is life. If you show your shiny best a few times people will expect it permanently.I will say that her descriptions were on point. I felt lost in the landscape and could easily picture the layout of the backyard and all the night sounds a fall evening would present. The characters were also sitting right next to me throughout the whole story and I could have happily read more about each one of them. Where things fell apart was the predictability of the mystery and my irritation for the lead not seeing what was right in front of his face.Three stars for excellent visuals."
125,https://www.goodreads.com/user/show/3679784-drew,Rating 5 out of 5,"5+ out of 5.This is Tana French's strongest book yet. This, her second standalone, does what folks wanted to believe THE WYTCH ELM did -- I liked that book, but did not think it anywhere near her best -- in that it proves she can write anything and make it compelling. Much of this book is housework, small conversations, missed cues and solitudinal thought.Don't worry, there's also a missing kid and some strangely slaughtered sheep. And drugs. And small towns fading into obscurity.I fucking loved every word of this and would read it all again in a heartbeat. While it doesn't capture the top spot in my personal French rankings (THE LIKENESS still takes the cake for me; that book...), it is absolutely phenomenal and if you aren't reading Tana French, now is a good time to start. This one, this one will hook you good. "
126,no user info,Rating 1 out of 5,"This is a very short story that got padded and padded into a novel. As an example of the padding- the main character gets his ass kicked by three men. How does he react while lying there bleeding? He starts remembering other times dating back to childhood that he got his ass kicked. His survival instinct doesn’t kick in because that might hurry the plot along. Instead he lays there reflecting. A good 4/5th of this book consists of reflections and ponderings. The story could fit on one page. And the main character— a supposedly intelligent cop — buys a house sight unseen in a town he never met in a country he never visited, and lands himself in the middle of a drug conspiracy. Sure Tana. Make them bucks, even if it requires you to hustle out pointless story after pointless story, chock full of blather and padding. One star is too much for this drivel."
127,https://www.goodreads.com/user/show/25852459-deanna,No Rating,"It pains me DNF about 1/3 of the way in, but it pains me more to continue. Nothing about this works for me--characters I can't find it in me to care about, terribly weak plot at this point, inexplicable American - Irish mashup, motivations that seem contrived or missing, writing that's fine but not as compelling as it would have to be to seduce me to keep going. Maybe it all comes together to pay off for the difficult start and becomes the book worthy of the glowing reviews. I’ve decided not to know and leave space for my anticipation to grow for her next book. "
128,https://www.goodreads.com/user/show/23024303-daniel-shindler,Rating 5 out of 5,"This book has a lot of depth Tana French’s stand alone novel is an exploration of the human condition wrapped in a mystery story. The plot is fairly straightforward, reprising classical narratives of a stranger coming to a small town and delving into a hidden secret. The stranger is Cal Hooper, a retired police officer who is divorced and burned out from his years on the job. He is an American who decides to take refuge in a small village in rural Ireland, having purchased a decrepit farm that he wants to restore. As he is acclimating to his new life, he meets a young taciturn teenager who wants him to find a missing brother. Reluctantly, Cal is drawn into unofficially probing for clues about the brother’s fate. He encounters silence and resistance from the village residents. Eventually, Cal plods his way through to unravel the solution. The allure of this book, for me, does not lie in the mystery itself. The mystery is credibly plotted and moves at a brisk enough pace. Rather the characterization and interplay between Cal and the teenager Trey give this novel a great deal of depth and emotional engagement. French’s prose and dialogue provide the book with an emotionally resonating tone. The reader is left with a sense of poignancy that will linger."
129,https://www.goodreads.com/user/show/103995549-toni,Rating 3 out of 5,"2.5 starsBoring as boring can get.Plot summary: An ex-cop Cal Hooper now living peacefully in Ireland starts to investigate the disappearance of a teenager who went missing after his brother/sister asked him to help.When I first started reading this, I thought it's gonna be something bigger, with some plot twists, some interesting characters, and a mystery revolving around the disappearance of a young man. But later the book just started to fade away for me, it was so boring because nothing really happens in this book. And that's a fact. This was my first book by Tana French and I'm so disappointed. Even until the ending, I've expected some big twist, but none of that has happened."
130,no user info,Rating 1 out of 5,This novel moves at a dismally slow pace. The reader has to wad through more than 100 pages before any real hint of a plot appears. The story line is weak and drawn out with repeative descriptions of topography and bland dialog. I only finished it because I paid handsomely for it.
131,https://www.goodreads.com/user/show/15939692-trish-at-between-my-lines,Rating 4 out of 5,"4.5 starsCal has retired early from the Chicago police force, and is living a quiet life restoring a cottage in the West of Ireland. He wasn't long finding trouble though, or rather trouble searched him out and made him seek answers.Well this book has reminded me of all the things I love about Tana French- Her characters sparkle with life. We get so many subtle clues about what makes them tick and it just makes me feel like I know them intimately.- The plot is buried deep within the pages. So deep that sometimes you forget it's brewing away nicely in the background while you are just caught up in the characters and the lush writing.- You need to read between the lines. Tana French will never spell everything out for you, and you have to form your own opinions of why things happened and what really motivated certain people to act certain ways.- Initially the ending disappointed me. But when I reflected it felt perfect as it was a full circle right back to where we started.- The theme is heavy, red raw and left me feeling very unsettled. Because I pictured everything vividly in my head while I read. Balanced to perfection with colourful banter between Cal and the locals.Complex, full of mockery and life in all shades; I just loved it."
132,https://www.goodreads.com/user/show/1629797-maria-v-snyder,Rating 5 out of 5,"I love Tana French's books - the writing is superb and the descriptions glorious! This is a different story than her Dublin Murder squad books - the plot advances at a slower pace, but I really liked the characters and didn't mind waiting for the final reveal."
133,https://www.goodreads.com/user/show/2843912-switterbug-betsey,Rating 3 out of 5,"There isn’t a Tana French novel that I’ll pass up; in fact, I’ll buy it on the first day it is released. I suppose nothing she has written since IN THE WOODS and THE LIKENESS will compare to those two, and there are a few that were even forgettable. I had high expectations of THE SEARCHER, as friends and critics alike have given it accolades, but my reading experience wasn’t as passionate or thoroughly absorbing. The dilatory pace (and too much exposition) didn’t lead to a brilliant reward, because the character that the protagonist was investigating/searching for never came alive for me. Moreover, I get the sense that French may have been setting this book up as a first of a series. The lead man, Cal Hooper, is a retired Chicago cop, divorced, who took a big risk and moved to a berg in Western Ireland. Any of his minor flaws are forgivable. He’s that consummately likable, full-of-integrity protagonist that typical series books depend on. A bit of the aw-shucks, but unafraid and focused on his target. I feel like this novel is a little bit of a sell-out—careful to be inoffensive, and relatable to hearts everywhere. And trite. Aw shucks."
134,https://www.goodreads.com/user/show/11510694-donna-davis,Rating 5 out of 5,"I was bewildered at first why my fellow reviewers are so stingy with their ratings for this novel, which I fucking LOVE, but then I realized, it's because of expectations. Those that are looking for a seat-of-your-pants thriller or heavy, heart-thudding suspense won't find a lot of it here. However, if you love strong contemporary fiction and/or literary fiction, here it is. I was turned down for the galley, and so I checked out the audio version from Seattle Bibliocommons as soon as it became available. (Serious wait list; no surprise there.) I finished it this evening, and although I have other books on board, this is the one I keep thinking about. I'm particularly taken with the character named Trey, who is at least as important here as the protagonist. That said, once again, this is not from the Dublin Street series, which I also love; it's a stand alone novel, and an excellent one at that. I don't want to give spoilers, but I will say this: thank you, Ms. French, for not hurting the beagles. The narrator does a splendid job. Highly recommended."
135,https://www.goodreads.com/user/show/7481492-margitte,Rating 4 out of 5,"Cal Hooper starts out climbing metaphorical mountains in Chicago and ends up climbing a physical one in West Ireland. In between he finds himself coming to terms with the noise and pollution of his mind and soul.His new home in Ireland is idyllic and so different from his life as a cop in Chicago. Where he hopes to find a different serenity, he discovers silence with a roar. A relaxing read. An almost philosophical, lackadaisical, surreal plot, but a new possibility for gen Z. The thirteen-year-old Trey was the main focus. The author captures the reader immediately with the soulful descriptions of the bogs, rains, animals, people. It is as though we moved in with Cal and went with him on his new discoveries. In fact, I decided I will stay even if Cal decides to go back to Chicago! There is so much to otherwise enjoy in this novel, although I would have preferred a more 'classic' fast-moving suspense thriller or even detective drama. Overall a good choice to read something different."
136,https://www.goodreads.com/user/show/3947172-vivian,Rating 4 out of 5,"Less self-destruction than the average French book and more moral calculus.This isn’t a happy book, I don’t think French can do one. Here at least, the despair isn’t as fresh, unresolved. We actually make it through to the final stage of grief which is silver lining. Still have a cop or ex-cop, a dead body, a twisty maze of suspects and that oppressive sense of being unable to escape. Here there’s window even we never take it and that makes this book less devastating to me than the Dublin series. It’s horrible but the acceptance makes all the difference. "
137,https://www.goodreads.com/user/show/6810645-sheila,Rating 4 out of 5,"4 stars--I really liked it. French's usual skill with pacing and characters is on display here, and the Ireland setting is (as ever) evocative. I greatly appreciated each character's complexity, but found the book overall quite bittersweet, and the ""happy"" ending very melancholy. I thought Mart's analysis of Irish young men was insightful... even if his solutions to the problem might be problematic!"
138,https://www.goodreads.com/user/show/5164670-noodle,Rating 2 out of 5,"I’ll sorry but wow that was rather boring for me. I went in expecting slow burn cause that’s what all the reviews k read said and it truly was that - maybe not even really a burn imo, more just a barely there coal fire you have at the end of the night when everyone else has peeled off and only the few stragglers remain with their own thoughts. 2.5 stars maybe. I could round up but I don’t really want to lols, GR give us the half star rating, please!!"
139,https://www.goodreads.com/user/show/2413885-shashi-martynova,Rating 5 out of 5,The book is plain marvellous. I have an urge to kiss the author ferociously. Ireland is so spectacularly herself here I'm lost for the epithets. And the dialogues!.. Великолепное исследование гения места как бога и демона.
140,https://www.goodreads.com/user/show/10446876-lenaribka,Rating 5 out of 5,Tana French in her best form. I enjoyed it a lot.P.S. I disagree with those readers who think/hope it is a start of a new series. I really hope this one will stay a standalone. Nothing to add to this great storyline. Leave it be.
141,https://www.goodreads.com/user/show/2431873-emily,Rating 3 out of 5,
142,https://www.goodreads.com/user/show/17593842-monique,Rating 2 out of 5,"Am I missing something here? Super slow, not a mystery... couldn’t hold my attention."
143,https://www.goodreads.com/user/show/44095345-carmel-hanes,Rating 4 out of 5,"This was an audio listen, and was engaging enough to keep my attention from wandering. Cal, an ex-cop gets pulled into trying to solve the mysterious disappearance of a local boy after moving to a rural community in Ireland. A mystery that provides a bevy of interesting locals for Cal to navigate as we get to know their idiosyncrasies and secrets. Although it's not a new concept, somehow the pairing of a tough but vulnerable kid with a rough but protective man always sucks me in. It's a meandering story, but maintains interest as it weaves to a conclusion that doesn't surprise as much as confirms. I enjoyed the characters, and the narrator seemed perfect for the Cal character. The story was a nice, easy distraction. "
144,https://www.goodreads.com/user/show/35942740-obsidian,Rating 5 out of 5,"Well this was hands down better than The Witch Elm. Though French doesn't follow the Dublin Murder Squad crew, she follows an ex-Chicago police officer, Cal Hooper. Cal leaves America for Ireland in order to get away from bad memories and the end of his marriage. I thought French did a great job with Cal's point of view and the development of secondary characters like Trey and Lena. I also loved the ending since it was typical French in my mind. What would you do in the situation that Cal finds himself in? Would you choose the same? You hold your breath through the last 1/3 of the book after everything is revealed just waiting for the shoe to drop. Could you keep living like that? I enjoyed this immensely and have my fingers crossed that French dropping hints about revisiting Rob from In the Woods in a future book comes true. I am still haunted by that book and Rob. I will not speak on The Likeness since that and ""The Witch Elm"" are my least favorite of French's books.""The Searcher"" follows ex-Chicago police officer, Cal Hooper. Cal is in his late 40s and has left America for an old house and some land in Ireland. We find out that Cal's marriage (which he was quite happy in) ended unexpectedly. He has an adult daughter that he finds hard to connect with. Yes, I had my eyebrows raised since the dude did just abandon the US (I get it though Cal) for another country. Cal is getting the lay of the land and is fixing up his home. His nearest neighbor, an older man named Mart comes by and gives him grief. Cal has a routine with the local shopkeeper and is starting to feel part of things. However, Cal starts to realize that someone is watching him and is concerned that the person wants to harm him. Cal eventually befriends the person watching him, Trey, a 12 year old local that comes to Cal because they want his help in finding their missing brother. Cal isn't a cop though and he really has no idea where to start, but he starts to dig, and finds that there's a darkness in his local community he had no idea of at all.I really found myself liking Cal a lot. He has made mistakes, but is trying to do what he thinks is best for Trey. When Cal starts to realize that the community he has made himself home in, is not all sunshine and friendly neighbors you start to realize that he has walked himself into something that can end up causing him and Trey harm. Cal also you can tell misses his wife and daughter, but doesn't know how to communicate with either of them without it turning into a disappointing talk each time. I think watching him with Trey it's in the back of Cal's mind that he can do something here. What I did love though with this story is the parallels between what Cal ended up doing when an incident occurs with his daughter. In the end, Cal chooses different, and I think in that way French is signaling that things will be different here. I liked the secondary characters like Mart, Lena, and Noreen in this one. There's a slowly dying farming community where Cal ends up and you can see the struggle for those who still live there to keep it going. But it's definitely going out on its last gasp if the young don't stay. This community reminded me a bit of my hometown (without the racism though) with the younger generation moving away and the homes/farms just falling into disrepair. We also get some glimpses of how the crash is still impacting Ireland and how many of the younger crowd are getting by. I loved the writing in this one. Not going to lie though, the book starts off slow. It takes a bit for it to get going (around the 15 percent mark for me) since it seems such a departure for French to take on an American as the main protagonist. But once you get into the rhythm of the book it's hard to put it down. The setting of this community at times seems pretty fantastic until Cal starts to uncover things that have gone on. Also, there's hints here and there about something darker in this part of the world, but Cal at times seems too blind to it. Or he wants to be blind to it.I loved the ending, but wonder if that's the end or not. Will we get another story in a few years time with an older Trey? "
145,https://www.goodreads.com/user/show/9569165-patricia-williams,Rating 5 out of 5,"Another book that I absolutely loved because of the feelings it gave me as I finished. I love Tana French anyway, have read all her Dublin MUrder Squad books and they're great. This book is totally different. It's not about the murder squad, it's about a retired policeman from America who comes to Ireland to retire and how busy and mixed up his life becomes after he tries to settle down. He is divorced and not on good terms with his ex wife and his daughter is grown and he does keep in contact with her but the lives of the people in the small town where he now lives all become a big part of his life, especially a teenage girl who he bonds with and becomes her friend, helps her a lot. I think this is first book in a new series and I will definitely read more."
