,user_links,user_ratings,review_text
52,https://www.goodreads.com/user/show/126157045-robert-khorsand,Rating 3 out of 5,"ضیافت و شب‌نشینیِ والامقام‌ها فئودور داستایفسکی، آنتوان چخوف، لئو تولستوی، جورج اورول، فردریش نیچه، کارل یونگ، ویلیام شکسپیر، هربرت جورج ویلز و لوئیس کارول در افکار عالیجناب هاروکی موراکامی!هرچه نوشتم و نوشتم، نتوانستم توصیفی پخته‌تر، کامل‌تر و راستین‌تر از توصیف فوق برای این غول سه‌جلدی بنویسیم.سیاهه‌ای تقدیم به سرور و سالار نویسندگان،آقای موراکامی پیش‌تر بارها نوشته و گفته‌ام، می‌گویم و خواهم گفت که عاشق شما و قلم جادویی‌تان هستم و هرچه که حال در این ریویو می‌نویسم و از تجربه‌ی خواندن این کتاب نقل خواهم کرد ذره‌ای از عشقم به قلمِ جادویی‌تان کم نمی‌کند.افتخار می‌کنم که امروز می‌توانم تایید کنم پس از خواندنِ رمان‌های: «کافکا در ساحل، جنگل نروژی، وقتی از دویدن صحبت می‌کنم از چه می‌گویم، به آواز باد گوش بسپار، پینبال ۱۹۷۳، تعقیب گوسفند وحشی، برقص برقص برقص، پس از تاریکی، اسپوتنیک دلبند من، سوکورو تازاکای بی‌رنگ و سال‌های سرگشتگی، کتاب‌خانه‌ی عجیب، جنوب مرز غرب خورشید، سرزمین عجایب بی‌رحم و ته دنیا، قتل شوالیه و وقایع‌نگاری پرنده‌ی کوکی» و صدالبته پس از خواندن مجموعه‌‌ داستان‌های «پس از زلزله، بیدکور و زن خفته، مردان بدون زنان و اول شخص مفرد» غول سه‌جلدی و مرحله‌ی آخر دنیای شما را تا به امروز نهم شهریورماه یک‌هزار و چهارصد خواندم و منتظر خواهم ماند تا رمان آخر خود را که در حال نگارش آن هستید به جهت تعیین و تکلیف وضعیف «مرد گوسفند نما» بخوانم، او زنده است و من منتظر بازگشت باشکوه او خواهم ماند... .گفتار اندر دنیای وان-کیو-عیدی فوراغلب خوانندگان و علاقه‌مندان موراکامی به درستی دنیای افکار او را به دو قسمت «رئال» و «رئالیسم جادویی» تقسیم می‌کنند اما موراکامی یکبار هفده سال قبل از ابررمان «کافکا در ساحل» اقدام به نوشتن و انتشار «سرزمین عجایب بی‌رحم و ته‌دنیا» کرد و در آن در عین اینکه سبک نوشتارش همان رئالیسم جادوییِ شخصی‌سازی شده‌ی خودش بود اما گاه به گاه در بخش‌هایی از کتاب پا به دنیای «سای‌فای» یا علمی تخیلی می‌گذاشت و در این رمان هم همان‌کار را تکرار کرد، پس پیش از هرچیزی عرض می‌کنم که این کتاب فقط و فقط یک رمان عاشقانه به سبک رئالیسم جادویی نیست و گاه وارد فضای علمی تخیلی می‌شویم.وقایع این کتاب در سال ۱۹۸۴ میلادی رخ می‌دهد و شخصیت‌های اصلی کتاب دختری به نام «آئومامه» و پسری به نام «تنگو» هستند که در دوران کودکی در یک مدرسه حضور داشتند و تجربه‌ی گرفتن دست همدیگر به آن‌شکلی که در کتاب می‌خوانیم آغاز ماجراهای عاشقانه‌ی آن‌ها سال‌ها سال بعد در ۱۹۸۴ خواهد بود.در این کتاب با دو دنیا مواجه خواهیم شد:نخست دنیای واقعی در سال ۱۹۸۴ که اگر سوزن به بدن خود فشار دهیم بی‌درنگ از آن خون بیرون خواهد آمد و دوم دنیای وان کیو عیدی فور که دنیایی‌ست که در آسمان آن ماه برای خود همدمی یافته و ما دو ماه در آسمان می‌بینیم و تماشای این دوماه اتفاقات زیاد و هیجان‌انگیزی از جمله حمله‌ی «آدم‌کوچولوها» به دنیای ما را رقم خواهد زد... .پدر یا بهتر است بگویم ناپدری تنگو مسئول جمع‌آوری حق اشتراک شبکه NHK است و همین کافی‌ست تا آوردن نام تنگو و شبکه و ماجرای پدرش شما را به یاد داستان کوتاه «شهر گربه‌ها» بیندازم :)بله خود خودشه و موراکامی در این غول سه‌جلدی داستان شهر گربه‌ها را به زیبایی هرچه تمام‌تر بسط می‌دهد و تمام علامت‌ سوال‌های ذهنتان را از بین خواهد برد.و از آن‌طرف مادر آئومامه عضو یک فرقه‌ی مذهبی از شاخه‌های مسیحیت است که داستان تبلیغ فرقه‌ی آن را در داستان کوتاه «همه‌ی بچه‌های خدا حق دارند برقصند» و فیلم اقتباسی که از آن ساخته شده بود بخشی از آن را خوانده و تماشا کرده‌ایم.تنگو از اینکه هر یکشبه با پدرش به جهت جمع‌آوری حق اشتراک و آئومامه به ج��ت اینکه هر یکشنبه با مادرش جهت بردن تراکت تبلیغات با پشت کردن به تفریح و بازی با هم‌کلاسی‌هایشان خسته شده‌ بودند از خانواده‌ی خود هر یک به شکلی که در کتاب می‌خوانیم جدا می‌شوند و به سراغ زندگی خود می‌روند.داستان در جلد اول و دوم کتاب به صورت زوج و فرد و به ترتیب ماجراهای آئومامه و تنگو را نقل می‌کند و در جلد سوم شخصیتی به نام یوشیکاوا به آن‌ها اضافه می‌شود و این یعنی در جلد سوم به ترتیب فصول سه گانه داستان‌های این یوشیکاوا، آئومامه و تنگو را می‌خوانیم تا اینکه به فصل نهایی یعنی آئومامه و تنگو برسیم.آئومامه مربی موفق بدنسازی و ایروبیک است و تنگ�� معلم ریاضی و همچنین یک ستون‌نویس و مقاله‌نویس که در آرزوی نوشتن یک رمان است و ... .من به تمام داستان‌های این غول‌ سه‌جلدی ورود نمی‌کنم و خواندن ماجراهای کتاب را به شما می‌سپارم.نقل‌قول نامه""جهان مثل شیربرنج وارفته است، نه چهارچوبی دارد و نه دست‌آویزی. صحنه‌ها از جلوی چشم‌هایمان می‌گذرند، بی‌آنکه نشانی بر مغز ما بگذارند.""""وقتی در یک جمع دروغ می‌گویی باید تا ته داستان بروی و این کار انتها ندارد. تحریف حقیقت به شکلی که همه‌ی جزئیات باهم بخوانند از نظر روانشناختی و عملی به هیچ‌وجه کار آسانی نیست.""""حواسِ جمع کلید موفقیت است.""""داشتن استعدادهای فراوان، شکمت را سیر نمی‌کند اما اگر غریزه‌ات قوی باشد، هیچ‌وقت گرسنه نخواهی ماند.""""یا من مسخره‌ام یا دنیا، نمی‌دانم کدام. وقتی دربِ بطری به بطری نمی‌خورد، مشکل از درب است یا بطری؟""""اگر تاریخ واقعی را از مردم بدزدی، انگار که قسمتی از وجودشان را دزدیده‌ای و این یک جنایت است.""""دنیا یعنی نبرد بی‌پایان خاطرات متضاد.""«هر دینی که پایانِ جهان را در مرکزِ اصول عقایدش قرار دهد، بدون شک کاذب است.»«اگر نتوانی چیزی را بدون توضیح بفهمی، با توضیح هم آن‌را نخواهی فهمید.»«رابطه‌ی زن و مرد، تابع عقل و منطق نیست.»«فقط دزد می‌تواند یک دزد را بگیرد. برای اینکار کافی‌ست تنها یک چیز را پنهان کنی، دزد مکانش را بو می‌کشد و پیدایش می‌کند.»«هر جا که امید هست، رنج هم هست.»«نویسنده اگر می‌خواهد پخته شود، باید مدام بنویسد.»«فکر کردن به زمان، به نظر تنها می‌تواند از سرعت حرکت آن بکاهد.»کارنامهپیش از نوشتن این بخش از «عباس آقای معروفی» وام می‌گیرم و می‌نویسم اگر می‌خواهید نویسنده‌ی کتاب را بشناسید باید پاورقی‌های کتاب را بخوانید! و همانطور که در توصیف خود در ابتدای ریویو نوشتم موراکامی از هر نویسنده‌ای که به ذهنش آمد در این کتاب استفاده کرد، البته اینکه موراکامی عاشق داستایفسکی، فرانتس کافکا، تولستوی، شکسپیر و ... است برکسی پوشیده نیست اما اینکه برای بسط دادن به ماجراها این همه نویسنده را وارد داستان کند، اعتراف می‌کنم باعث رنجش خاطرم گردید، به همین منظور یک ستاره بابت این موضوع از کتاب کسر می‌کنم و یک‌ستاره نیز به دلیل طولانی کردن و بسط دادن ماجراهای کتاب با وارد کردن بی‌دلیل شخصیتِ کم‌اهمیتی به نام «یوشیکاوا» در جلد سوم کتاب و نهایتا سه‌ستاره برای این ابررمان منظور می‌کنم.دانلود نامهفایلِ ای‌پابِ کتاب به زبان انگلیسی را در کانال تلگرام آپلود نموده‌ام، در صورت نیاز می‌توانید آن‌‌را از لینک زیر دانلود نمایید:https://t.me/reviewsbysoheil/336"
53,https://www.goodreads.com/user/show/30800-oriana,Rating 4 out of 5,"Because I am an idiot (and because it was way cheaper), I bought this massive weapon of a book in a single volume, rather than the super-portable trilogy edition. It's been staring at me reproachfully for weeks, so I finally took a big Cutco knife to it and DIY'd it into two volumes. I haven't had to do that since I read Infinite Jest, but it was totally worth it.***Checking in after finishing tonight, it seems that I spent five full weeks with this book, which is longer than I've spent with anyone other than Pynchon and DFW, I think? So that's crazy, but also somewhat lovely, as those guys and this guy are all among my most favorites ever. Also I read three graphic novels interspersed with 1Q84, the last of which was Rasl, another book that moves creepily between worlds.So let's just say I've had some strange dreams over the last week.In any case, 1Q84. As with The Instructions, this book doesn't actually feel long, despite being 1200 freaking pages. It has such an easy flow, such a compelling pace (though slightly plodding in its meticulousness), that it just slid right along. I actually sort of feel like it wasn't long enough, as there are a couple of questions that I don't think ever got properly answered. I think I said this about Against the Day, but a book like this is a little bit like reading an entire life; just sitting on someone's shoulder as they go about their every day, so naturally it feels like you just want to keep following them, day after day, forever. On to other things about this book. It's got all the Murakami building blocks that we have come to expect:[from HTMLGIANT]So that was comforting. In fact, comforting is really the main adjective I would use to describe this reading experience. Yes, I know, the book does contain murder, incest, rape, child neglect, religious fundamentalism, torture, and on and on. But yet, it's not gory, or explicit, or harsh. All these things are dealt with in the same slow, measured, matter-of-fact tone and pace as the more ""normal"" parts, and moreover, the harshness amounts to a very very small percentage of the book overall. I'm dancing around doing any plot explication, but here are some of the other things to be found in this book: ghostwriting, smoking hash, mystical ""little people,"" moon(s), cats and owls, a gun (along with a discussion of Chekhov, and whether a gun introduced into a story must eventually be fired), loneliness, despair, shadow selves, long train rides, cute nurses.So I definitely don't mean to say that it's boring—just slow. Methodical. Placid. Calm.Which I definitely don't mind! Although I suppose I have to admit that I don't think this is as good as Wind-Up Bird Chronicle, and perhaps a lot of that has to do with how much more electrifying the latter is. It might even also have to do with how much shorter Wind-Up Bird is, and that is by no means a short book. I mean, while I wouldn't say 1Q84 ever exactly dragged, I do think he could have sliced out at least 200 pages just through a bit of stern editorial oversight. I am known to be pretty fucking elitist and cranky, and for most authors, if I felt like a book could loose two hundred goddamn pages, I would probably never read that person again. But I don't know what it is about Murakami; to me reading him is like wrapping up in my favorite soft threadbare hoodie—it's just so damn comfortable, I forget to notice that there's a hole in the pocket, one of the seams is unraveling, and it's got a couple of pretty noticeable stains. I don't know if that metaphor works or what. But I did love this book, just like I've loved every other book he's written, and will probably love everything else he ever does. "
54,https://www.goodreads.com/user/show/70459127-tara,Rating 4 out of 5,"
“If you can’t understand it without an explanation, you can’t understand it with an explanation.”
Spending time in 1Q84, I felt uneasy and uncertain, disoriented, “increasingly like an ant trapped in a bowl of sand.” Even now, I’m not really sure whether I “liked” it or not, which actually says quite a bit about the originality of this remarkably uncanny reading experience. The book had this dark, surreal, haunting, sort of viscous atmosphere that I sank into and got lost in. It gradually but steadily colored my thoughts and perceptions, seeping into my daily life, until even the tree outside my bedroom window began to appear ominous and strange. And although I was happy to finish it and be able to put it aside, simultaneously, on another level, I never wanted it to end. It’s harder than you might think to leave the world of 1Q84 behind.This was my first encounter with Murakami, but it seems to me that he has a genuine gift for conjuring up that intangible, elusive something, that spark. Needless to say, I’ll definitely be coming back for more."
55,https://www.goodreads.com/user/show/6203616-praveen,Rating 4 out of 5," “According to Aristophanes in Plato's The Banquet, in the ancient world of legend there were three types of people.In ancient times people weren't simply male or female, but one of three types: male/male, male/female or female/female. In other words, each person was made out of the components of two people. Everyone was happy with this arrangement and never really gave it much thought. But then God took a knife and cut everyone in half, right down the middle. So after that the world was divided just into male and female, the upshot being that people spend their time running around trying to locate their missing half.”  -Haruki Murakami, Kafka on the ShoreMurakami recreates his spell with the above Greek myth which he already narrated in his book “Kafka on the Shore” but this time it’s with highly structured plot which goes beyond 900 pages.1Q84 is a story of two characters who are wandering around trying to locate their missing half in a parallel world with two Moons, haunted by little people, where there is an entrance but no exit until…….Murakami has blended his love for Greek Philosophy/mythology along with Russian literature in the subplots of this book where he narrates a society which is more or less equal to the classless society which Plato described in his “The Republic”, a primitive form of communism. The stuffs which I always love to read. A world with two moons.From the out shell 1Q84 is a love story woven with highly complex surreal episode driven by “Dotha and Maza”, beyond once comprehension. Like “IF you can’t understand it without an explanation, you can’t understand it with an explanation.”An ultimate Murakami effect is shown through the character of NHK Fee Collector who bangs on the doors (to explain the split of Dotha and Maza ).On the whole 1Q84 got everything which will make you engaged in the process of reading, only one drawback is the length.New Image Added on 19 Oct 2013 (Source : Haruki Murakami Stuff: A Murakami Fan Blog - Photo by Phina Ëndor Coöre) "
56,https://www.goodreads.com/user/show/3263980-adam-dalva,Rating 5 out of 5,Don't believe some of the negative reviews...this is exceptional.
57,https://www.goodreads.com/user/show/66796812-erigibbi,Rating 4 out of 5,"4.5Devo parlarvi di 1Q84 di Haruki Murakami, e il problema è che non so nemmeno da dove partire. Non perché non abbia cose da dire a riguardo, ne avrei fin troppe probabilmente, ma perché non devo svelarvi troppo. E parlarvi di un libro come 1Q84 senza dire nulla di concreto sui contenuti lo sto trovando davvero complicato.Ci troviamo a Tokyo nel 1984. I protagonisti principali sono Aomame, assassina, che con una tecnica particolare vendica le donne che hanno subito violenza; e Tengo, insegnante di matematica per tre giorni alla settimana, nei restanti quattro è uno scrittore.Entrambi si ritroveranno in una Tokyo uguale e diversa al tempo stesso. In cielo ci sono due lune, quella che conosciamo e una più piccola, deforme e verde che si trova accanto all’altra, ma non tutti se ne accorgono. Aomame chiama quel mondo “1Q84” (la q sta per question mark, il punto interrogativo) e Tengo lo chiama “la città dei gatti”. Nomi diversi per indicare la stessa cosa.«Che mi piaccia o no, adesso mi trovo in questo anno 1Q84. Il 1984 che conoscevo non esiste più da nessuna parte. Ora è l’anno 1Q84. L’aria è cambiata, il paesaggio è cambiato. Devo adattarmi il più in fretta possibile a questo mondo con punto interrogativo. Come un animale che è stato trasportato in una nuova foresta, che per proteggersi e sopravvivere deve capire il più presto possibile le regole del luogo, e adattarvisi.»Penso di avervi detto un decimo di quello che c’è da dire su quest’opera, e forse vi ho comunque detto tanto.Non ho letto molti libri di Murakami, eppure qualcosa mi dice che 1Q84 è L’opera. È un libro mastodontico, non tanto per le pagine, che sono poco più di 1100 (e che ok, non sono poche), ma per tutti i contenuti e tutti i legami che si sviluppano nel corso delle pagine.Sono persino andata ad indagare il simbolismo giapponese. Nel romanzo assume importanza fin dall’inizio una crisalide d’aria. Si parla di crisalide quando ci riferiamo alle farfalle. In Giappone la farfalla è ritenuta il simbolo di nascente bellezza e grazia della donna. Se avete letto il libro, capite quanto senso assume questa visione? E se non lo avete letto, be’, tenetevi a mente questa cosa. Ho indagato per bene questa cosa della farfalla, perché ci sono diversi significati a seconda dei movimenti, o del colore. Per esempio, due farfalle che danzano nell’aria indicano felicità coniugale. Due farfalle bianche che si allontanano indicano le anime di due amanti suicidi. Seguire una farfalla indica la soluzione di un problema o aiuta a svelare un mistero. Tutte cose che in un modo o nell’altro sembrano legate a 1Q84 di Murakami.Ci sono così tante cose di cui vorrei parlarvi: l’esattore della NHK, una preghiera, la Sinfonietta di Janáček, la Società dei Testimoni, i Little People, 1984 di George Orwell, una persona strangolata, Fukaeri, mother e daughter, La crisalide d’aria. Sono tutti legami, persone, situazioni, cose che ritornano, che si ripetono, in una storia o nell’altra, in un mondo o nell’altro.Si legge un capitolo di Aomame e si esclama: “Oddio, è la stessa cosa che è successa in un capitolo di Tengo”. Si legge un capitolo di Tengo e si esclama: “Oddio, è la stessa cosa che è successa in un capitolo di Aomame”. Si legge un capitolo di Aomame e un capitolo di Tengo e si esclama: “Oddio, è la stessa cosa che Tengo ha riscritto nel romanzo La crisalide d’aria”.1Q84 è un trip mentale assurdo. Pensate anche solo all’idea di creare un mondo alternativo, ma parallelo, uguale al nostro mondo, che differisce solo per piccoli dettagli. Le persone che ci vivono però sono le stesse e i rapporti che noi abbiamo con quelle persone sono gli stessi che avevamo nel mondo normale. Solo le persone che si accorgono di essere in un mondo diverso, alternativo, dove in cielo ci sono due lune anziché una, sono uniti da un legame speciale, unico se vogliamo, e diventano davvero protagonisti, personaggi attivi, che modificano il corso della storia. Geniale, semplice e assurdo allo stesso tempo.«Questo non è uno spettacolo da quattro soldi. Il 1Q84 è un mondo reale, dove se ci si taglia esce sangue vero. Il dolore è sempre dolore e la paura è sempre paura. La luna sospesa in cielo non è di cartapesta. È una luna vera. Anzi, una coppia di lune vere. In questo mondo io ho accettato volentieri di sacrificare la mia vita per Tengo, e non permetterò a nessuno di dire che la mia scelta è un falso.»Pensate anche solo a due bambini che non si sono praticamente mai parlati, ma che si sono stretti la mano. Quella stretta di mano, quel ricordo è l’unica cosa vera e di sostanza che rimarrà ai due, anche una volta diventati adulti, anche dopo vent’anni. Quel tenersi per mano ha cambiato e cambierà le loro vite, per sempre.E il bello è che in più di 1000 pagine di libro Murakami non spiega nemmeno tutto. Alla fine ci resteranno dei dubbi e delle domande. La cosa sorprendente è che questo non sapere mi infastidisce, e allo stesso tempo mi va bene. Le cose che noi lettori non sappiamo, sono le stesse cose che Tengo e Aomame non sanno e che non riusciranno probabilmente mai a sapere. E se non le sanno loro, perché dobbiamo pretendere di saperle noi? E aggiungiamoci che stiamo parlando di Murakami. Come dicevo all’inizio, non ho (per il momento) letto molti libri suoi, ma quei pochi che ho letto hanno un finale aperto o perlomeno qualcosa di lasciato in sospeso quindi non mi stupisce se 1Q84 mi ha lasciato con dubbi e incertezze. E forse va bene così.1Q84 non è un romanzo facile. Ci sono anche dei punti piuttosto lenti (e questo è l’unico motivo per cui non do il massimo dei voti a quest’opera). Ma è un romanzo assurdo, e nella sua assurdità è un romanzo che al momento mi sento di definire unico nel suo genere, almeno per quella che è la mia esperienza da lettrice. È un viaggio, un viaggio all’insegna dell’onirico, un viaggio dove un poco alla volta, pagina dopo pagina, si scoprono cose, legami, associazioni. Un trip mentale che farete senza il bisogno di assumere sostanze deleterie, vi basterà leggere una riga dopo l’altra.Le parole pronunciate. Le sensazioni che non diventano parole. Le promesse dimenticate. Le speranze non realizzate. Le aspirazioni andate smarrite."
58,https://www.goodreads.com/user/show/2908629-ellie,Rating 5 out of 5,"1Q84 by Haruki Murakami is wonderful, familiar Murakami-land... taken to new levels. The story, the characters, the themes, everything both separately and taken together is incredibly satisfying. There are cults, children, and a permeable boundary between ""reality"" and the supernatural. There is everything Murakami fans expect and want from their Murakami-plus. The love story is touching, the characters more than usually well-drawn, and the plot/s interesting. It drags a bit occasionally in the mid-points but on the whole, considering how huge the book is, it reads quickly.I'm not impartial, though: I love Murakami generally and this one in particular."
