,user_links,user_ratings,review_text
134,https://www.goodreads.com/user/show/83144-el,Rating 3 out of 5,"There have been a few conversations that occurred in my home while I was finishing this book today. They all involved my boyfriend trying to talk and me yelling ""BITCH, C'MON!"" To break up some of the monotony of this, occasionally I'd give him a rundown on where I was in the reading process. ""C'mon, 100 more pages!"" ""Babe, just 45 more pages...""What's funny is to look at what I just wrote makes it sound like I was really involved in this book and he was distracting me from a really awesome story and I was gonna cut him. In reality, while it was a fine book, the majority of my ire directed at him and his mouth was that a) this book is due at the library tomorrow and I refuse to extend this check-out and b) I just wanted to finish the fucking book. Sweetie-baby, I promise I will rub your feet when I'm done, just please let me finish this book before my fucking head explodes. Head-explosion doesn't help anyone.I turned into a dude watching a football game while reading this book. ""You can talk all you want if you just let me finish this, I'm almost done, hold on, don't fall apart yet..."" Total role reversal in this joint tonight.So. The thing is that I don't really like Murakami all that much. I've read him, and I continue to read him, but when I'm done I wonder why I took the time. It's not that it's all shit-poor, but there's always something lacking. This is a really long book, over 900 pages, and while normally that gives me a reason to get out of bed in the morning, these 900+ pages were sort of... unnecessary. It's filled with a lot of repetitious details, boring sequences that don't move the plot along, and it's like Murakami was trying to pull a David Lynch with this one. And, c'mon, let's be honest. No one can be David Lynch but David Lynch.It's a crazy story, and it's really no bad, but (like my reviews, ahem) it went on entirely too long. Except, unlike my reviews, Murakami gets paid the big bucks and there's no excuse for it.I'm sure someone is going to try to make a movie of this at some point and I'll totally see it. It'll be totally Hollywoodized and it'll be like, I dunno, Jesse Eisenberg and Amanda Bynes and I'll hate it. But if it's done right it could be pretty decent.Whatever, I'm just happy to be done."
135,https://www.goodreads.com/user/show/2352900-elaine,Rating 5 out of 5,"As with so many of the things the characters in 1Q84 do, I'm giving this book 5 stars based on a feeling, without being able to say why using deductive reasoning. Which is only fitting, since Murakami repeatedly shows us the limits of logical thought. Murakami creates a world, or two, or three, that I thoroughly enjoyed spending slightly over two weeks in. I always wanted to pick up the Kindle and spend more time in the quirky (even if often repetitive and often slow yet other times thrilling) minds of Tengo and Aomame. The entire experience reminded me quite a bit of Infinite Jest, although Murakami is less dazzingly cerebral and more interested in the human heart. But there are similarly a million mysterious allusions, doublings, echos, and also similarly, a million loose ends that are not ""solved"" at the book's conclusion, although in both cases I never stopped hoping (deductive reasoner that I am) that they would be. Nonetheless, Tengo and Aomame are almost uniquely likeable in recent fiction I've read. Both are quirky, damaged, and questing -- but somehow both totally win our sympathy and affection, so that you keep going even when the trappings don't quite synch up. Oddly, despite all the self-referential stuff on writing and the intertextual shout outs to Proust, Chekhov, etc., what this book is most is an utterly surreal but warm and compelling love story.  My first Murakami -- but now that I'm no longer intimidated, there will be more."
136,https://www.goodreads.com/user/show/37081848-carme,Rating 4 out of 5," Yo sólo me pregunto... ¿por qué? ¿Por qué tiene que ser tan injusto? Si soy sincera, 1Q84 (Libros 1 y 2), es una de esas historias que tardan en arrancar. Las casi primeras 200 páginas pueden hacerse un poco cuesta arriba, más que nada porque no acaba de orientarse el rumbo que debe seguir la historia - o sí lo hace, pero de forma tan vaga que ciertas explicaciones pueden hacerse pesadas -. El tema está en que, cuando arranca, lo hace a lo grande. Y a mí me ha flipado. No es ningún secreto que a Murakami le gusta jugar con la realidad. Dibujarla y desdibujarla, con una lógica aplastante que hace que se acepte sin más. Podríamos compararlo, sin tener absolutamente nada que ver, con un realismo mágico de toques un poco grotescos. Pero no importa, comparaciones a parte es una historia que vale la pena. ¿Y por qué? Por sus protagonistas. Sin duda, mi favorita ha sido Aomame. Esa mujer, esa Señora - sí, con mayúsculas -, tiene una fuerza de voluntad que me ha dejado bizqueando. Es fuerte porque debe serlo, sin cuestionarse si puede o no estar a la altura. Tengo, por su parte, ha sido muy dulce. Un chico más bien metido para adentro, que vive el día a día sin prisas, hasta que un día se ve envuelto en algo bastante... turbio. No os quiero contar nada, porque ir a ciegas con esta historia es un acierto. Os pido paciencia con el principio, eso sí. Luego Murakami se encargará de que valga la pena cada página. Palabrita."
137,https://www.goodreads.com/user/show/10331984-gillian,Rating 4 out of 5,"In this parallel story of two main protagonists, who find themselves unintentionally operating in a different world with a different plot from their ""regular"" lives, the chapters from different perceptions are amazing. In other words, the reader relives the plot from different viewpoints constantly. The love story between Tengo and Aomame just provides a framework for the meticulous and detailed plot and subplots revealed through their story. One of the main themes is how we create our own future, even to the extent of the novelist ending up inside his story.As thorough as this 1157 page book was, I thought every loose end would be tied up or untied(denouement), the word the author used for his ending, but I still have some questions after reading this. Either I didn't fully understand what the author was getting at with some of the seemingly ""unnecessary"" storylines or perhaps it is one of those books, where you may be thinking about it afterwards and possibilities will then dawn on you: A many layered master-piece."
138,https://www.goodreads.com/user/show/37094857-naseeba,Rating 5 out of 5,"هاروكي موراكامي مرة اخري وكالعادة الكثير من السحر والخيال والمتعه الكتاب كبير جدا و لا اعتقد انك ستستمتع به مالم تكن معجبا كبيرا لموراكامي او علي الاقل قرأت له كثيرا وتحب اسلوبه , المهم انه ليس الكتاب المناسب للبدء مع موراكامي .ظننت قبل قرأتي لهذا الكتاب ان موراكامي لن يكتب عملا بمستوي ""كافكا علي الشاطئ"" ولكني اعتبر هذا الكتاب بنفس درجة الجودة وكما اعتدنا من موراكامي الكثير من موسيقي الجاز والبوب والقطط ولكن المختلف في هذا الكتاب انه يناقش مواضيع واقعية وحساسة مثل الاديان والتعصب الديني والخير والشر في العالم رغم وضعه شخصيات رمزية وتعمد عدم وضوحها ,هناك الكثير من الخيال والسحر والتشويق عالم له قمران زعيم غامض لطائفة دينية تمارس طقوسا غريبة وقصة حب لطيفة لا يمكنني بالتأكيد كتابة مراجعه وافية عن كتاب ضخم كهذا ولكني ارشحه لمحبي موراكامي ويمكنكم ان تتأكدو ان موراكامي لن يخذلكم .الآن بعد قراءتي ل كتاب جورج اورويل 1984 الذي كان يتنبأ فيه للمستقبل بطريقة تشأؤميه .. ويتحدث فيه عن نظام شمولي فاسد يحكم العالم ... هل كان موراكامي في هذا الكتاب يتنبأ لمستقبل قد يسيطر عليه التعصب الديني ويمثل فيه الدين نظاما شموليا اخر ؟!"
139,https://www.goodreads.com/user/show/32433113-jonathan-k-max-outlier,Rating 4 out of 5,"Marukami is one of the few authors that masterfully bridges genre. Epic in length, he combines mystery, romance, fantasy and crime while using italics to illicit the character's 'thoughts'. As the multifaceted plot unfolds, we immerse in two separate worlds of mismatched characters who over the course of the story, connect. Haruki adds a spiritual/fantasy element which deepens the reader engagement while illuminating character's desires. I don't believe I've ever encountered a story quite like this one, though I'll admit I was disappointed by the ending. Regardless its pacing, genre blending and and prose are unique to the author making for a highly recommended book. "
140,https://www.goodreads.com/user/show/4609183-brian-yatman,Rating 2 out of 5,"I love Murakami, but I really struggled with this one. Perhaps I'll give it another go sometime."
141,https://www.goodreads.com/user/show/64072698-maria-ionela-dan,Rating 5 out of 5,"Magnifica!!! Pe parcurs ce intri in poveste devine tot mai complexă. Avem dragoste, meditație asupra existenței libertății și a violenței...avem lumea fantastica și cea reală care par să fie tot mai neclare de la un punct. Avem și personaje de care sa ne atașăm.. cu alte cuvinte, avem o cartegeniala!!! Murakami e genul de scriitori de care te îndrăgostești iremediabil!!!!🥰💖🌟🌟🌟🌟🌟 O recomand din suflet!!"
142,https://www.goodreads.com/user/show/96166320-iva-magunska,Rating 5 out of 5,ГЕНИЙ НА ЧОВЕШКАТА ДУША! Други думи са излишни за това огромно нещо от около 1000 страници...❤️❤️❤️
143,https://www.goodreads.com/user/show/67951314-phrodrick,Rating 5 out of 5,"In 1Q84, Haruki Murakami has proved that a modern writer can tell a story with the best of any era or culture. Heaping superlatives on this book may make me sound like a shill. Too bad. Murakami has written the best fiction I have read in years.Within the first few chapters, the reader has enough information to know much about the plot and can make a fair guess how it will end. The only thing to keep the reader's attention is the author's craft. The details are all that matters for the 1157 pages in this edition.In the first chapter, it is Spring of 1984. We are introduced to Aomame our female protagonist. She will fall down a rabbit hole, technically climb down into it, and emerge in in what she will come to call 1Q84. In case you think this will be a children's story, she will have a mildly erotic memory as she descends. We have already been warned that ""not everything is as it seems."" Aomame is not as she seems.In the next chapter we will meet the male protagonist, Tengo. He is very much who he seems. However it will be his task to secretly ghost write a book. That is he will produce a major plot device that is not all that it seems.The structure of 1Q84 is alternating chapters about these two people. We will quickly learn of the long ago connection between them. Given this structure and this information it does not take a very alert reader to understand that these two will find each other. By chapter four we know the outcome and have ample information to guess at the broad outline of the plot. The only question is: can the writing keep us involved?Early in the book and continuing throughout we will be fed global cultural references. The most common being:American jazz and blue jeansEastern European Classical musicCentral European Philosophy and psychologyOne German made pistolFrench and British literatureLiquor and tobacco from several non-Japanese originsThe heart of the story is Japanese. The story-line is based in magical reality. We are asked to consider forces beyond good and evil. There are spirits, portents and ghosts. Among these forces it is never clear who is good or bad. The ultimate power seems to reside in maintaining balance. Even this word is left ambiguous. Forces are in opposition, but too much power on the one side causes something to happen that empowers the other. Over all this love is triumphant and we are reminded that there is a God.All of these themes are consistent with Japanese story telling. I have seen these same vague spirits in early Japanese movies and in modern Japanese Anime.Ultimately what sets 1Q84 above the various traditions and the predictable ending are the skills of the story teller. Murakami style is deceptively simple. Where you are given facts, they are rarely embellished or intricate. If you are not to be given facts, it is made clear that you are not intended to have an explanation. Some things are never fully explained. Pay attention. Characters will usually tell you pages in advance, what new disclosure is coming or what will never be explained.Murakami is also a master of pacing. Much of the early chapters are introductory, events proceed slowly. The middle third will see an increase in the action and increased tensions. The ending will occasionally lag then leap forward. All of this is deliberate. All of this is applied story telling.1Q84 can be read in relatively short bursts. There may be readers who could not put it down. I was not one. But, when I was not reading it, I was thinking about it. As certain as I was of the outcome I was worried about both the main characters and many of the second and third tier characters. Most of these characters at some point will engage your sympathies. No one is entirely good or evil.One can argue that great writers like Tolstoy wrote long novels, but they also handled large issues: war, crime, politics, and the depths of the human soul. 1Q84 is mostly about its characters. The major themes include the power of love and of believing. The discussion of being beyond good and evil will be the starting point for many advanced academic papers. What I most enjoyed, what I most happily road in was the craft of Haruki Murakami"
144,https://www.goodreads.com/user/show/58035793-hiba,Rating 3 out of 5,"[2.5*]I have just finished the book and didn't want to let it sit with me before talking about it, and I'm not sure that's a good idea or not. Murakami was never a favorite author of mine, I never felt particularly drawn to his writing, and I can even say I feel somewhat repulsed by his ""style."" Nonetheless, when I saw a thousand pages beauty, I couldn't stop myself; thanks to my best friend, I got ahold of the book, and it was all I could do to hold myself from diving right through into it. But enough about me, a subjective review is in order.I will first start with book 1; it was a sort of introduction to the story, separated bits here and there. The first thing I noticed was how fast-paced the book is, albeit long. I did enjoy myself, but some particularities put me off. Murakami might not be misogynistic, and he probably only wanted to portray a 1984ish world faithfully. Still, I couldn't shake off the feeling of uncomfortableness some comments and passages generated in me. Similarly, there is also the issue of sexualizing women, which is something I have noticed in many Japanese writings (including manga). Here, the same thing was present plus sexualizing a 17yo. Call me oversensitive, but that's just how I see things. Coming to book 2, I began loosening up a bit and trying to enjoy the flow of the story more. I also came to the realization and acceptance of the fact that I would never, no matter how hard I try, fully grasp Murakami's books. When I accepted that, I came through this line that sums it perfectly: ""If you can't understand it without an explanation, you can't understand it with an explanation."" Once I resigned myself to this realization, I felt that I enjoyed this part of the story better. Perhaps it was because of the action going on, I'm not sure. Nonetheless (you knew this was coming) there were again elements that shouldn't have been there—for instance, presenting paedophilia and underage sex as some event drawing from fantasy, magical realism, and otherworldly stuff. Of course, these events weren't meant as underage sex, etc., but that's what they are. I would have preferred the author had chosen something else to represent these fabulous and unusual occurrences. Still, I didn't feel the magical element of the book; I didn't feel the spark (I know I'm being extra cliché today, but bear with me), I read on and on, not feeling anything.Book 3 was a nightmare; I started noticing recurrences in Murakami's style, how repetitive he is. Of course, when you're writing something this long, you probably should make sure your readers are still following the line of events, but Murakami did it overtly (so much for being subtle).The elements that were always there in writing were mainly comparisons and figures of speech. I don't mind comparing things to other things to make the description more vivid, but you can't keep throwing them all over the place, even to describe the making of a cup of coffee in the morning. The ending, however, was spectacular, I give Murakami that. It was heartwarming, and I even teared up a bit (blame the hopeless romantic in me).Overall, the book isn't spectacular; there are some quotable passages, some aesthetic elements, things that made me carry on reading day after day. It was fast-paced, so I didn't have to struggle through it for a month or so, but that was it. 1Q84 is not a book that would stay with me or one that I would recommend. It came into my life and didn't displace anything or put anything out of order; it left me exactly as it has found me.With this declare my rupture with Murakami, this was the last thread connecting me to his world, and I have put up so many hopes on it that it fell apart and disconnected me from wherever it is Murakami lives."
145,https://www.goodreads.com/user/show/2187043-mike-the-paladin,Rating 4 out of 5,"The synopsis of this book tells us of people who find themselves in a world that is similar to but different from the ""real world"" of 1984. There is the obvious suggestion here from the title and year mentioned but don't let that mislead you. While there are a few undercurrents that might refer peripherally to ideas from Orwell's work the book is not dealing with the same type story.The only way I can describe this book is ""odd"" or ""different"". I suspect it will appeal greatly to some readers (and I can see why as the writing even in translation is often beautiful). Others will probably be totally put off by it. Could I give a 3.5 here I would. The book, it's story and the experience of reading it are good, but there are (for me) significant negatives. I'll not even try to give a synopsis here. Any including the cover blurbs would be and are imprecise and in some ways misleading. Also the book is (as I said) in some ways more of an experience than simply a read. I read other reviews and see that it took others far differently than it did me. For example one reviewer mentioned a sense of the eerie that seemed to be the major part of the book. This was not so for me.A great deal of the books atmosphere comes from the collision of the normal with the strange. For me the normality overwhelmed the strange a bit. For the protagonists the strange or eerie intrudes at different moments forcing them to confront that it's there only to leave them trying to fit back into the other normal or almost normal parts of life. These are people who get jerked into a world that is in many ways greatly different from the one they (and we) know while in other ways being indistinguishable. Be aware if it bothers you that there s a great deal of graphic sex in the book. I suspect we have a bit of cultural dissonance here. Speaking of the graphic scenes this book has more sex scenes that really aren't supposed to be about sex than any I've read. Sex and the sex act stand in for several things in the story. It works but I can see how it may bother some readers.While there are times the book seems to get very tedious and repetitive (there's one character we are told over and over is ugly. Not only that he is ugly but how he's ugly, how it has effected his life, his family's lives and so on. Thousands of words get devoted to it almost every time the character comes on the scene). Still while this is a problem it doesn't really ruin the book. I admit that by the time I got to the end I was ready for the book TO END, but still on the whole I liked it.With some reservations I recommend this. All I can say is try it for yourself and see if it's your cup of green tea. "
146,https://www.goodreads.com/user/show/36155695-yel,Rating 3 out of 5,"
 3 of 5 stars-----
I'm going to start off with the things I didn't like about this book. I am all for the writing as it was easy to read and approachable but there are some parts that didn't sit with me well. The sexual narrative was cringey. I was wincing every single time Tengo described the 'swell of the breasts' of every woman he met. The intent was nothing sexually perversive than to simply describe the woman in front of him but still! Every time he was having a 'private time' with a woman, or even in Aomame's point of view while staring at her own body, it wouldn't be complete if there's no description of the 'pubic hair'. Every. Single. Time. He even found a way to mention pubic hair by describing Ushikawa's frizzy hair. And how can I place my trust to someone who used the word 'ejaculation' to describe the sexual release in every sexual encounter in the whole book, like dude you can describe it in different ways. And the word 'pumping'?! What the hell? His sexual narrative was unpleasant it weirded me out. I don't know if it was really Murakami's technique or it was just influenced by the translator but either way, it was kind of ridiculous. This book was also so unnecessary lengthy. Maybe the story was served best in a long book. I would definitely understand if it was 600 page long but more than a thousand page? I don't think it needed to be that long. And the problem alongside that was the fact that it was that long yet there are still a lot of things left unanswered. What happened to the other characters that were left hanging like Tengo's older girlfriend, Fuka-Eri, Tsubasa, Buzzcut and Ponytail, and even the six Little People that exited Ushikawa's mouth? What the hell happened to them? This book was as vague as it was lengthy. And I was not that happy to wait basically the whole book for Tengo and Aomame to finally meet. I even started to doubt if they were really going to meet. That being said, I still didn't have the desire to cut my reading off halfway. Despite those problems, I still found myself anticipating every chapter and I really did enjoy the whole time I was reading this. I specifically didn't consider the slow progress of the story as boring because it was what I liked about it the most. I can even considered this as the slowest build up of a story I've ever read. I didn't particularly regret reading this. I just wish it provided clear explanations and answers in exchange for the time I've invested reading this. This is not a great book but it was still good overall. Though it was definitely not for every kinds of readers out there but I still recommend it for those patient enough to overlook the length."
147,https://www.goodreads.com/user/show/12831990-jason,Rating 3 out of 5,"Murakami has a way of writing ethereally lonely accounts that twist and distort reality rather than wrenching it, he is a spell caster. 1Q84 is a perfect example of this intimate look at a world that has slipped, though perhaps this one slips a little further towards fantasy than his typical writing. We have 'little people', cocoons or 'chrysalises', a small green moon, and all kinds of other supernatural stirrings. More than anything though, I think we realize before the end that this is just a love story, a strange and meandering love story, a struggle against loneliness and hurt, and what is more normal than that?“I'm tired of living unable to love anyone. I don't have a single friend - not one. And, worst of all, I can't even love myself. Why is that? Why can't I love myself? It's because I can't love anyone else. A person learns how to love himself through the simple acts of loving and being loved by someone else. Do you understand what I am saying? A person who is incapable of loving another cannot properly love himself.”As long as this book was and as long as it took me to read it, I think I am going to keep this very short. Behind the slip from one world to another, beyond the small green moon, beneath the mysterious happenings and violence, what we have is a desperate search for human love, for The One that makes everything have meaning.“At my core, there is nothing. Neither is it parched wastelands. At my core, there is love. I'll go on loving that ten-year-old boy named Tengo forever --- his strength, his intelligence, his kindness. He does not exist here, with me, but flesh that does not exist will never die, and promises unmade are never broken.”Repetitions/Inspirations/Recommendations:- moon(s)- Janacek's Sinfonietta- Proust's In Search of Lost Time- Chekov"
